id	depth	set	subreddit_id	subreddit	permalink	link_id	parent_comment_id	created_utc	author_id	author	body	score	controversiality
40351811101	10	eli5_10-19	4697437	explainlikeimfive	https://www.reddit.com/r/explainlikeimfive/comments/wi2zgg/_/ijcfcpp/	1965289984	40350838797	2022-08-07 19:01:52	69240016	mlwspace2005	I'm not really sure what you're supposed to do with a domesticated species once it stops being useful. Exterminate them?	1	0
26655578353	10	eli5_10-19	4697437	explainlikeimfive	https://www.reddit.com/r/explainlikeimfive/comments/1a0wr9/_/c8u1jw1/	77304789	26655568966	2013-03-12 04:17:52	NA	I_AM_AT_WORK_NOW_	I'm not saying it has to be that precise.

I'm asking that because leading on from the premise of second hand smoke is a complete ban on smoking. And while I hate smoking, I will defend individuals right to smoke.

Does the average person have the same exposure and take on the same risks from second hand smoke as they do from cleaning products? If so, that's important information.  	0	0
34345329614	13	eli5_10-19	4697437	explainlikeimfive	https://www.reddit.com/r/explainlikeimfive/comments/gr1ocs/_/fs0blxq/	1012886668	34345237073	2020-05-27 19:14:26	27033628	thesilenthurricane	What? I’m considering value for money being better for a PS4 on the basis that a PC of the same value as a PS4 will give you much lower performance relative to the amount you spend. A £300 PC bought in 2013 when the PS4 released would not be able to play any game released this year on PS4 maybe minus things like base minecraft.	1	0
28964009533	11	eli5_10-19	4697437	explainlikeimfive	https://www.reddit.com/r/explainlikeimfive/comments/5he3xk/_/db0f8sd/	331542632	28963175343	2016-12-10 04:05:24	NA	perseus2510	I like how this thread went from a discussion about muscle control to humans masturbating 	1	0
36620110440	11	eli5_10-19	4697437	explainlikeimfive	https://www.reddit.com/r/explainlikeimfive/comments/mlluym/_/gtmo220/	1366547710	36620057939	2021-04-06 23:37:48	47381657	znyggisen	Transmission lines work differently as they have 3 phases that are out of sync with each other. Putting it very succinctly, they are out of phase from each other by 120 degrees, so all 3 are never positive or negative at the same time. Current from one wire will return through the other two.	1	0
42453677848	19	eli5_10-19	4697437	explainlikeimfive	https://www.reddit.com/r/explainlikeimfive/comments/131yz0y/_/ji3tnh4/	2361492178	42453610122	2023-04-28 21:19:48	385928588285	kiltedweirdo	421 of 1.4142135623730950488016887242097 is collatz conjecture's looping result.	1	0
28132605875	2	eli5_2	4697437	explainlikeimfive	https://www.reddit.com/r/explainlikeimfive/comments/3tv0cf/_/cx9fdmb/	231554175	28132593681	2015-11-22 21:57:20	NA	skipweasel	And they're probably hoping inflation will erode it to the point of being trivial.

Won't work, of course, but they may not think that.	1	0
29293886394	2	eli5_2	4697437	explainlikeimfive	https://www.reddit.com/r/explainlikeimfive/comments/6686cq/_/dggtnei/	373256234	29293441220	2017-04-19 13:43:29	NA	cutebirdbutts	This answer seems much more likely than that essay that talked about democrats and the KKK and political memes	5	0
26300135614	2	eli5_2	4697437	explainlikeimfive	https://www.reddit.com/r/explainlikeimfive/comments/m67ah/_/c2yf6im/	37240937	26300133915	2011-11-09 16:30:24	NA	[deleted]	[deleted]	1	0
26839826092	2	eli5_2	4697437	explainlikeimfive	https://www.reddit.com/r/explainlikeimfive/comments/1l3y7s/_/cbvqmcs/	95922424	26839765978	2013-08-26 18:18:22	NA	[deleted]	Wrong; common worker ownership is expressed through the government.  While you're right that it is not a necessary condition that there be a government, there is no effective difference if a group of people take your property by force or if the entity labeled ""the government"" does it.  

There can be a government-free socialism, but there exists no difference.  A governing body can be a body other than the government. 	-7	0
28634225080	2	eli5_2	4697437	explainlikeimfive	https://www.reddit.com/r/explainlikeimfive/comments/4tspoq/_/d5k2th4/	291913226	28634036135	2016-07-20 20:59:36	NA	Jesseroberto1894	wow thank you so much this was honestly super helpful!!!!	2	0
26530608308	2	eli5_2	4697437	explainlikeimfive	https://www.reddit.com/r/explainlikeimfive/comments/122j22/_/c6rn0dw/	63943418	26530561372	2012-10-25 17:39:52	NA	Happily_Frustrated	Thank you, precisely the answer I was looking for. 	1	0
34706751344	3	eli5_3	4697437	explainlikeimfive	https://www.reddit.com/r/explainlikeimfive/comments/hqqmwi/_/fxzi4q8/	1072837746	34706727510	2020-07-14 00:09:53	43264415	khanv1ct	It has to do with the way the kinetic energy is dispersed to all those grains of sand. It works the same way with a large body of water(Google Mythbusters firing guns into pool).	2	0
29808893685	3	eli5_3	4697437	explainlikeimfive	https://www.reddit.com/r/explainlikeimfive/comments/790ya0/_/dozg1kl/	438424200	29807518128	2017-10-27 21:23:09	NA	verpine	Damn I had that laptop for over a year and it was one of the best I've ever owned. No problems whatsoever.	1	0
29055577730	3	eli5_3	4697437	explainlikeimfive	https://www.reddit.com/r/explainlikeimfive/comments/5of00b/_/dcixv9e/	343341515	29055394532	2017-01-17 03:07:13	NA	philmarcracken	The naysayers never think about that side, they believe their tax money is getting hoarded somehow, and these poor people have no need of shelter or to eat. The phrasing is like 'sit on your ass all day and get paid, i dont think so buddy.'

Meanwhile the machine that just replaced them is paying no tax.	3	0
40000848881	3	eli5_3	4697437	explainlikeimfive	https://www.reddit.com/r/explainlikeimfive/comments/vjclry/_/idjh0j5/	1906952254	39999556596	2022-06-24 09:53:56	62436202	DulceEtBanana	I once was in a hurry and opened the men's door at work a little  too hard.  The guy behind it, who happened to be leaving at that moment, ended up with a bloody nose.	4	0
28010963502	3	eli5_3	4697437	explainlikeimfive	https://www.reddit.com/r/explainlikeimfive/comments/3lsff0/_/cv905ri/	217996812	28010898873	2015-09-21 14:10:42	NA	awksomepenguin	The alternative is to let people who want to kill us kill us.	0	0
27504942671	3	eli5_3	4697437	explainlikeimfive	https://www.reddit.com/r/explainlikeimfive/comments/2pd4uz/_/cmvqdlb/	163535579	27504917130	2014-12-15 18:59:31	NA	jcla	I'm saying that probiotic foods have no demonstrated health effects.  There are very limited studies that show that specific strains of some bacteria can have a limited effect in very specific situations, but that isn't what is being sold here.

http://www.ncbi.nlm.nih.gov/pmc/articles/PMC3056112/
http://blogs.scientificamerican.com/food-matters/2014/04/29/are-probiotics-helping-you/

It is all advertising and marketing, designed to get you to either pay more for a food or choose a specific brand, which is why the commercials don't make any specific health claims.

Here is the ""Health Effects"" section of the article on the probiotic used in Danone products: http://en.wikipedia.org/wiki/Bifidobacterium_animalis#Health_effects

Take a minute to read that...no, wait, it is empty.	1	0
40830389800	6	eli5_4-9	4697437	explainlikeimfive	https://www.reddit.com/r/explainlikeimfive/comments/xwj6pg/_/ir9cyeg/	2050026676	40830162406	2022-10-06 09:05:54	21418352	peptide2	😳	35	0
27215444173	7	eli5_4-9	4697437	explainlikeimfive	https://www.reddit.com/r/explainlikeimfive/comments/27p1t3/_/ci3df4d/	133858407	27215422802	2014-06-09 22:42:42	NA	LionessFeathers	That would be because the majority of ""sex ed"" is teaching abstinence only education, pushed by the conservative religious right and the Republican Party. Places like the conservative bastion of Oklahoma have the [fourth highest teen pregnancy rate](http://www.addictinginfo.org/2013/09/04/oklahoma-school-district-ditches-abstinence-only-program/) in the country and have not even been covering things like STD transmission. 

These flawed lessons are being taught because of the stigma attached to sex by the religious segment of the populous. We cannot properly educate people on responsible sex when we are still shaming people for it and denying sexuality as a whole.	3	0
30986159915	5	eli5_4-9	4697437	explainlikeimfive	https://www.reddit.com/r/explainlikeimfive/comments/9rdi3b/_/e8gcy0b/	590175191	30986137470	2018-10-25 22:29:49	17594008	RiPont	Good point.	2	0
28030125668	6	eli5_4-9	4697437	explainlikeimfive	https://www.reddit.com/r/explainlikeimfive/comments/3mzyn3/_/cvkevdw/	220027935	28029783839	2015-10-01 12:41:37	NA	beznogim	It has balls, a whole grid array of them!	1	0
30861417563	7	eli5_4-9	4697437	explainlikeimfive	https://www.reddit.com/r/explainlikeimfive/comments/9hhgbx/_/e6e3a6z/	573563373	30859786373	2018-09-21 17:41:54	63525144	Ransidcheese	I wasn't trying to be mean, I just didn't know if I was missing something. It's all good.	1	0
26470431076	7	eli5_4-9	4697437	explainlikeimfive	https://www.reddit.com/r/explainlikeimfive/comments/y1s1f/_/c5rt7c4/	57189939	26470427513	2012-08-12 03:37:39	NA	nonubiq	Well, we are in /r/explainlikeimfive, which may be why. I was surprised too. I thought I might get downvoted, but I was pleasantly surprised.	1	0
