id,depth,set,subreddit_id,subreddit,permalink,link_id,parent_comment_id,created_utc,author_id,author,body,score,controversiality
40603331707,11,aita_10-19,4922054,AmItheAsshole,https://www.reddit.com/r/AmItheAsshole/comments/x7svll/_/ini6b97/,2008488441,40602485087,2022-09-07 21:15:52,787041369128,Sea-Ad9057,"If her parents don't trust her then they clearly don't trust on how they raised their kids either..... she has proven to be  responsible .... and no one can really get a first home without help from their family ...
 Big vulture funds are buying up properties and pricing people out of the market.... today's world is a very different one to the world her parents grew up in",1,0
33580993607,16,aita_10-19,4922054,AmItheAsshole,https://www.reddit.com/r/AmItheAsshole/comments/esvjtk/_/ffd98hz/,895027736,33580987960,2020-01-23 21:45:06,431735170981,throwaway88352521,No. I didn't knoe that bday sex was a thing and that's it. I know that I was an accident because I have no siblings and my parents weren't even married then.,3,0
40128545495,12,aita_10-19,4922054,AmItheAsshole,https://www.reddit.com/r/AmItheAsshole/comments/vvxctg/_/ifnhzvb/,1928075812,40128535802,2022-07-10 22:46:01,664042837706,flyingfoxtrot_,"Considering we're a family who shows love by gently bullying each other (in jest, no actual malice), it's all very unusually wholesome lmao",54,0
42391919541,12,aita_10-19,4922054,AmItheAsshole,https://www.reddit.com/r/AmItheAsshole/comments/12tfszz/_/jh31ygl/,2347160975,42391869082,2023-04-21 00:26:55,NA,[deleted],[deleted],-2,0
33523378820,14,aita_10-19,4922054,AmItheAsshole,https://www.reddit.com/r/AmItheAsshole/comments/eol4yx/_/feeycn8/,887823465,33523345096,2020-01-14 23:18:31,293934784747,bossyjudge,"Going shopping with her to choose the ring she would like, is showing that what she wants is important. Giving her a piece of heirloom jewelry from his family is showing her she’s important. That’s saying he wants her to be a part of his family. It also shows trust because he is giving something that is part of his history and he is entrusting her with it. 

She doesn’t have to explain anything, she doesn’t have to tell anyone she’s engaged until she gets the ring they shop together for. She can simply say they are going to go pick out rings next weekend.",0,0
44020470137,10,aita_10-19,4922054,AmItheAsshole,https://www.reddit.com/r/AmItheAsshole/comments/17oh2ec/_/k80ng55/,2641152612,44020424778,2023-11-06 02:22:27,774171720720,martyqscriblerus,"So's the US, you're just too used to hearing about schoolchildren murdered with AR-15s to send more than thoughts and prayers to them lol",23,0
42952604830,2,aita_2,4922054,AmItheAsshole,https://www.reddit.com/r/AmItheAsshole/comments/14odsrk/_/jqcvdzy/,2459601632,42952010380,2023-07-02 07:44:33,580343904313,Jessika1111,No one will be having sex with this person hahaha,1,0
34860488778,2,aita_2,4922054,AmItheAsshole,https://www.reddit.com/r/AmItheAsshole/comments/i4e2e8/_/g0j19ai/,1095765920,34858288000,2020-08-06 05:04:33,NA,[deleted],"They will just point out all the bullshit they had to pay to get the youngest on the straight and narrow.

He should have claimed it was a finder's fee. Hell, even lie and say he was on the hook for $2k if it went south. That's a white lie that keeps the peace.

I mean I'm not a dad, but it also takes me like two seconds to see this shit coming and how easy it was to prevent it andI would think as a parent spending more time around people who act on baser emotions rather than adult logic would have a better chance of seeing what was obviously coming, but i guess not.

OP isn't an asshole, obviously, he just has a debilitating lack of EQ.",2,0
41302204163,2,aita_2,4922054,AmItheAsshole,https://www.reddit.com/r/AmItheAsshole/comments/zditz4/_/iz29koz/,2139029824,41301324812,2022-12-05 22:54:33,NA,[deleted],[removed],1,0
43063718027,2,aita_2,4922054,AmItheAsshole,https://www.reddit.com/r/AmItheAsshole/comments/1515bcr/_/js70xhn/,2481040827,43063518717,2023-07-16 14:40:54,27403132376096,Same-Reality8321,He probably meant her kitchen ( ewww🤢),1,0
36403491672,2,aita_2,4922054,AmItheAsshole,https://www.reddit.com/r/AmItheAsshole/comments/lzetye/_/gq1p5y0/,1329268262,36403483256,2021-03-07 00:19:48,842465305757,offendedthrowRA,That’s quite alright. There’s a reason I asked here before I did anything! I accept judgments.,3,0
42754393714,2,aita_2,4922054,AmItheAsshole,https://www.reddit.com/r/AmItheAsshole/comments/1422vvb/_/jn2v1bm/,2422140887,42754391267,2023-06-06 04:02:13,1675411418665,Free-Replacement-166,What?,1,0
41484985008,3,aita_3,4922054,AmItheAsshole,https://www.reddit.com/r/AmItheAsshole/comments/zx65k0/_/j2337ao/,2172030624,41479519121,2022-12-29 08:06:56,59681286,I-lack-conviction,It feels real good when you get the go ahead to push that button,2,0
31896226328,3,aita_3,4922054,AmItheAsshole,https://www.reddit.com/r/AmItheAsshole/comments/bon53p/_/eni6tqw/,706518421,31896211487,2019-05-14 19:25:18,248144115695,sevenliveslater,That doesn’t justify using telling his mom as leverage. And it could not only hurt the mother but the exes relationship with the mom.,-10,0
42669858987,3,aita_3,4922054,AmItheAsshole,https://www.reddit.com/r/AmItheAsshole/comments/13rq8jw/_/jloj5wr/,2404754636,42665101171,2023-05-26 10:14:55,638242592358,MissK2421,"Bruh. I come from a family who naturally speak loudly, and sometimes we might not realise, but I'd be mortified if I woke up napping kids. You are absolutely NTA.",1,0
40090218032,3,aita_3,4922054,AmItheAsshole,https://www.reddit.com/r/AmItheAsshole/comments/vs8lvw/_/if0oi7k/,1921882316,40089882407,2022-07-06 01:19:31,1684349637337,Maleficent_Wash_934,"I said it's fine if they wanted to leave, it was the dramatics that were unnecessary.",-1,1
35225629029,3,aita_3,4922054,AmItheAsshole,https://www.reddit.com/r/AmItheAsshole/comments/izpklm/_/g6kfhb9/,1148370826,35225496610,2020-09-25 19:54:19,491596879079,Kreeblim,For real everyone in this story suckkks,7,0
43735724258,3,aita_3,4922054,AmItheAsshole,https://www.reddit.com/r/AmItheAsshole/comments/16y9j2e/_/k3b4cte/,2597130950,43729279599,2023-10-03 17:17:21,1126003198814,Fit_Organization4552,"Exactly this. My four year old has just helped me pick out presents for 2 of her friends and expressed an interest in using each of them 'first'. Quick reminder that these were for 'X' and 'Y', never mentioned again. She's even helped me wrap them and is excited to give them away. Both are things she's put on her Christmas list. If a 4 year old can get it and a 9 year old can't, then those parents need to develop a spine. NTA",1,0
35081699876,4,aita_4-9,4922054,AmItheAsshole,https://www.reddit.com/r/AmItheAsshole/comments/in9r52/_/g46qkv8/,1127477414,35081686999,2020-09-06 00:47:58,387082647892,walkingisnice,Yess! My thoughts exactly,2,0
35834333673,4,aita_4-9,4922054,AmItheAsshole,https://www.reddit.com/r/AmItheAsshole/comments/khiwbr/_/ggmu4tl/,1238758695,35832871048,2020-12-21 22:59:54,18338360,sezit,"I had a friend in High School who - after i had made a critical remark about a mutual acquaintance - asked me sadly: ""Is that how you talk about me when I'm not here?"" 

OMG. I died of shame. I am so indebted to him for saying that to me, not criticizing me so much as expressing deep disappointment in my thoughtless cruelty. It changed me on the spot.",36,0
31848130155,6,aita_4-9,4922054,AmItheAsshole,https://www.reddit.com/r/AmItheAsshole/comments/blich3/_/empjyi3/,701255847,31848124146,2019-05-07 04:22:22,25431814,curiiouscat,Is it a surprise that there are exceptions to every rule?,143,0
37525719336,5,aita_4-9,4922054,AmItheAsshole,https://www.reddit.com/r/AmItheAsshole/comments/p2jo7z/_/h8lueco/,1515931487,37525578250,2021-08-12 01:06:01,21428806641,throwinitback,"Even as a seasoned traveller, I'd give myself enough time to navigate whilst transitting in a new travel hub, which increases travel time. 

OP is making it out that it's a 2 hour easy train journey. I know London really well, I reckon I could maybe make the journey in 3 hours if all factors were perfect. But I know these stations/exits/entrances and would run for the connection. I'd hate to have to do that with luggage after a long flight too. Giving yourself a comfortable buffer will make it more like 3.5 hours via trains. 

In fairness, the GF really should have got a connecting flight to further up north in the UK. Best case scenario, she's saving £20 for a further 3.5 hours of travel if she pre-books a cheap train fare and researches the route ahead of time.",79,0
39301095413,4,aita_4-9,4922054,AmItheAsshole,https://www.reddit.com/r/AmItheAsshole/comments/tmgjt9/_/i1yuvat/,1791242829,39300962010,2022-03-24 19:11:29,625514678874,seitan_bandit,... My guess is child support.,18,0
42975338964,5,aita_4-9,4922054,AmItheAsshole,https://www.reddit.com/r/AmItheAsshole/comments/14qn5ia/_/jqqenro/,2463397282,42972162792,2023-07-05 08:16:44,894241672939,Great_Clue_7064,I think that was pretty clear.,1,0
