id,depth,set,subreddit_id,subreddit,permalink,link_id,parent_comment_id,created_utc,author_id,author,body,score,controversiality
28040189299,11,eli5_10-19,4697437,explainlikeimfive,https://www.reddit.com/r/explainlikeimfive/comments/3noyd3/_/cvqekj7/,221193975,28039721809,2015-10-06 19:05:20,NA,Mack99,/r/OtherTimesItsTH5  It's a thing now...,1,0
31114158011,13,eli5_10-19,4697437,explainlikeimfive,https://www.reddit.com/r/explainlikeimfive/comments/a0qiuc/_/eakkdyz/,605899236,31114130215,2018-11-27 14:26:22,27264825,divinelyshpongled,You like totally and literally should be ,-1,0
40526239089,14,eli5_10-19,4697437,explainlikeimfive,https://www.reddit.com/r/explainlikeimfive/comments/x00c0c/_/im89y7l/,1995399372,40526232095,2022-08-29 07:27:22,61979707,Goseki1,&gt;!Oh fuck I hadn't realised he'd topped himself after waking up. I'll need to give the wiki a good read or just watch it I reckon!!&lt;,2,0
27723957294,14,eli5_10-19,4697437,explainlikeimfive,https://www.reddit.com/r/explainlikeimfive/comments/325k5h/_/cqi4mcu/,185017157,27723860255,2015-04-20 03:09:11,NA,[deleted],[deleted],1,0
43675565998,13,eli5_10-19,4697437,explainlikeimfive,https://www.reddit.com/r/explainlikeimfive/comments/16sntc2/_/k2bayem/,2587719746,43675454286,2023-09-26 17:50:36,23517184,deja-roo,"> Are you ignoring the months of Musk's very public attempts to get out of the purchase? 

No, I'm not ignoring it, I'm **directly addressing it**. 

https://www.google.com/finance/quote/QQQ:NASDAQ?sa=X&ved=2ahUKEwiT_8fs6siBAxUXlWoFHYalBTgQ3ecFegQIHxAf&window=5Y

Zoom to a five year view. That local peak right after the beginning of 2022 is where he made the offer. The NASDAQ then plummeted over 20% over the next month, dragging all tech valuations down with it. Then Musk started to to try and get out of the deal. 

Both of our explanations have speculation, but mine has some evidence behind it and it correlates with how you would expect an impulsive human to behave when confronted with this scenario.",1,0
27849668554,11,eli5_10-19,4697437,explainlikeimfive,https://www.reddit.com/r/explainlikeimfive/comments/3bbnb6/_/cskz1sa/,200417730,27849448666,2015-06-28 00:24:58,NA,baconbash,So much gold...,1,0
33800314815,2,eli5_2,4697437,explainlikeimfive,https://www.reddit.com/r/explainlikeimfive/comments/famrmz/_/fizu1tr/,924851051,33799908166,2020-02-28 07:24:50,35031090068,CollectableRat,They still don’t trust computers and remote desk staff to trade that much at once?,1,0
31429724477,2,eli5_2,4697437,explainlikeimfive,https://www.reddit.com/r/explainlikeimfive/comments/andc7t/_/efsg2m5/,643915289,31429718150,2019-02-05 11:53:38,216099160690,hayleypayley55,And if you can’t pay it they send a debt recovery company after you? ,2,0
28085298292,2,eli5_2,4697437,explainlikeimfive,https://www.reddit.com/r/explainlikeimfive/comments/3qllkg/_/cwh9eus/,226076272,28083562821,2015-10-29 16:00:31,NA,zeradragon,except it is 683 not 685 =p,2,0
27756347129,2,eli5_2,4697437,explainlikeimfive,https://www.reddit.com/r/explainlikeimfive/comments/35312t/_/cr1euih/,189937973,27755383927,2015-05-07 14:38:44,NA,fwau,I wonder: what's the evolutionary advantage of releasing dopamine during a pretty song?,1,0
29071628705,2,eli5_2,4697437,explainlikeimfive,https://www.reddit.com/r/explainlikeimfive/comments/5pnu2o/_/dcshw9t/,345433344,29071627544,2017-01-23 10:22:35,NA,pier4r,nice the parallel with radiators.,1,0
44262044644,2,eli5_2,4697437,explainlikeimfive,https://www.reddit.com/r/explainlikeimfive/comments/18avden/_/kc0h884/,2678771615,44261985990,2023-12-04 22:06:32,37543738,Emyrssentry,The fact that the sun emits slightly more green light compared to red and blue light doesn't make the sun not white.,9,0
41421266051,3,eli5_3,4697437,explainlikeimfive,https://www.reddit.com/r/explainlikeimfive/comments/zpq24p/_/j115hfn/,2159522377,41409745534,2022-12-20 22:24:50,154621763293,NinjasOfOrca,Being drunk doesn’t negate consent; it is a factor in considering whether a person had the capacity to consent,1,0
27649836996,3,eli5_3,4697437,explainlikeimfive,https://www.reddit.com/r/explainlikeimfive/comments/2ygv5b/_/cp9zyro/,178826159,27649281146,2015-03-10 05:36:19,NA,Plazmotech,"I was about to say this, it really irked and confused me as a American-Portuguese",1,0
27861316977,3,eli5_3,4697437,explainlikeimfive,https://www.reddit.com/r/explainlikeimfive/comments/3c1jtz/_/csrwprl/,201626279,27861268090,2015-07-04 12:57:04,NA,thisworldfreaksmeout,Maybe a blow by a hunting rifle.  Or even sombody killed u with a hunting rifle... I said what the beliefs are not that I believe them or that I spread them!  ,2,0
29532303494,3,eli5_3,4697437,explainlikeimfive,https://www.reddit.com/r/explainlikeimfive/comments/6o4cgc/_/dkerr7q/,403310604,29532224505,2017-07-19 02:19:59,NA,Halo4,Halo 6 will have splitscreen! Yey!,7,0
26307891358,3,eli5_3,4697437,explainlikeimfive,https://www.reddit.com/r/explainlikeimfive/comments/mqe8b/_/c331evy/,38183051,26307881744,2011-11-27 04:24:48,NA,VonPepper,"I agree. While I don't know what the moderator's intent was with this subreddit, I'd assumed that it was to have somewhat complicated subjects stripped of the complication and explained in laymans terms which is what I saw for a while after I'd subbed but now it seems to be becoming some kind of askreddit bastard spawn with an ELI5 gimmick.",5,0
27641469138,3,eli5_3,4697437,explainlikeimfive,https://www.reddit.com/r/explainlikeimfive/comments/2y02dh/_/cp50m36/,178042373,27641443408,2015-03-05 09:01:01,NA,poopinbutt2k14,"Well they're lying...

Just like Israel is lying (or, uh, ""not commenting"") about their nuclear weapons. ",0,0
27010671809,4,eli5_4-9,4697437,explainlikeimfive,https://www.reddit.com/r/explainlikeimfive/comments/1v75up/_/cepgfr5/,112868449,27010666039,2014-01-14 18:51:04,NA,Fuck-The-Moderators,"That is unfortunate :( 

What if the VPN is located outside of the US? Unfortunately this would likely mean slow speeds though.",8,0
28140979421,6,eli5_4-9,4697437,explainlikeimfive,https://www.reddit.com/r/explainlikeimfive/comments/3ud3qx/_/cxeeuot/,232398393,28140951194,2015-11-27 04:20:49,NA,Pug_grama,"Dunno, but it is disgusting to me.  ",-5,0
27000283733,4,eli5_4-9,4697437,explainlikeimfive,https://www.reddit.com/r/explainlikeimfive/comments/1ujty2/_/cej9s9h/,111779930,26999925004,2014-01-07 03:34:42,NA,tubular1450,What's an e-ink screen? Do they not use backlights?,1,0
41542834245,5,eli5_4-9,4697437,explainlikeimfive,https://www.reddit.com/r/explainlikeimfive/comments/103tigd/_/j31j41x/,2183198125,41542285466,2023-01-05 12:30:04,1946875007737,StrawberryCandid2013,"Have you not been paying attention to what Elon Musk has been doing? He is ruining Twitter and making life hell for everyone working there. We also have a bunch of companies buying each other out, costing many, many workers their livelihoods. And then there's Trump, who is a literal criminal and doesn't pay his taxes. Yeah, politicians can be ""unpleasant,"" but let's not forget how some politicians are also rich and are influenced by lobbyists to make decisions which screw over their constituents.

So yeah, no, I don't buy that rich people should have control of their money, because there are exactly zero good billionaires.",1,0
33742156210,5,eli5_4-9,4697437,explainlikeimfive,https://www.reddit.com/r/explainlikeimfive/comments/f5nx60/_/fi17icy/,916506792,33740774882,2020-02-18 18:56:11,40756922,andreipoe,"&gt; I'm actually shocked by how many people from so many different countries are saying credit cards are rare.

I think they are rare in the sense that locals don't use them that often, not that they aren't accepted. I don't think I was ever in a situation where a credit card didn't work but a debit one did. Some places used to charge extra fees if you paid with a credit card, but there is now some European legislation which prevents them from doing it.",1,0
27303538754,8,eli5_4-9,4697437,explainlikeimfive,https://www.reddit.com/r/explainlikeimfive/comments/2culhm/_/cjjtlc2/,142515274,27303400676,2014-08-07 20:04:23,NA,blaqsupaman,"I see. I won't lie like it isn't nice to see my numbers go up, but I'm more interested in seeing a lot of responses and discussion.",1,0
40636776636,13,random_sample_10-19,4594374,AskReddit,https://www.reddit.com/r/AskReddit/comments/xaxt9t/_/io235j0/,2013757553,40636767700,2022-09-11 23:36:52,22222068,TEG_SAR,"No? Why are you so bad at this. 

You’re unoriginal and lame. Next you’re gonna tell me it’s a joke not a dick so don’t take it too hard?",1,0
42407734208,11,random_sample_10-19,4827700,AskRedditAfterDark,https://www.reddit.com/r/AskRedditAfterDark/comments/12vkpnm/_/jhcgx4w/,2350749154,42407725026,2023-04-23 02:20:53,1564821120958,liplover04,Ok what ever fits your narrative,-1,0
39753460329,15,random_sample_10-19,59876393,ToppsMarvelCollect,https://www.reddit.com/r/ToppsMarvelCollect/comments/utc1fw/_/i9g6max/,1863255884,39750936773,2022-05-21 13:47:48,1560129004766,usueurmen,your grandparents are too,2,0
28017695159,10,random_sample_10-19,4595804,soccer,https://www.reddit.com/r/soccer/comments/3m6a8v/_/cvd0fxz/,218643295,28017684340,2015-09-24 21:01:00,NA,riomx,"Haha. Some people just can't handle being informed about misuse of language. Anyway, carry on.",0,0
38441684944,10,random_sample_10-19,4594491,conspiracy,https://www.reddit.com/r/conspiracy/comments/rbxks2/_/hnr6pxs/,1652629106,38441638753,2021-12-08 19:24:31,475244310332,PrinceJau,"😂😂 sure kiddo! Keep making things up

That reaction really makes it seem like you’re telling the truth 😉",-1,1
38222383078,15,random_sample_10-19,44545163,HolUp,https://www.reddit.com/r/HolUp/comments/qr1sdt/_/hk4mbja/,1617553649,38222073100,2021-11-10 22:33:12,468261737811,ChunkyTaco22,Snackception,2,0
39080308651,2,random_sample_2,5108141,TransDIY,https://www.reddit.com/r/TransDIY/comments/t0jg0v/_/hyben57/,1754426335,39079863220,2022-02-25 00:29:57,NA,[deleted],That's not nice.,1,0
36872696997,2,random_sample_2,4595804,soccer,https://www.reddit.com/r/soccer/comments/na2xmk/_/gxt1v39/,1407655100,36869569651,2021-05-12 02:13:23,10977720,Grungemaster,"Lukaku plainly said he’d like to play in Italy, the season before he left for Inter.",5,0
39041117589,2,random_sample_2,4594386,Music,https://www.reddit.com/r/Music/comments/swhem2/_/hxo2n4l/,1747612730,39038186367,2022-02-20 04:54:00,17010702,Weediedeedee,That's a good song.,1,0
27999951460,2,random_sample_2,4669973,buildapcsales,https://www.reddit.com/r/buildapcsales/comments/3kyin0/_/cv2g4tg/,216601308,27998630215,2015-09-15 16:07:09,NA,TotesMessenger,"I'm a bot, *bleep*, *bloop*. Someone has linked to this thread from another place on reddit:

- [/r/bestofbapc] [/u/ggghhhyyy goes hard in the Nvidia paint ""750 ti at 1080p is a better experience than a 390x at 4k"" ""I dont know what the word asynchronous means""](https://np.reddit.com/r/BestOfBaPC/comments/3l219m/uggghhhyyy_goes_hard_in_the_nvidia_paint_750_ti/)

[](#footer)*^(If you follow any of the above links, please respect the rules of reddit and don't vote in the other threads.) ^\([Info](/r/TotesMessenger) ^/ ^[Contact](/message/compose?to=/r/TotesMessenger))*

[](#bot)",4,0
30307168964,2,random_sample_2,4613843,Accounting,https://www.reddit.com/r/Accounting/comments/8bmow9/_/dx83t8k/,503263881,30307127308,2018-04-12 03:32:15,NA,Aycoth,"The one who you communicate more with, duh.",100,0
28091814435,2,random_sample_2,4707253,shittyaskscience,https://www.reddit.com/r/shittyaskscience/comments/3r3i1f/_/cwl52qr/,226911507,28091430407,2015-11-02 02:29:57,NA,PlCKLES,"I've never heard of free-range Christs and if you've ever seen the conditions in which Christs are raised for eucharist meat, you'd probably swear off it for good. They keep the Christs hanging on wooden posts 24/7 with wounds that are left bleeding. I've also heard that one of the eleven secret herbs and spices is ""suffering"", which priests say makes the Christ meat extra tender and juicy.",2,0
28724017087,3,random_sample_3,4594370,videos,https://www.reddit.com/r/videos/comments/505v6r/_/d71jdfj/,302604579,28723982346,2016-08-29 18:41:26,NA,68regalager86,But even if it was... it still doesn't make sense? Why would he call Curly a spaniard?,-3,1
36400712449,3,random_sample_3,4803564,Overwolf,https://www.reddit.com/r/Overwolf/comments/kmmgye/_/gq01lhd/,1247323478,35883645535,2021-03-06 19:21:50,585724903396,Dispare76,"Nothing to be paranoid bout. The people on WoW are cancerous at best and toxic at worst, so what they say can be mostly ignored. and as bug said, people are just afraid of change or salty about needing to get a new launcher, I was the same myself, Until i realized it's just a reskinned twitch launcher without the annoying streamer crap on the front.",1,0
42829492761,3,random_sample_3,308165032,EscapingPrisonPlanet,https://www.reddit.com/r/EscapingPrisonPlanet/comments/14ad4hn/_/jobko49/,2436055547,42828997884,2023-06-16 06:28:55,86745276461,k3v1n0123,"Its wonderful to be here, its definitely a thrill,  you're such a lovely audience!",6,0
37353241648,3,random_sample_3,4594456,movies,https://www.reddit.com/r/movies/comments/onbw98/_/h5r5lps/,1490374412,37352736738,2021-07-19 14:10:10,NA,[deleted],"Yup.  As Dr. Tyson said in one of his talks, ""Any technology that can turn another planet into Earth will also turn Earth back into Earth.""",1,0
41496543371,3,random_sample_3,4773760,mildlyinfuriating,https://www.reddit.com/r/mildlyinfuriating/comments/zz63br/_/j29yxsb/,2175386967,41496033758,2022-12-30 18:42:31,591115901740,ATR2002,Was the cream warm?,1,0
27300944397,3,random_sample_3,4750204,learndota2,https://www.reddit.com/r/learndota2/comments/2cqrls/_/cji9zil/,142336576,27300883429,2014-08-06 05:34:01,NA,arcisal,"There are several ways to play Sniper.

You get MoM basically to get more headshots off. This also involves you actually leaving the lane and killing heroes. While its not such a bad idea, you're just delaying your more important items (in my humble opinion). 

I prefer to go Treads &gt; Aquilla &gt; Maelstorm. People say that you get Phase on him so that you can reposition yourself easily, but I prefer to ability to tread switch to get that extra Assassinate off or the extra tankiness and attack speed. Aquilla is a great early game item that allows you to stay in lane with its regen and solves your crap base damage. Maelstrom procs help you farm as well and can be upgraded to a Mjolnir later on which is way more relevant.

I get Blink sometimes but I find its too gimmicky for me. Yes its great and all for escaping, but that is provided you see them before they're on you. ",1,0
40618466181,5,random_sample_4-9,4615031,pregnant,https://www.reddit.com/r/pregnant/comments/x9yolc/_/inr6p39/,2012118528,40618457535,2022-09-09 17:56:45,689449526147,LadyoftheFjords,Brb running to the store immediately 🤰🏼🏃🏼‍♀️,6,0
26460769411,6,random_sample_4-9,4594323,gaming,https://www.reddit.com/r/gaming/comments/xejmn/_/c5m24cj/,56105951,26460725556,2012-07-31 14:24:21,NA,SonicFlash01,"Ash would be proud, but minus points for evolving it at all.",1,0
28917923291,6,random_sample_4-9,4596141,hockey,https://www.reddit.com/r/hockey/comments/5dw32q/_/da8zgez/,325662866,28917619490,2016-11-21 02:26:24,NA,SomethingSoDivine,https://gfycat.com/GiddySickHerald,0,0
35876877979,4,random_sample_4-9,41777197,Cringetopia,https://www.reddit.com/r/Cringetopia/comments/klz3xr/_/ghc607v/,1246233519,35876220391,2020-12-28 23:34:37,375836345466,Gr4ph0n,Right leaning incels? It's like this sub is breaking the 4th wall.,1,0
36006207489,6,random_sample_4-9,4603564,nba,https://www.reddit.com/r/nba/comments/kym1ih/_/gjh5zi9/,1267458857,36006198074,2021-01-16 16:50:10,404377721693,LAKERSfanTV,SAY OOOOH,2,0
30451825942,6,random_sample_4-9,4901653,controversialiama,https://www.reddit.com/r/controversialiama/comments/8lcxac/_/dzm8b9y/,519604356,30448390828,2018-05-26 17:13:17,NA,appropriate-username,"Removed two comments of yours, no insults.",1,0
31923700236,10,unpopularopinion_10-19,4738204,unpopularopinion,https://www.reddit.com/r/unpopularopinion/comments/bpvorj/_/enyjor0/,708596767,31923522348,2019-05-17 22:02:01,286071250895,hrichardson8,"According to [Wikipedia](https://wikipedia.org/Cloning), artificial cloning involves replacing DNA from an egg cell with that of a somatic cell, so technically not fertilization, but scientifically equivalent.",1,0
31918257136,10,unpopularopinion_10-19,4738204,unpopularopinion,https://www.reddit.com/r/unpopularopinion/comments/bph0bc/_/envb0ts/,707911896,31914855422,2019-05-17 05:57:58,NA,[deleted],[removed],0,0
34638813756,17,unpopularopinion_10-19,4738204,unpopularopinion,https://www.reddit.com/r/unpopularopinion/comments/hjd5fz/_/fwv1zr0/,1060451279,34638804443,2020-07-04 01:29:31,55852710,MadGeekling,So what happened?  You get bullied by black kids at school?  Why are you such a victim?,1,0
35585147989,11,unpopularopinion_10-19,4738204,unpopularopinion,https://www.reddit.com/r/unpopularopinion/comments/jva7y7/_/gcih7x1/,1201402303,35585140408,2020-11-16 17:21:02,30055785,Rainbwned,"Why are the two mutually exclusive? Why can't you complain about something while trying to do something about it?  


After you get out of retail, why can't you still complain about retail?",3,0
40498411411,11,unpopularopinion_10-19,4738204,unpopularopinion,https://www.reddit.com/r/unpopularopinion/comments/wxfq4l/_/ilrpi8j/,1991078661,40498402606,2022-08-25 18:49:59,664290515023,Kitchen_Bobcat_700,"I think it contains weird, creepy or illegal stuff, but unlike the dark web, you wouldn’t be putting yourself in any actual danger by being on it",2,0
32366995919,11,unpopularopinion_10-19,4738204,unpopularopinion,https://www.reddit.com/r/unpopularopinion/comments/cgmfwv/_/evah1vz/,753515023,32366867031,2019-07-28 20:58:35,76175609491,mrmuledeer,"Again look at the Washington post as they wrote an article. They wrote that it would stimulate over 170,000 jobs per year. And bring in $65 billion additional revenue each year to the economy. As well as making it more likely for the Mexican people to be able to unionize. Which will drive up wages in Mexico and push manufacturing back to the United States overtime. Socialist shit holes like you should absolutely fuck them selves in their face over that",1,0
33521874959,2,unpopularopinion_2,4738204,unpopularopinion,https://www.reddit.com/r/unpopularopinion/comments/eons8b/_/fee249b/,887946923,33521553398,2020-01-14 18:00:09,16489512485,HoldMyBeerAgain,"Right. If my husband asked for a paternity test he can get it, by all means, that's his kid and I can't stop him but he for damn sure better communicate exactly why he believes there's any sliver of doubt making him want to be *sure sure* like he ought already be.


Maybe we can work through it, maybe we can't.. but don't get mad at me if I decide I can't be in a marriage that doesn't have full and absolute trust. Just makes us incompatible I suppose.",6,0
31187974185,2,unpopularopinion_2,4738204,unpopularopinion,https://www.reddit.com/r/unpopularopinion/comments/a653d9/_/ebsiiw9/,614977101,31187908928,2018-12-14 18:17:15,211328064526,PapadinDanse,Why don't you tip?,1,0
34826217680,2,unpopularopinion_2,4738204,unpopularopinion,https://www.reddit.com/r/unpopularopinion/comments/i1nkgr/_/fzympjk/,1091170395,34826215386,2020-08-01 06:29:39,335164828046,cruisinnude,I lived in LA county for ten years.,2,0
33530464346,2,unpopularopinion_2,4738204,unpopularopinion,https://www.reddit.com/r/unpopularopinion/comments/epfdoz/_/fej67ve/,889234451,33530374803,2020-01-16 07:09:14,399699338746,DarleneTrain,"This, i kept hearing great things and it was just meh.

Only Olaf improved the rest was a big step down",2,0
32063514191,2,unpopularopinion_2,4738204,unpopularopinion,https://www.reddit.com/r/unpopularopinion/comments/bxuzgs/_/eq9sdvz/,722000908,32063513583,2019-06-07 14:11:37,62092701548,LimbRetrieval-Bot,"You dropped this \ 
 *** 
^^&amp;#32;To&amp;#32;prevent&amp;#32;anymore&amp;#32;lost&amp;#32;limbs&amp;#32;throughout&amp;#32;Reddit,&amp;#32;correctly&amp;#32;escape&amp;#32;the&amp;#32;arms&amp;#32;and&amp;#32;shoulders&amp;#32;by&amp;#32;typing&amp;#32;the&amp;#32;shrug&amp;#32;as&amp;#32;`¯\\\_(ツ)_/¯`&amp;#32;or&amp;#32;`¯\\\_(ツ)\_/¯`

 [^^Click&amp;#32;here&amp;#32;to&amp;#32;see&amp;#32;why&amp;#32;this&amp;#32;is&amp;#32;necessary](https://np.reddit.com/r/OutOfTheLoop/comments/3fbrg3/is_there_a_reason_why_the_arm_is_always_missing/ctn5gbf/)",2,0
31947401555,2,unpopularopinion_2,4738204,unpopularopinion,https://www.reddit.com/r/unpopularopinion/comments/brcy21/_/eocnosz/,711081577,31947206429,2019-05-21 17:50:09,110040541395,The_Hard_R,"This is a good argument. 

“Does he like me because me, or because I’m Asian”

I don’t think it makes a difference. What is imprinted on us sexually is impossible to control. What if it is older ladies with blonde hair? Or women without makeup? Or really tall women?",3,0
31627269108,3,unpopularopinion_3,4738204,unpopularopinion,https://www.reddit.com/r/unpopularopinion/comments/b3qeq4/_/ej22510/,671398924,31627245566,2019-03-21 18:03:12,238392012954,confidentgirl,"What? Really!?! 

I didnt know that...ok now that sucks and should be changed. 

One thing is if you are always getting banned but downvotes? Come on",1,0
35279241298,3,unpopularopinion_3,4738204,unpopularopinion,https://www.reddit.com/r/unpopularopinion/comments/j2dyas/_/g7gcksy/,1152867556,35277126234,2020-10-02 22:05:20,392473185157,sneezingbees,"Just because some women are fine with them doesn’t mean they speak for all women. Jokes normalize certain beliefs and behaviors and if it’s a sexist joke, it normalizes sexism which is very damaging",0,0
30722435255,3,unpopularopinion_3,4738204,unpopularopinion,https://www.reddit.com/r/unpopularopinion/comments/96ttj6/_/e43cerb/,555664578,30722426884,2018-08-13 02:34:01,115314589582,dryduneden,"Banjo was actually fun to explore in though. It had some nice charm.
DK exploring is just

-Starts new level

-Gets bananas

-Suddenly theres Diddy Bananas

-Go back and switch to diddy

-Get bananas

-sudeenly there's only a chunky area

-go back and switch

etc etc. ",1,0
31692229573,3,unpopularopinion_3,4738204,unpopularopinion,https://www.reddit.com/r/unpopularopinion/comments/b9cfsb/_/ek4qgud/,680824811,31691420170,2019-04-04 21:16:28,18667481,Michigan__J__Frog,That’s not at all how it works.,7,0
44494262305,3,unpopularopinion_3,4738204,unpopularopinion,https://www.reddit.com/r/unpopularopinion/comments/18w08ra/_/kfuqgip/,2714270806,44494235537,2024-01-01 17:16:36,68074726016044,Frequent-Cookie-9745,"No it can't, but it can be cross continamted in the kitchen. And some people are so strongly allergic, just the odor can cause a reaction",1,0
33821712985,3,unpopularopinion_3,4738204,unpopularopinion,https://www.reddit.com/r/unpopularopinion/comments/fcmwwn/_/fjckord/,928217111,33821707302,2020-03-03 08:30:07,197537633212,7eet,Why?,1,0
34943314999,8,unpopularopinion_4-9,4738204,unpopularopinion,https://www.reddit.com/r/unpopularopinion/comments/ibks7f/_/g1wciev/,1107836619,34943311074,2020-08-17 19:32:47,494535351507,Darkenprince,To have modernized slavery,-5,0
38957409606,5,unpopularopinion_4-9,4738204,unpopularopinion,https://www.reddit.com/r/unpopularopinion/comments/son88s/_/hwa8hmu/,1734447484,38957284929,2022-02-09 22:03:52,388086586722,McthiccumTheChikum,Exactly. I gave up drinking and lost 15lbs over the following few months.,10,0
32078245054,5,unpopularopinion_4-9,4738204,unpopularopinion,https://www.reddit.com/r/unpopularopinion/comments/byf0lt/_/eqik4am/,722935505,32077902540,2019-06-09 13:54:28,17089806961,SemiTrainedApe,"With women? Clinton was much worse. Trump made some comments. Clinton might be an actual rapist. Google Juanita Broadderick and Paula Jones (and Katherine Willey). The fact that you think Trump saying ""grab her by the pussy"" is worse than actual physical sexual assault is scary.",2,0
32098218849,4,unpopularopinion_4-9,4738204,unpopularopinion,https://www.reddit.com/r/unpopularopinion/comments/bzo7oq/_/equg869/,725044202,32098125517,2019-06-12 08:50:23,NA,[deleted],Which is why you would work for someone who doesn’t drug test. Nobody is forcing you to work for a certain company,3,0
36357949175,7,unpopularopinion_4-9,4738204,unpopularopinion,https://www.reddit.com/r/unpopularopinion/comments/lv6j2w/_/gpal14n/,1322162456,36357829608,2021-03-01 12:45:47,60870922,hailbaal,"I don't hate anyone for having a different skin color. That's silly. Most people strongly dislike people from the ME for causing major problems in our society. It's not your skin color. It's culture and religion. And even then, not all. I met so many wonderful christians and atheists from syria and iran.",0,0
37777941961,9,unpopularopinion_4-9,4738204,unpopularopinion,https://www.reddit.com/r/unpopularopinion/comments/pnu43p/_/hcs0ekp/,1551690565,37777841764,2021-09-14 03:29:13,162303859447,jocelyn6789,"Calling others pathetic doesn't exactly sound like a message of acceptance (body or otherwise).

&gt;ya old saggy bitch?

Oh yes, such a message of body acceptance!

&gt;You feel like hell because you sit on your bed, eat gummy bears all day and go on reddit.

Except I quite literally can't physically do much of anything due to the many injuries I've been struggling with for over 10 months following a serious car crash. Can walk a little. My right arm is almost completely unusable from a rather fucked up shoulder. I'm so sorry that offends you so very much...?

May I suggest some SSRIs for you?",1,0
