id,depth,set,subreddit_id,subreddit,permalink,link_id,parent_comment_id,created_utc,author_id,author,body,score,controversiality
29533161603,10,eli5_10-19,4697437,explainlikeimfive,https://www.reddit.com/r/explainlikeimfive/comments/6o4cgc/_/dkfa5c3/,403310604,29533132534,2017-07-19 12:31:42,NA,bodiesstackneatly,They outsold because they have far superior marketing and target markets. Some people may enjoy the games I absolutely hate the majority of Nintendo exclusives ,-5,1
42859562390,11,eli5_10-19,4697437,explainlikeimfive,https://www.reddit.com/r/explainlikeimfive/comments/14e1sx4/_/joth5zq/,2442245800,42859552985,2023-06-20 11:29:22,985640706443,ActualMis,Tooth paste. Not food. Silly beaver. Try and stay on topic.,1,0
37274557728,10,eli5_10-19,4697437,explainlikeimfive,https://www.reddit.com/r/explainlikeimfive/comments/ofyuvr/_/h4gb4tc/,1478008791,37274409776,2021-07-08 08:27:41,357081686332,bigsquaredick,That’s all well and good but don’t you know the earth is actually a disc surrounded by a wall of ice that’s not totally just like a popular tv show.,-1,0
29552754246,10,eli5_10-19,4697437,explainlikeimfive,https://www.reddit.com/r/explainlikeimfive/comments/6pk7rz/_/dkqy346/,405730655,29552690401,2017-07-26 15:27:57,NA,IDontFuckingThinkSo,"Or better yet, just don't eat at restaurants where tipping is expected and customary.  McDonald's doesn't require tipping.",0,0
33069662728,12,eli5_10-19,4697437,explainlikeimfive,https://www.reddit.com/r/explainlikeimfive/comments/dtcui9/_/f6wtn2g/,835368561,33069267147,2019-11-08 17:36:28,58244152319,thatidiotcat,"What about imagining someone you know really well?

If I imagine something like an apple, I see it on the back of my mind and not really clear. But imagining faces is a lot more difficult. Like, if I try to imagine my best friend or my mom I have a few characteristics that identify them (red hair, their eyeshape, a scar) but I'm imcapable of putting all of them together. But if I see them in real life, I can definitely distinguish them from a person that looks similar
I thought that was the norm until now.",3,0
27278754189,14,eli5_10-19,4697437,explainlikeimfive,https://www.reddit.com/r/explainlikeimfive/comments/2be8qp/_/cj52dfx/,140072641,27278751723,2014-07-23 01:51:27,NA,LuluRex,"Sorry, what question would that be?",2,0
29507310112,2,eli5_2,4697437,explainlikeimfive,https://www.reddit.com/r/explainlikeimfive/comments/6m9gor/_/djzw274/,400190139,29507288249,2017-07-09 19:50:59,NA,medroti007,I'm talking about all these wanna be rappers in the news and media. No one in particular. ,1,0
37145533852,2,eli5_2,4697437,explainlikeimfive,https://www.reddit.com/r/explainlikeimfive/comments/o3epd4/_/h2bhpcs/,1456913128,37145517247,2021-06-19 12:50:24,NA,[deleted],[deleted],-10,0
27089416415,2,eli5_2,4697437,explainlikeimfive,https://www.reddit.com/r/explainlikeimfive/comments/206wcg/_/cg0c7hb/,121254208,27089414063,2014-03-12 01:35:59,NA,StrewwelChris,So we need a flash. Let's load some nukes on a rocket and send them on the way!,3,0
38614844873,2,eli5_2,4697437,explainlikeimfive,https://www.reddit.com/r/explainlikeimfive/comments/rse0k6/_/hqma4zt/,1680269910,38614511896,2021-12-31 00:28:52,55493917,purplepinksky,"True.   At the beginning of your career, you don’t leak anything because frankly, it’s so obscure and low profile no one cares.   Eventually, when you do work on something well known, it’s not worth the risk to your career to leak info.   You also may be too busy and jaded to care about impressing internet strangers.   Which isn’t to say that leaks don’t happen.   They do.   However, you might also be surprised how many of them are deliberately put out there by networks or studios for publicity.",220,0
31267845848,2,eli5_2,4697437,explainlikeimfive,https://www.reddit.com/r/explainlikeimfive/comments/abxc61/_/ed42g9k/,624692953,31267545465,2019-01-02 23:31:38,62561403,rand652,That is what every nomad horse archer says! ,206,0
41022573653,2,eli5_2,4697437,explainlikeimfive,https://www.reddit.com/r/explainlikeimfive/comments/yhfmp4/_/iufs4et/,2085132712,41018691245,2022-10-31 00:02:49,636381615127,ionee123,"But what if they like move backwards, like reverse on a car",1,0
27629480394,3,eli5_3,4697437,explainlikeimfive,https://www.reddit.com/r/explainlikeimfive/comments/2x8bvm/_/coxvnii/,176748322,27629478253,2015-02-26 15:56:43,NA,BaconContest,Flock,75,0
28260051123,3,eli5_3,4697437,explainlikeimfive,https://www.reddit.com/r/explainlikeimfive/comments/42uvsq/_/czdaz03/,246664826,28260037222,2016-01-27 01:26:56,NA,esk_209,"I'm sure there are examples where an attempted murderer got a longer sentence than an actual murderer -- it would depend upon the jurisdiction, the jury, the skill of the defense attorney at the sentencing hearing, the circumstances surrounding the murder attempt (and whether or not there were other charges that the person was found guilty for).  Someone convicted of 125 counts of attempted murder (say, for an arson at an occupied building or something filed under RICO statutes) could quite easily get a much longer sentence than someone convicted of one count of murder. But generally, given *identical* circumstances, someone convicted of attempted murder is going to get a shorter sentence than someone convicted of murder (that being said, there is never going to be a situation with _identical_ circumstances).",3,0
39604698488,3,eli5_3,4697437,explainlikeimfive,https://www.reddit.com/r/explainlikeimfive/comments/uga5g3/_/i6zm4xk/,1841332755,39602805921,2022-05-02 04:00:17,17585278,Dodecahedrus,What about an ancient Bostonian athlete’s burial site?,31,0
27108378197,3,eli5_3,4697437,explainlikeimfive,https://www.reddit.com/r/explainlikeimfive/comments/21azj2/_/cgbmmhh/,123124574,27107876126,2014-03-25 18:04:12,NA,[deleted],That's why I love my american spirits. There not any safer but I buy half as many packs as I used too.,1,0
28163280664,3,eli5_3,4697437,explainlikeimfive,https://www.reddit.com/r/explainlikeimfive/comments/3vw9sh/_/cxroufs/,234972305,28162762948,2015-12-08 17:07:21,NA,funobtainium,"I'm surprised to learn this is the case outside the developed world -- I thought this was something first-world patients were demanding, mostly. TIL. ",2,0
34955117028,3,eli5_3,4697437,explainlikeimfive,https://www.reddit.com/r/explainlikeimfive/comments/ickpsn/_/g23dgx0/,1109513111,34954733738,2020-08-19 12:19:44,239732699310,Samthetrendynerd,Where have you been getting your baguettes then????!!!,0,0
39524901781,4,eli5_4-9,4697437,explainlikeimfive,https://www.reddit.com/r/explainlikeimfive/comments/u8uhc5/_/i5o3ted/,1828844357,39524292833,2022-04-21 21:24:14,47611847,Elfich47,The civil/structural assumes the full weight of the snow when designing the structure.,0,0
28212214414,4,eli5_4-9,4697437,explainlikeimfive,https://www.reddit.com/r/explainlikeimfive/comments/3zaad5/_/cyktnym/,240665081,28212055720,2016-01-03 22:28:52,NA,leggo_my_jhncena_pog,"Under Armour is also a huge employer of illegals. They use a dirty hiring agency so they have plausible deniability.  I have witnessed this first hand and as much as I love UA i refuse to wear it.  I am sure other companies engage in this as well, its just that I have personally witnessed this.",9,0
40486549989,7,eli5_4-9,4697437,explainlikeimfive,https://www.reddit.com/r/explainlikeimfive/comments/wvvc4j/_/ilkn9wl/,1988447779,40485817523,2022-08-24 09:36:37,NA,[deleted],[deleted],1,0
36015880779,9,eli5_4-9,4697437,explainlikeimfive,https://www.reddit.com/r/explainlikeimfive/comments/kyxjod/_/gjmxbgr/,1267995613,36014055812,2021-01-17 19:13:11,5794994,frodegar,"So, ""cut of his dick with a plastic spoon"" is probably not in the original lyrics.",3,0
27481159092,6,eli5_4-9,4697437,explainlikeimfive,https://www.reddit.com/r/explainlikeimfive/comments/2nu9py/_/cmhkm2c/,160975798,27480214937,2014-12-01 03:21:30,NA,LithePanther,That's how almost all games are,0,0
27466626334,5,eli5_4-9,4697437,explainlikeimfive,https://www.reddit.com/r/explainlikeimfive/comments/2mz1or/_/cm8x4im/,159519051,27466623863,2014-11-21 13:40:59,NA,[deleted],[deleted],-2,0
42051373665,13,random_sample_10-19,4738505,dataisbeautiful,https://www.reddit.com/r/dataisbeautiful/comments/11l31kd/_/jbgavkx/,2272662445,42051047383,2023-03-08 20:59:43,66442563,csjerk,"Not true! You give a shit, otherwise you wouldn't be melting down like a 5-year-old.",1,0
27614476250,18,random_sample_10-19,4594548,Christianity,https://www.reddit.com/r/Christianity/comments/2w4xjf/_/cooy28q/,174910155,27614438903,2015-02-18 05:03:46,NA,gtfooh1011,"All is forgiven, brother/sister. May peace and the Holy Spirit be upon you.",-1,0
28772923601,15,random_sample_10-19,4675745,AdviceAnimals,https://www.reddit.com/r/AdviceAnimals/comments/53ij0b/_/d7unlxt/,308234171,28772593187,2016-09-20 15:08:03,NA,EditorialComplex,She's not even the most corrupt person in the race.,0,0
28725855509,10,random_sample_10-19,4594370,videos,https://www.reddit.com/r/videos/comments/505v6r/_/d72mryt/,302604579,28725841652,2016-08-30 14:41:52,NA,Oafah,Apparently it does.,1,0
35750689670,18,random_sample_10-19,4619142,Minecraft,https://www.reddit.com/r/Minecraft/comments/k9ypuk/_/gf91cp2/,1226059868,35750228982,2020-12-10 05:32:21,367355133071,Eggyland85,This is the way,7,0
38856308841,14,random_sample_10-19,4685587,shittyama,https://www.reddit.com/r/shittyama/comments/seskl0/_/hum1js9/,1717900596,38856245636,2022-01-28 18:04:03,184515800265,smellygymbag,That sounds suspiciously like something a vegan would say..,3,0
28039713162,2,random_sample_2,4687226,streetwear,https://www.reddit.com/r/streetwear/comments/3nhkn7/_/cvq4d56/,220849603,28036470617,2015-10-06 14:51:20,NA,eiqht,bro just look man its fake ,1,0
40824150025,2,random_sample_2,5242519,amexcanada,https://www.reddit.com/r/amexcanada/comments/xw0853/_/ir5n7rd/,2049142071,40821703343,2022-10-05 14:52:28,430160716796,Nameless11911,Thanks didn’t know they take Amex,2,0
42046435919,2,random_sample_2,4738505,dataisbeautiful,https://www.reddit.com/r/dataisbeautiful/comments/11l31kd/_/jbdd1lb/,2272662445,42046380022,2023-03-08 05:49:09,NA,[deleted],[removed],1,0
35386738158,2,random_sample_2,4738505,dataisbeautiful,https://www.reddit.com/r/dataisbeautiful/comments/jcwvhr/_/g98clwu/,1170546543,35382522992,2020-10-18 15:58:07,220217622373,Franghein,So it looks like a picture!,2,0
44681606758,2,random_sample_2,4631985,buffalobills,https://www.reddit.com/r/buffalobills/comments/19cfd6l/_/kiy9wfa/,2741850237,44681593447,2024-01-21 22:14:47,1096332223805,lytrendsa,both,4,0
43145323240,2,random_sample_2,4607607,Louisiana,https://www.reddit.com/r/Louisiana/comments/159i6yr/_/jtjm0h4/,2495078595,43138704593,2023-07-26 16:52:01,16162413,achilles84,"For those now fearful of driving across the LC bridge, allow me to greatly compound that fear. In the U.S. generally, almost 8% of all bridges are structurally deficient and, more alarming, about ONE THIRD of bridges need repair or replacement, including one third of interstate bridges. If that doesn’t sound like a crisis, consider this: to fix only those bridges that are structurally deficient (ignoring the other repair/replace, at great risk), it would take almost 70 years and 54 billion dollars. Of course, in that time, imagine how many will be further damaged. (See the following, though many sources exist: https://artbabridgereport.org/)

We have an infrastructure CRISIS. It isn’t politically sexy and the problems are mostly invisible (for now). Add in the cost and labor, and it is easy to see why those in charge turn a blind eye. It is almost guaranteed that there will be catastrophic failure of multiple bridges before anyone is motivated to act. 

If you’re still complacent, go ahead and look into the state of sewers, dams, and other major infrastructure. It’s all crumbling and not much is being done to address it. Good luck out there.",1,0
37664526149,3,random_sample_3,4715053,DeadBedrooms,https://www.reddit.com/r/DeadBedrooms/comments/pd661s/_/hawhidh/,1533777184,37653083798,2021-08-30 07:09:35,NA,[deleted],[deleted],2,0
34303941860,3,random_sample_3,4647503,intel,https://www.reddit.com/r/intel/comments/gnsrdx/_/frboixw/,1007431845,34303915915,2020-05-21 08:26:32,65542294,SmokeOnTheGround,Fire extinguisher... you know... just in case,102,0
34920378836,3,random_sample_3,4748068,Pathfinder_RPG,https://www.reddit.com/r/Pathfinder_RPG/comments/i9zuj9/_/g1iowr8/,1105180245,34920329777,2020-08-15 03:36:00,31112436,Rytarius,That's what I was starting to think after some digging and didn't see that he had another Post.,2,0
36677138358,3,random_sample_3,41777197,Cringetopia,https://www.reddit.com/r/Cringetopia/comments/mqxuya/_/gukmd2u/,1375505650,36677120498,2021-04-15 04:43:06,435126935071,CheeseKiller66,I see. Thanks for clarifying,2,0
43884382753,3,random_sample_3,4595845,motorcycles,https://www.reddit.com/r/motorcycles/comments/17cltab/_/k5rmmg1/,2621218691,43884241334,2023-10-21 00:38:07,41646178454603,Emergency-Cookie9413,"Oh okay, yeah not too many good solutions then. Alot of them are just bored assholes unfortunately. I don't give them the time of day.",1,0
44282909718,3,random_sample_3,491636098,Evansville_NSFW,https://www.reddit.com/r/Evansville_NSFW/comments/18bmmvg/_/kccwfti/,2680043596,44282512886,2023-12-07 12:36:49,2467281021123,newguyverse,lol. You free Mondays,1,0
27517525094,6,random_sample_4-9,4595402,nyc,https://www.reddit.com/r/nyc/comments/2q325r/_/cn38292/,164745135,27516543586,2014-12-23 13:24:19,NA,mship,"Its right in he's backyard. It's not like that shot is trucked and then shipped on a boat, hunderd or thousands of miles from where he lives.

Come on man.",2,0
37538316887,4,random_sample_4-9,17363955,FortniteCompetitive,https://www.reddit.com/r/FortniteCompetitive/comments/p3bivo/_/h8tceon/,1517230932,37533708644,2021-08-13 18:39:30,45242902,Kuhzoom,I think the problem people have with purple/gold is the distance at which you can take those huge shots. At least IMO that’s the most consistently rage inducing part of fighting a purple/gold pump is that it feels impossible to trade damage with.,3,0
42966729015,8,random_sample_4-9,143741460,VALORANT,https://www.reddit.com/r/VALORANT/comments/14poopq/_/jqla4af/,2461789214,42966712770,2023-07-04 03:32:54,630978073239,TheRadicalJay,"Yeah, if i’m not doing too good on a specific day i would stay back, and get info for the team too",3,0
37091964590,6,random_sample_4-9,4766280,baseballcards,https://www.reddit.com/r/baseballcards/comments/nxmeru/_/h1flj1q/,1447194954,37091948914,2021-06-11 18:38:44,47585335,BernieSandInMyPants,I dont think theres a 'premium' cost or additional cost in an 'HTA' box. Someone can correct me if I'm wrong but I think all Jumbo Hobby boxes are technically HTA boxes. Just depends if  a seller slaps the label on a listing or not.,2,0
28509767367,4,random_sample_4-9,4603564,nba,https://www.reddit.com/r/nba/comments/4krp69/_/d3hz9af/,276749361,28508622083,2016-05-24 17:56:02,NA,smoke4sanity,That building was so damna loud that being just one row away wouldn't lead to being able to be loud enough to disrupt communications.,1,0
40631453516,8,random_sample_4-9,4594374,AskReddit,https://www.reddit.com/r/AskReddit/comments/xaxt9t/_/inyx26k/,2013757553,40631447005,2022-09-11 10:14:08,70431450,LudoVicoHeard,"No, it shows you can't attract or keep a decent man. I Thought that was pretty obvious.

Same energy as incels complaining about women. Glad I could clear it up anyway.",-6,1
35177779834,10,unpopularopinion_10-19,4738204,unpopularopinion,https://www.reddit.com/r/unpopularopinion/comments/ivix5h/_/g5rxwmy/,1141342037,35177748944,2020-09-19 02:57:27,242595086371,Robbie1266,"I mean, I could just say mind control. I don't really know a whole lot about star wars....just seen the ""these are not the droids you're looking for"" meme and that's what I think of when I see the outcome of this marketing campaign. Sorry you don't like my unpopular opinion, sheep.",0,0
31561645276,18,unpopularopinion_10-19,4738204,unpopularopinion,https://www.reddit.com/r/unpopularopinion/comments/axc2nd/_/ehyzlcs/,660652393,31561466467,2019-03-07 04:07:24,16379018,5th_Law_of_Robotics,Yeah women are kinda lazy. ,1,0
34721648447,14,unpopularopinion_10-19,4738204,unpopularopinion,https://www.reddit.com/r/unpopularopinion/comments/hs4i54/_/fy8dfen/,1075164376,34721623755,2020-07-16 07:43:47,342831990899,evylina12,"Yes, I'm very insecure about dealing with insecurities. It makes me very nervous, whatever is said, there is always a flaw. Who needs that? 🙂 I didn't say I was YOUR manager. Never claim to be. And have no desire to get promoted by you 🙂 It already makes me a lesser person spending time for this nonsense conversation. I'd love to stay and chat, unfortunately, I have my own insecurities to deal with 😉 Bye!",-1,0
34604212094,10,unpopularopinion_10-19,4738204,unpopularopinion,https://www.reddit.com/r/unpopularopinion/comments/hdmt5m/_/fwagcxq/,1050824218,34604205619,2020-06-28 18:46:06,NA,[deleted],[deleted],1,0
38194416294,11,unpopularopinion_10-19,4738204,unpopularopinion,https://www.reddit.com/r/unpopularopinion/comments/qokvg1/_/hjnyw86/,1613405233,38194238087,2021-11-07 12:22:26,307290467941,Marty-the-monkey,You're right. Diplomatic trips don't do anything. Who would be dumb enough to have diplomats,0,0
43976482866,12,unpopularopinion_10-19,4738204,unpopularopinion,https://www.reddit.com/r/unpopularopinion/comments/17kvnmf/_/k7agnci/,2635114839,43976464694,2023-10-31 22:15:45,60183197,wildwill921,I’m okay with that if they can’t come up with video of it. Have to draw the line somewhere or the road pirates would have us all in jail,1,0
27143144153,2,unpopularopinion_2,4738204,unpopularopinion,https://www.reddit.com/r/unpopularopinion/comments/22tpcn/_/cgwbs2h/,125677463,27135871545,2014-04-19 04:36:40,NA,Jareth86,Really? Go into a crowded public place and state this opinion. See where it gets you.,1,0
33872310922,2,unpopularopinion_2,4738204,unpopularopinion,https://www.reddit.com/r/unpopularopinion/comments/fgsykq/_/fk6p6dm/,935217674,33872290362,2020-03-11 07:00:57,40316502,Arclight_Ashe,"Yeah but if I’m waiting on a bus and there’s a bin a few feet away from it with an ashtray, I’ll be standing by that ashtray.",1,0
31181145876,2,unpopularopinion_2,4738204,unpopularopinion,https://www.reddit.com/r/unpopularopinion/comments/a5nk3a/_/ebog650/,614158966,31180251146,2018-12-13 04:11:32,54769841,Flowers818,"This. Also, there is an author that is widely praised by Military vets, Sebastian Junger. Basically, we aren't just opening up more about the many different forms of mental trauma we experience, we're actually experiencing more of it over time, and that ***modern society is legitimately making the trauma worse.***

Throw a dog into a fighting pit, and then into a cage, it will then stay traumatized. Take one, and send it to a professional, give it a family, and over time it will lose its trauma symptoms. 

So the same goes with modern society. Lose a child? See war? Get deployed to South Korea, never see combat, but be forced to stay away from your family for a year? 
Our lonely apartment buildings are all our cages. ",1,0
34021305111,2,unpopularopinion_2,4738204,unpopularopinion,https://www.reddit.com/r/unpopularopinion/comments/fwbcfx/_/fmnen13/,961269693,34021214526,2020-04-07 01:52:07,127007081654,JayeKimZ,"A professor of a freshman class is getting a lot of questions from students not understanding the material? That sounds like a red flag of a bad professor/system. 

Have they considered setting up a google doc that has a list of questions asked and the answers?",3,0
30602822861,2,unpopularopinion_2,4738204,unpopularopinion,https://www.reddit.com/r/unpopularopinion/comments/8xmfaj/_/e244p8t/,540202987,30602813953,2018-07-10 07:10:14,21049243715,Chumpacabra,"&gt; That sounds cruel. 

I am somewhat, yeah.

&gt; And it’s not “literally giving free money” because they get taxed on it. I agree tipping is bad because the employer should be paying the waiter.

There is no argument to be made here because waiters aren't slaves. There are other jobs.

&gt; But there’s people who have circumstances where they are working as a waiter/busser/runner and depend on tip money to provide for their family 

Shoulda learned something in highschool or picked up a trade then. I went to uni to get a profession to meet my financial needs, not to be a one woman charity for lazy dumb people.

&gt; They bust their ass to go above and beyond 

And if they don't I'll talk to their manager.

&gt; cheap shit. 

Charge more for the menu items. Hell, double the cost. I'd pay it. I'd still want to eat out. I'm not giving away free money though.",1,0
31372021728,2,unpopularopinion_2,4738204,unpopularopinion,https://www.reddit.com/r/unpopularopinion/comments/ajb4yf/_/eeu3aw0/,637094103,31372018536,2019-01-24 10:42:40,153326095133,spicy_bob,I mentioned its on a leash. I did the best I could with my english.,9,0
34400505693,3,unpopularopinion_3,4738204,unpopularopinion,https://www.reddit.com/r/unpopularopinion/comments/gwiz10/_/fsx682l/,1022091732,34399106689,2020-06-05 00:33:49,482275934508,Lostoldacct22FA,Reddit it wasn't on reddit.  If reddit is your main news source God help you,6,0
37462674552,3,unpopularopinion_3,4738204,unpopularopinion,https://www.reddit.com/r/unpopularopinion/comments/ox4v6i/_/h7kb4oo/,1506842586,37462642017,2021-08-03 15:44:41,899939658539,AbandonedBySony,Fair enough,2,0
31152964544,3,unpopularopinion_3,4738204,unpopularopinion,https://www.reddit.com/r/unpopularopinion/comments/a3hmyg/_/eb7o5a8/,610523512,31152555370,2018-12-06 14:08:27,65232039195,JerichoKyrie,"Want the fuck?

Ok, so

1. Obama is not Kenyan. Like at all.

2. That is a part of you you can’t control, so apologising for it would be pretty fucking stupid.

3. ‘Kenyan’ is nto a choice. It’s not a stance. It’s got nothing to do with whether or not someone will vote for you. Racism on the other hand is an aspect of your character, and something you can control, an therefore are responsible for. Additionally, it’s somethign that will have bearing in your job. So if someone votes for a racist, they are necessarily supporting a racist doing that job.",2,0
33032722799,3,unpopularopinion_3,4738204,unpopularopinion,https://www.reddit.com/r/unpopularopinion/comments/dqwcf9/_/f6atw1b/,831239397,33032609797,2019-11-03 06:27:04,21866961649,Dingoatemypenis,Democratic Peoples Republic of North Korea. Peoples Republic is literally in the name and people like you call us a dictatorship. We just love dear leader so much we keep electing him.,2,0
34753318386,3,unpopularopinion_3,4738204,unpopularopinion,https://www.reddit.com/r/unpopularopinion/comments/hv4xmm/_/fyr8836/,1080223294,34753149963,2020-07-21 11:33:17,11063504,jurassicbond,"I can see it. His whole deal was that he thought people would retroactively thank him and work towards a better universe. Instead he finds out that they'll kill him and try to put things back to his that were before. They haven't learned a thing from the better universe he created for them, and even his daughters have turned against him. It's not like he was a very rational person before and those revelations caused him to snap (no pun intended).",3,0
42970188545,3,unpopularopinion_3,4738204,unpopularopinion,https://www.reddit.com/r/unpopularopinion/comments/14qg0cd/_/jqnc9oh/,2463063997,42969685454,2023-07-04 16:15:49,213936701726,saveyboy,Seems you do care.,4,0
36193052974,5,unpopularopinion_4-9,4738204,unpopularopinion,https://www.reddit.com/r/unpopularopinion/comments/lf7w2d/_/gmkeqem/,1295352085,36193026857,2021-02-08 09:42:52,358169781217,Elgringomk,You're right. Just googled it. Didn't know that was the definition,0,0
37272422255,4,unpopularopinion_4-9,4738204,unpopularopinion,https://www.reddit.com/r/unpopularopinion/comments/ofumg5/_/h4f1d2n/,1477811237,37272398678,2021-07-08 00:12:39,NA,[deleted],"Woah woah woah... Lol okaay.

I'm waking up the die hards. Some things are beyond our current science. Can we agree on that? Hell we don't have to agree. 

This confirms the unpopular opinion 100 tho.",1,0
34445786993,5,unpopularopinion_4-9,4738204,unpopularopinion,https://www.reddit.com/r/unpopularopinion/comments/h0q52t/_/fto4rch/,1029144629,34445655874,2020-06-11 06:19:13,12662876,magiclasso,"UH doesnt require all doctors to work for UH. They can still practice privately, they just wont find many people willing to pay absurd rates.

But since you asked just about everything that you have a ""right"" to must be protected by somebody. If I hear you saying something I dont like in public I can subdue you and stop you from talking...unless somebody else stops me from doing so. So youre right to free speech REQUIRES the labour of somebody else.",0,0
31761465469,9,unpopularopinion_4-9,4738204,unpopularopinion,https://www.reddit.com/r/unpopularopinion/comments/beyx26/_/el9yflp/,690271710,31761388389,2019-04-19 16:07:42,19315332,qa2,u/Paraltin absolutely DESTROYS unsuspecting college kids with FACTS and LOGIC on why we should FUCK CORPSES! LIBERAL BOOMER professor is DEBUNKED and has his LITERAL CORPSE RAPED with FACTS AND THE TRUTH.,1,0
34097565950,4,unpopularopinion_4-9,4738204,unpopularopinion,https://www.reddit.com/r/unpopularopinion/comments/g4adgc/_/fnwt69q/,974661276,34097558819,2020-04-19 19:35:52,387694066153,thegoldendoodleone,You do know there are already people getting microchipped?,1,0
42821725798,4,unpopularopinion_4-9,4738204,unpopularopinion,https://www.reddit.com/r/unpopularopinion/comments/149kxh3/_/jo6y73a/,2434740087,42820060668,2023-06-15 05:07:19,2297466450205,keepingitrealgowrong,That slope is begging for some gravel to skid on and cause a whole crush. But it does look like a nice orderly commute otherwise. Check the Baltimore Orioles shirt too lol,5,0
