id,depth,set,subreddit_id,subreddit,permalink,link_id,parent_comment_id,created_utc,author_id,author,body,score,controversiality
27101864478,3,data_driven_civil_discourse_subset_3,4855832,changemyview,https://www.reddit.com/r/changemyview/comments/20xnem/_/cg7r0gu/,122502334,27101812356,2014-03-20 21:50:01,NA,HeartyBeast,"Sure, and I absolutely agree - the stickiness and the public commitment are the core aspects. It suits some people, not others. I just think that the 'it's bullshit' line is a little ... unnuanced :) 

There's something about finding that person, and saying. ""That's it. I'll look after you forever"" which makes it an astonishing commitment.

And if that commitment fails, it will be astonishingly painful. Perhaps fewer people should get married? I'm not sure.",3,0
27626253705,13,data_driven_civil_discourse_subset_10-19,4855832,changemyview,https://www.reddit.com/r/changemyview/comments/2wzu8h/_/covyhs9/,176352209,27626225725,2015-02-24 21:17:36,NA,Fuckn_hipsters,"Yep, that is exactly how it plays out in the Olympics, and in my opinion should play out in college athletics.",1,0
28829900497,5,data_driven_civil_discourse_subset_4-9,4855832,changemyview,https://www.reddit.com/r/changemyview/comments/57j9mj/_/d8sktld/,314987131,28829898334,2016-10-15 01:36:18,NA,Nepene,"Thanks. Ideally, put it in a new comment, since delta bot only reads new comments.

Ideally with alien technology we can make superior robots.",1,0
28331024959,3,data_driven_civil_discourse_subset_3,4855832,changemyview,https://www.reddit.com/r/changemyview/comments/48h0gv/_/d0jk6rj/,256095391,28331016708,2016-03-01 17:34:43,NA,Hq3473,"&gt; Wouldn't my original assertion still hold true since some people retain a sense of childlike innocence past 18 years? Like toy makers or children's book writers. Wouldn't they still be able to see the taste then?

If that were true, then some adults (toy makers or children's book writers) should have been able to understand why kids love the taste of Cinnamon Toast Crunch even in 1995.  Yet we know for a fact that they were not able to.

Perhaps losing the ability to understand why kids love the taste of Cinnamon Toast Crunch is what defines child-to-adult transition.

Perhaps *people* who retain a sense of childlike innocence never truly become ""adults."" 


",109,0
30367138281,3,data_driven_civil_discourse_subset_3,4855832,changemyview,https://www.reddit.com/r/changemyview/comments/8fs0g3/_/dy7t5ux/,510230595,30366842113,2018-04-30 15:39:55,NA,Glory2Hypnotoad,"Fantasy can and often does tackle philosophical thought experiments. The ability to show a world fundamentally different from our own serves to take issues that are tied up in specifics in our world and abstract them to their logical form. It also makes us question which elements of our own world are essential and which are accidental, since we have a potentially infinite range of fantasy worlds but our sample size for real worlds is one. The Ones Who Walk Away From Omelas is a critique of utilitarianism. Wheel of Time explores the memetic nature of myths and the psychological burden of concepts like destiny.",2,0
30169537932,5,data_driven_civil_discourse_subset_4-9,4855832,changemyview,https://www.reddit.com/r/changemyview/comments/80sz76/_/duy5wgc/,485081394,30169525443,2018-02-28 06:09:47,NA,I_want_to_choose,"No, because Christians believe in God and believe that he actually does the things they attribute to him. They absolutely have hope in the present life.

Your hope and purpose doesn't need to be grounded in reality. 

Consider two patients facing cancer. One has hope that God will heal him. One doesn't believe in God. God doesn't exist. Does that mean that the person who believes in God doesn't have hope any more? No, because that person believes in God. Belief in God is enough to provide hope; the actual presence and action of God is not necessary.

Honestly, were I an all-knowing, all-seeing deity who wants a creation with free will, I would make sure that the creation benefits from belief in God without needing physical proof. In this interesting scenario, the deity would indeed have no need to prove himself via miracles beyond the initial development of the faith. I'm not saying that this is what is happening, but the Bible makes it clear that free will is a priority in creation. ",1,0
31252859269,3,data_driven_civil_discourse_subset_3,4855832,changemyview,https://www.reddit.com/r/changemyview/comments/aaubyq/_/ecv58jp/,622873106,31252824509,2018-12-30 10:22:49,27405438,IIIBlackhartIII,"I think it's more valuable to specifically and explicitly distinguish between ""racism"" and ""systemic racism"" at least in common parlance. While the academic definition certainly distinguishes the institutionalised oppression of class, that's not the colloquial usage. When most people talk about having experienced ""racism"", I think what they're referring to is predominantly what you seem to define as specifically simply ""prejudice"". If you think of it like a venn diagram, this overlap between the academic and colloquial definitions just leads to ambiguity in meaning, which I think hurts the conversation and doesn't provide a productive solution, and if anything gives ammunition to those who hold prejudicial views because it just makes it feel like the game is rigged even from the perspective of the language being used- bigotry and hate thrive in ignorance and fear of the unknown, so dissolving the foundation of even common language hurts efforts to expand narrowminded people's horizons. I think the function of language should be clarity, and making an effort to specifically and distinctively separate the concepts of the common experience of encountering ""a racist"" and therefore ""encountering racism"" versus the more abstract experience of being victim of institutionalised racial prejudice and therefore ""being racially oppressed"" is a worthwhile endeavour. As such I would say that a white person even in contemporary America can in fact encounter ""racism"" just as anyone can, but absolutely are not in a position as the majority power to be victim of institutionalised oppression. ",3,0
33901568886,3,data_driven_civil_discourse_subset_3,4855832,changemyview,https://www.reddit.com/r/changemyview/comments/fjo9mu/_/fko49yu/,940037574,33901516431,2020-03-16 17:30:21,91650544314,Delaware_is_a_lie,"&gt;everyone else I know who is also a part of it are mature adults

Right but you’re on reddit so it’s skews toward the younger and less mature demographic. 

&gt;I find it highly unlikely that a small minority of “angsty” malcontents could get such traction on their posts without help.

This website typically promotes the more extreme aspects of different ideologies. Add that to my other comment and you can see the results on /r/WayOfTheBern",8,0
34596588687,2,data_driven_civil_discourse_subset_2,4855832,changemyview,https://www.reddit.com/r/changemyview/comments/hgt4xa/_/fw5wyof/,1056158254,34596568823,2020-06-27 13:19:08,222980141844,SouthSimongo,"the philosophytube video sums it up really well imo, in a clear way as well.",3,0
39732700373,10,data_driven_civil_discourse_subset_10-19,4855832,changemyview,https://www.reddit.com/r/changemyview/comments/usahad/_/i93tnth/,1861503493,39732124337,2022-05-18 18:41:16,52575702,lehigh_larry,I did cite a study￼ from the San Fran fed. Here it is again in [this Vox article](https://www.vox.com/23036340/biden-american-rescue-plan-inflation).,2,0
40529135002,5,data_driven_civil_discourse_subset_4-9,4855832,changemyview,https://www.reddit.com/r/changemyview/comments/x0stgi/_/ima00pm/,1996728354,40529093304,2022-08-29 17:00:39,6164020,ralph-j,"It looked like an integral part of your argument, especially when you start talking about ""inner turmoil"":

&gt;&gt; This is important because stating that a woman is a woman because they identify as one negates the harsh reality that transgender individuals do NOT just identify as their desired sex. Along with their identification they experience intense scrutiny, inner turmoil, and confusion on their path to be themselves. Real, medically documented turmoil.

You appear to be saying here that turmoil is a necessary requirement because being a woman cannot just be through self-identification?",6,0
34842459860,3,data_driven_civil_discourse_subset_3,4855832,changemyview,https://www.reddit.com/r/changemyview/comments/i2zidv/_/g08au38/,1093407187,34842420700,2020-08-03 17:17:10,161685,hacksoncode,"&gt; is it really stimulating the economy more than if the first person just went and bought groceries with the money

Someone gets that money for the house. So yes. Also, loans are not only long-term obligations such as mortgages, but also unsecured short term loans like credit cards, which almost *entirely* go directly into the economy. 

Note, though, that this isn't an argument about the rich's money ""trickling down"" to poorer people, as these kinds of loans actually exacerbate inequality, if one thinks that's something important to care about. 

It's only an argument that it doesn't result in lower velocity of money, but rather higher.",6,0
33120613538,15,data_driven_civil_discourse_subset_10-19,4855832,changemyview,https://www.reddit.com/r/changemyview/comments/dxg6rt/_/f7r5oyq/,842242889,33120537017,2019-11-17 07:21:22,14162994113,speedythesequel,"I cant see how you can honestly hold the position that you are 100% a sadist, with anti social personality traits,

and you are certain, that you are a normal person and not suffering from a mental disorder.

""I enjoy killing animals and watching friends die in car accidents. I'm completely normal."" 

There has to be some part of you that realises that being a sadist, is part of the DSM-5, and is classified as a personality disorder, which makes it a mental disorder.

Which renders your entire argument moot, when you argue that your opinion is normal because you are sane.

You cannot be a sadist that acts on your impulses, and claim to be normal. You are simply a sadist that has not been caught. You're just a smart sadist that blends in, thats it. 

Being caught for killing an animal and enjoying it, is the only reason that you arent diagnosed with a sadistic personality disorder. Which means the entire basis of your argument, is defined by you getting caught.",3,0
38280021099,2,data_driven_civil_discourse_subset_2,4855832,changemyview,https://www.reddit.com/r/changemyview/comments/qwdyy1/_/hl2xpbf/,1626520105,38279906238,2021-11-18 04:19:58,43099694,sessamekesh,"Out of curiosity, I went through the first couple dozen of my LinkedIn connections to try to identify the professional benefit I either get or hope to get from each connection:

* Works/worked in field I want/wanted to work in: 4
* Contact I might turn to if looking for talent: 5
* Industry-specific contacts with no specific goal: 6
* Non-industry-specific contacts with no specific goal: 8

I also tallied the ones that I feel like I have a sort of personal connection with beyond work:

* Had existing personal or workplace connection: 10
* Formed personal connection through networking context: 3
* No personal connection or interest in forming one: 11

*EDIT: I still like the ""no specific goal"" connections, I've found myself reaching out to someone in this group many times to get direct firsthand professional insight about some business or industry, and on many occasions I've been more than glad to help contacts who have reached out to me for the same.*",1,0
42724049800,3,data_driven_civil_discourse_subset_3,4855832,changemyview,https://www.reddit.com/r/changemyview/comments/13y35jh/_/jmksnt4/,2415434957,42723996853,2023-06-02 05:16:39,42619765,Z7-852,"Few notes:

1. If you take just the story from any tv-show, film or even book, they are nothing special. They are just same hero's journey one after another. ""Story"" doesn't exist in a vacuum but is always part of art direction, world building and style.
2. Story of Dark Souls as whole is something I haven't countered in any other media. I have read lot of stories of depression, self discovery or sacrifice but none are tied to same kind of grand mythology as Dark Souls. It's story and way it tells it's story are both unique. Or can you tell of a film that tells the same story?
3. Dark souls is not just a story. It's multiple stories and players/chosen undeads story is just one of them.
4. Finally Dark Souls disproves your position by counter example. Video games when done right can be not just good but more unique storytelling medium than anything out there.",3,0
27048156165,2,data_driven_civil_discourse_subset_2,4855832,changemyview,https://www.reddit.com/r/changemyview/comments/1xj2g0/_/cfbruv9/,116783136,27048150741,2014-02-10 16:57:09,NA,buttzillalives,"I have, but I don't recall the answers that I was given. I certainly didn't understand them. Can you explain it?",0,0
29550260172,6,data_driven_civil_discourse_subset_4-9,4855832,changemyview,https://www.reddit.com/r/changemyview/comments/6ph4wy/_/dkpgmoc/,405586978,29550191102,2017-07-25 18:29:28,NA,tildodildo,"no, it is not a problem. but it is when the Waltons own half the wealth of the US and a great percentage of their people are on government assistance. No one works harder than 160mil people so the 'they worked for it' argument is invalid. Also, you know, theyre heirs. ",0,0
30965644531,14,data_driven_civil_discourse_subset_10-19,4855832,changemyview,https://www.reddit.com/r/changemyview/comments/9pb1fp/_/e84588j/,586701061,30961324589,2018-10-20 12:02:53,70698232,fruitoftheloom18,Alright. You got me. How do I award deltas? Can I even do that here? Sorry I’m pretty new to this subreddit.,2,0
31495801686,14,data_driven_civil_discourse_subset_10-19,4855832,changemyview,https://www.reddit.com/r/changemyview/comments/aslvu9/_/egvsc46/,652712049,31495798926,2019-02-20 15:37:19,11257790957,MrObsidy,Yes. I do not debate that. What I debate is that I think this is wrong.,1,0
31844542524,2,data_driven_civil_discourse_subset_2,4855832,changemyview,https://www.reddit.com/r/changemyview/comments/blcfsx/_/emnf29o/,700980225,31844430803,2019-05-06 14:51:14,34303338,elbeanodeldino,I'm not convinced about this. [This article](https://capitalresearch.org/article/party-one-percent/) disputes what you wrote for example.,2,1
32035759292,2,data_driven_civil_discourse_subset_2,4855832,changemyview,https://www.reddit.com/r/changemyview/comments/bvwg50/_/ept9i2k/,718709940,32035477969,2019-06-02 14:19:45,63861015,chronus_poo,"1) The property of resident non-citizens has been seized many times in the past without due process (which I think has been upheld by the courts). Assange is an even worse legal situation because he is not even a resident non-citizen. He is a non-resident. Foreign targets are spied on by the CIA without any warrant, whereas a warrant is needed for domestic targets. That would be a pretty obvious violation of the 4th amendment if we extended the Bill of Rights to everyone on the globe.

2) You're right that I'm taking some liberties with that term. It's the same overall idea, though.",0,0
33383903677,2,data_driven_civil_discourse_subset_2,4855832,changemyview,https://www.reddit.com/r/changemyview/comments/eg1x08/_/fc3wwxp/,873489752,33383870602,2019-12-26 22:52:13,29655499,rollingtank,"You have put up quite a convincing argument here, perhaps the strongest reasoning yet. But isn't it still up to interpretation wether this relationship is a quasi-religious one or something more aligned to a traditional father and son bond?",19,0
37812104904,2,data_driven_civil_discourse_subset_2,4855832,changemyview,https://www.reddit.com/r/changemyview/comments/pqnr3d/_/hdccmvc/,1556432617,37812047573,2021-09-18 15:43:36,22995157,chinmakes5,"Totally agree.  My point isn't the original investors or even the investors who bought into the IPOs.  Why I am saying I don't begrudge Bezos his money.  I'm talking about the people who bought in two years ago, buying from other investors so that money doesn't touch Amazon, but make a fantastic return.",0,1
32843453034,4,data_driven_civil_discourse_subset_4-9,4855832,changemyview,https://www.reddit.com/r/changemyview/comments/dfpkpd/_/f3656ju/,812447761,32841824968,2019-10-10 11:15:30,36942428,Krenztor,"Thanks for your reply!

&amp;#x200B;

Here's a question, let's say you have two theoretical humans.  One has free will and the other doesn't.  Let's not worry about how one can or can't have free will.  Let's just assume that this is the case.  Your job is to test which one has free will and which doesn't.  How would you test this?  When I think of not having free will, I think of someone who acts logically and not based on impulse.  They don't run into walls because it is illogical.  So if someone does run into a wall intentionally, they probably have free will because it makes no sense to run into a wall.  So to me, seeing the ability to act intentionally illogically would seem to suggest free will.

&amp;#x200B;

The thing I've taken away from the other commenters the most in this debate so far is that their reasons for believing there is no free will can often be turned around as proof of free will.  For example, you say that a person being pressured by an outside force can be made to take certain actions.  This is because a person needs to be able to evaluate a large number of things and then apply all of those to make a decision.  This makes sense for a person who can actually make a choice.  If they are under duress or at least feel like they are, they may bow to the person or thing putting them in that position.  But if they have no free will then I'd reason that it makes less sense for them to give in because why would their actions be based on abstract things such as duress?  They would be able to make actions without needing to evaluate such trivial things and do things more coldly and logically.

&amp;#x200B;

Maybe we are also using different criteria to determine what is free will.  You are quite concerned with outside forces affecting our decisions.  This draws me back to the question about the wall.  I don't feel like walking around the wall instead of attempting to walk through it has any indication as to whether I can make a choice or not.  Why should it?  I evaluated the situation and make a decision.  If I choose to eat only after first being influenced by the smell of food, I don't see that as evidence against free will either.  I again evaluated a situation and made a decision.  Clearly there are always going to be outside forces involved in decision making.  Heck, just the ability to breathe affects every decision you make.  If you can't breathe you certainly will make different decisions than if you can breathe.",2,0
39769294501,2,data_driven_civil_discourse_subset_2,4855832,changemyview,https://www.reddit.com/r/changemyview/comments/uw5n50/_/i9pm011/,1867996260,39769147586,2022-05-23 18:11:01,11373704,Funboxtha3rd,"Your 2nd point is interesting to me.  I 100% agree with you that the fact that we live in a society in which women need to be armed is sad.  I'm incredibly skeptical that we could push societal change on a large enough scale in the U.S. to eliminate the need for firearms based on the fact that nearly 250 years later, race is still an issue to the level that the Buffalo shooting happened. I wish one of those people in the store was armed so they could have put that psycho in the dirt.",271,0
39811058369,12,data_driven_civil_discourse_subset_10-19,4855832,changemyview,https://www.reddit.com/r/changemyview/comments/uzxliu/_/iaeh58h/,1874339382,39811035583,2022-05-29 06:59:50,57147760764,Spider-Man-fan,"Are ‘lying’ and ‘deceiving’ the same thing? I definitely think there are cases where lying is ok, or even the morally correct action to take.",1,0
34718189155,3,data_driven_civil_discourse_subset_3,4855832,changemyview,https://www.reddit.com/r/changemyview/comments/hrshr8/_/fy6ba77/,1074604004,34718177708,2020-07-15 19:19:30,21491549,Ansuz07,"If the goal is to increase the number of donor organs - a cause I fully agree with - then lets try positive reinforcement first before we jump to punishing people for their choices.  Maybe tax credits for people who are donors, or a full opt-out system where everyone is assumed to be a donor by default.

We love to start with punishment solutions without even trying others first.

&gt;Doctors would, just as it is now, have a clear set of criteria to decide these cases.

Except now you are giving them criteria that are outside of their medical opinion and into their _moral_ opinion, which is the concern.  I don't like the idea of the people in power getting to decide who lives or dies based on their own moral calculus.  That is too dangerous a door to ever allow to be opened.",270,0
35970422262,4,data_driven_civil_discourse_subset_4-9,4855832,changemyview,https://www.reddit.com/r/changemyview/comments/kuqson/_/givuzg6/,1260962231,35966530655,2021-01-11 14:37:46,22594305,johnnyhavok2,"What a worthless comment.

**Edit -- The irony wasn't lost on me how worthless this comment was, too. [Rectified here.](https://www.reddit.com/r/changemyview/comments/kuqson/cmv_accidentally_offending_someone_is_not_the/gix604x/)**",0,0
43808847390,3,data_driven_civil_discourse_subset_3,4855832,changemyview,https://www.reddit.com/r/changemyview/comments/175vrpm/_/k4inmzi/,2609925898,43808576953,2023-10-12 03:57:53,27748873839,Queso_and_Molasses,"To your first point, there are studies showing that weight stigma impacts hiring. Not being hired because of your weight seems to match your definition of oppression (not given the same opportunity). 


https://bmcpublichealth.biomedcentral.com/articles/10.1186/1471-2458-12-525#:~:text=Obese%20people%20were%20more%20often,most%20pronounced%20in%20obese%20females.",1,0
33473890271,2,data_driven_civil_discourse_subset_2,4855832,changemyview,https://www.reddit.com/r/changemyview/comments/em016s/_/fdlhn1b/,883479556,33473846250,2020-01-08 22:56:56,298270536398,xGodLover77,"What does it have to do with what I said? There’s no contradiction in cultivating food and philosophy, people have been doing it for millennia",1,0
43961478605,6,data_driven_civil_discourse_subset_4-9,4855832,changemyview,https://www.reddit.com/r/changemyview/comments/17jab8x/_/k71j1zh/,2632439409,43959198745,2023-10-30 02:51:52,23174767999018,JianJiaHei,"So if I ask the HR to find me the money owe to me, all she has to find is $100, because I believe my boss is cheating my overtime pay, even if my belief is false, does that make it a crime?

Again, do I think he knew about it and that he belongs to jail? Yes, I just don't know if that phone call is enough to establish a direct linkage of acknowledgement.",1,0
40017564232,7,data_driven_civil_discourse_subset_4-9,4855832,changemyview,https://www.reddit.com/r/changemyview/comments/vl24qr/_/idtfa6g/,1909822851,40017541361,2022-06-26 15:43:59,15392442,Nepene,"You proposed a grand theory, the pleasure principle, in your post.",1,0
43423077651,15,data_driven_civil_discourse_subset_10-19,4855832,changemyview,https://www.reddit.com/r/changemyview/comments/162xin9/_/jy4z95f/,2544502437,43423035459,2023-08-28 20:27:52,18977689,wasframed,"So you just linked the LTC warranty info that they give to their civilian customers?   


So, you admit they sell to civilians?    


You literally just disproved your own point, lol.",1,0
26698186808,13,data_driven_civil_discourse_subset_10-19,4855832,changemyview,https://www.reddit.com/r/changemyview/comments/1cr6hz/_/c9jess8/,81889703,26698182384,2013-04-21 02:28:49,NA,294116002,"But you would presumably be making this speech to a much, much larger audience. I'll assume you're from the U.S, so you'll have the ears of at least 300,000,000 people, and the authority to make them at least listen. Rather than the 11,000 subscribers to this subreddit who may or may not actually read or pay attention to anything at all. ",1,0
30645291213,4,data_driven_civil_discourse_subset_4-9,4855832,changemyview,https://www.reddit.com/r/changemyview/comments/90v2jx/_/e2tey19/,545645229,30645216497,2018-07-22 04:26:30,42189451398,shakes-peare,"87% of the party supports Trump. Most if not all of mainstream conservative news sources are unyieldingly Pro Trump. And their policies have devolved from policies that counter Democrats to, frankly, extreme and nonsensical policies. Their values used to be upholding free market, a strong military, Etc. Not inherently moral or immoral views. Depends on who you ask. Radical and inhumane views have become mainstream now. Waterboarding, withholding human rights from people based on sexual orientation, refusing to give immigrants fair trials. Letting domestic abuse perpetrators own guns. These are immoral things and they've come to light in the mainstream.",9,0
33095104947,18,data_driven_civil_discourse_subset_10-19,4855832,changemyview,https://www.reddit.com/r/changemyview/comments/dv4sqn/_/f7byyer/,838352255,33095081372,2019-11-12 17:45:38,13487895245,fox-mcleod,"This is exactly the issue I pointed out. Your moral instinct is wildly self-inconsistent. We know it isn’t logical. 

Rule 1 of logic — The principle of non-contradiction.

You said “it is immoral because the right to life in inalienable”

Inalienable refers to a right that cannot be surrendered. But now you hold the contradictory view that this doesn’t mean assisted suicide is immoral. 

If I can’t surrender my right to life so that you can eat me **because** that right is inalienable, then I can’t surrender that right for any reason. Including assisted suicide.

I assert that really you’re just grossed out by eating people and your rationalizing it as something to do with a right to life. You can’t actually observe/intuit what is moral. This is just a moral illusion.",1,0
