id	depth	set	subreddit_id	subreddit	permalink	link_id	parent_comment_id	created_utc	author_id	author	body	score	controversiality
40569696005	14	random_sample_10-19	5761260	eyeblech	https://www.reddit.com/r/eyeblech/comments/x41wz1/_/imy5ds5/	2002191661	40566269596	2022-09-03 17:11:23	503452809480	Klutzy_Tune7835	Very true - wording is everything	2	0
40143803044	16	random_sample_10-19	251069408	CrazyFuckingVideos	https://www.reddit.com/r/CrazyFuckingVideos/comments/vw98ox/_/ifwl0o4/	1928630337	40143568566	2022-07-12 20:44:13	501222417534	Chelonate_Chad	Sure thing, keyboard kaptain.	1	0
40630357130	11	random_sample_10-19	4594374	AskReddit	https://www.reddit.com/r/AskReddit/comments/xaxt9t/_/iny9k7e/	2013757553	40630100134	2022-09-11 05:13:32	1510281990655	solmaverick_	Imagine being triggered by advice designed to protect you. Odd. Might want to dive into why you are against yourself.	-10	0
39512292822	12	random_sample_10-19	156167870	unitedstatesofindia	https://www.reddit.com/r/unitedstatesofindia/comments/u7n7zc/_/i5glk9i/	1826826024	39512285861	2022-04-20 09:34:19	NA	[deleted]	Smort loji, here have some cold buttermilk 🥛	2	0
34827567603	11	random_sample_10-19	4594449	news	https://www.reddit.com/r/news/comments/i1lrag/_/fzzfn5f/	1091085928	34827545013	2020-08-01 13:59:32	22789339	Sexploits	Those children were already starving because, and I don't want to disappoint you, but America has been on a long trend of not giving a shit about the poors and it hasn't slowed. Their not caring comes in the form of zero social support programs, and these many zeroes of programs is why lockdown is so untenable for the richest country in the world despite its massive success and relative ease of accomplishment in ... *checks notes* literally every other country.

This nonsense that lockdown is impossible is only a reality in the late stage capitalist shithole known as America, and it's so baked into the culture that it has produced a most disappointing and sad result -- people like you unironically demanding and claiming that, due to persistent and deliberate institutional failures of your government and a total lack of social and political accountability by both the government and wider society, pushing everyone out of lockdown into a situation where 3-10 *million* people die is not just acceptable, but necessary.	7	0
28771811358	17	random_sample_10-19	4675745	AdviceAnimals	https://www.reddit.com/r/AdviceAnimals/comments/53ij0b/_/d7tzrq6/	308234171	28771797441	2016-09-20 01:30:00	NA	RevDrStrangelove	She was hiding evidence - deliberately. That evidence most certainly was under subpoena. She then, a year later, destroyed that evidence. Nothing you say will change that.	2	0
39925304545	2	random_sample_2	4621302	writers	https://www.reddit.com/r/writers/comments/vbf8qv/_/icahu5d/	1893638407	39922952911	2022-06-14 04:07:52	787436046230	AnyAdvertising7623	indeed, thanks for clarification!	1	0
39268860957	2	random_sample_2	4806006	CombatFootage	https://www.reddit.com/r/CombatFootage/comments/tirbdg/_/i1fnz19/	1785026644	39268820227	2022-03-20 18:41:16	54715172	Majikmippie	So that when it gets peeled open by St. Javelin it's still tacticool	2	0
38532241123	2	random_sample_2	4981470	PublicFreakout	https://www.reddit.com/r/PublicFreakout/comments/rk6mqa/_/hp93nj7/	1666488466	38530575597	2021-12-20 03:30:49	55555347	KissTheDragon	Honestly, why *must* you do this? You just can't help yourself, huh?	2	0
35501882864	2	random_sample_2	4598982	Scotland	https://www.reddit.com/r/Scotland/comments/jnvvo0/_/gb4wk4w/	1188975888	35500652606	2020-11-04 17:32:00	494452677231	Ok-Philosophy4182	Mate what are you on about. 50 deaths in Scotland is a much higher rate than 359 in England.	1	0
27251323328	2	random_sample_2	4685621	talesfromtechsupport	https://www.reddit.com/r/talesfromtechsupport/comments/29tu92/_/cioqfnk/	137441126	27250884040	2014-07-04 22:44:55	NA	silentdragon95	Whenever I have to fix problems for people like these I always install an adblocker. It actually ""makes the computer go faster"" and also minimizes the risk of viruses and toolbars getting installed.	2	0
36805171143	2	random_sample_2	5845882	FreeKarma4U	https://www.reddit.com/r/FreeKarma4U/comments/n3bjfa/_/gwoujt3/	1396299286	36805047228	2021-05-02 17:53:36	NA	[deleted]	[removed]	1	0
30354962746	3	random_sample_3	4813832	BravoRealHousewives	https://www.reddit.com/r/BravoRealHousewives/comments/8eyef6/_/dy0k75m/	508849026	30354001242	2018-04-26 18:27:00	NA	rackcity113	Carole was the worst imo. Know your audience, lady! You are in the Hamptons at a seated dinner party. Her “major fashion moment” was cringeworthy. 	25	0
42591123524	3	random_sample_3	171144630	ididnthaveeggs	https://www.reddit.com/r/ididnthaveeggs/comments/13imss3/_/jkdnl8k/	2389477683	42586193428	2023-05-16 15:50:31	8349591	z0mbiegrl	I suspect they were looking for Mexican Street Corn.	2	0
39885695132	3	random_sample_3	5229648	norsemythology	https://www.reddit.com/r/norsemythology/comments/i105s9/_/ibmwvbw/	1090078281	39884254697	2022-06-08 18:05:42	814380364754	AshTBRM_2	Ah alright, thanks for clearing that up	1	0
28300656394	3	random_sample_3	4856177	hearthstone	https://www.reddit.com/r/hearthstone/comments/45wot7/_/d01ha8a/	251787931	28300109095	2016-02-16 03:19:49	NA	32Ash	Turn 9 saraad + hero -&gt; Turn 10 Justicar x2 hero power happens more often then you'd expect. It works particularly well when you bait out removal through other stuff (like Sylvanas and Voljin). I find I pull it off the most in Priest mirror or when I am up against a minion based build and have a taunt wall.	1	0
42955839847	3	random_sample_3	374541449	2westerneurope4u	https://www.reddit.com/r/2westerneurope4u/comments/14ooaa0/_/jqesq5j/	2460090888	42954853555	2023-07-02 18:34:33	NA	[deleted]	[removed]	1	0
34662913655	3	random_sample_3	4686089	guitarporn	https://www.reddit.com/r/guitarporn/comments/hmnu60/_/fx9ejcn/	1065988728	34659582914	2020-07-07 23:57:24	256030036144	asoiafgeek	I offer a blood sacrafice	1	0
40629720809	9	random_sample_4-9	4594374	AskReddit	https://www.reddit.com/r/AskReddit/comments/xaxt9t/_/inxvx7t/	2013757553	40629685291	2022-09-11 03:06:40	1136029536760	SereneBabe0312	Lmao I know they're so mad and I'm like where is this suddenly massive population of falsely accused men? Introduce us, please	5	0
41713097384	4	random_sample_4-9	4637473	ar15	https://www.reddit.com/r/ar15/comments/10l2v1y/_/j5uwfxk/	2212187830	41712886426	2023-01-25 19:04:54	7392928247	qtstance	Plenty of m16s out there that look worse than this. Lots of them are in Afghanistan.

Here's one that's seen 60 years of use. 

https://imgur.com/a/StqG1Rl	52	0
39885986139	9	random_sample_4-9	4976867	oddlyterrifying	https://www.reddit.com/r/oddlyterrifying/comments/v7357j/_/ibn33vf/	1886355487	39885968792	2022-06-08 18:49:38	1030583624065	SugOnDeez_	AGAIN, SUCK A DICK.  Your mom shouldve kept her planned parenthood appointment .	1	0
41237703661	7	random_sample_4-9	5181103	CitiesSkylines	https://www.reddit.com/r/CitiesSkylines/comments/z4dzn8/_/ixzv3sd/	2123687348	41226752199	2022-11-27 18:12:16	154769023017	hiro_ninja	Well that is sad to hear! 

I built amusement park just to see about visitor numbers and I notice it does fluctuate quite a bit, I saw number from 115 to as low as 24. The price didn't seem to affect the visits at all.  And knowing your overall visits are high I would say your park is it's working normally.	1	0
27298284334	6	random_sample_4-9	4672368	DotA2	https://www.reddit.com/r/DotA2/comments/2cl4ah/_/cjgoyzy/	142073081	27298270202	2014-08-04 17:20:20	NA	ArcticSquirrel	He has a friend who plays League, who said ""why would you want to kill your own army""	30	0
40628577587	7	random_sample_4-9	4594374	AskReddit	https://www.reddit.com/r/AskReddit/comments/xaxt9t/_/inx7f3n/	2013757553	40628535960	2022-09-10 23:50:28	833385046664	NewCoconut8548	Body odor is different, it’s something you can’t just ignore and it totally makes sense that you wouldn’t stand next to someone who smells bad, stretch marks, body hair and periods are normal and they shouldn’t be considered gross because it’s not neglected self hygiene. They are very two different things so no, you are not an asshole	14	0
