id	depth	set	subreddit_id	subreddit	permalink	link_id	parent_comment_id	created_utc	author_id	author	body	score	controversiality
35197640838	3	eli5_3	4697437	explainlikeimfive	https://www.reddit.com/r/explainlikeimfive/comments/iwpdz5/_/g63rlhi/	1143323393	35194480602	2020-09-21 14:16:45	608591749936	shyruken111	How we handle stress increases this in our body... Blood has a saturation percentage that propogates oxygen where the body needs it most... In times of stress it is mitigated from extremities to keep the brain and heart going more... Depending on how much anxiety you have you will notice pins and needles... That is the lack of oxygen in those areas... Your mind slowly over time can learn how to handle stress better and you are able to control that instinctual process... Also increasing your immune system will help your body protect itself again stress and will help prevent stress from creating a cascade effect in your body	2	0
27724016480	3	eli5_3	4697437	explainlikeimfive	https://www.reddit.com/r/explainlikeimfive/comments/336ljy/_/cqi5w0w/	186745246	27723797134	2015-04-20 03:51:10	NA	nofftastic	It's a new shape that they don't know how to escape. If they got stuck somewhere in their natural environment, eventually they'd figure a way out. If they get caught in a trap, they've only got until the fisherman comes back to get out. This is also presupposing that they *want* to get out. Most traps have bait, which encourages them to stay.	2	0
39329257350	3	eli5_3	4697437	explainlikeimfive	https://www.reddit.com/r/explainlikeimfive/comments/tq7rrb/_/i2fmh6u/	1797551687	39329223847	2022-03-28 13:13:39	398136676252	Useful-Shoulder4776	Agreed. But I think it’s way harder for women to go bald than it is for men. It’s far less common for women to go bald.	2	0
42961808309	3	eli5_3	4697437	explainlikeimfive	https://www.reddit.com/r/explainlikeimfive/comments/14pcobh/_/jqicng5/	2461228829	42961211731	2023-07-03 14:31:53	997282872680	RimpleDoRimpleDont	Technically, this is 100% false and just an adopted Reddit antiwork narrative. See other comments on this thread, backed with government statistics.	2	0
26926103099	3	eli5_3	4697437	explainlikeimfive	https://www.reddit.com/r/explainlikeimfive/comments/1qb8gp/_/cdb3u4b/	104660377	26926102008	2013-11-10 18:06:39	NA	[deleted]	[deleted]	4	0
27969011575	3	eli5_3	4697437	explainlikeimfive	https://www.reddit.com/r/explainlikeimfive/comments/3ivizl/_/cuk0zg7/	213102561	27968987287	2015-08-29 20:12:12	NA	corpuscle634	&gt;I once heard that every particle might have an anti-particle, does it have anything to do with that?

That's true, yup. If you've ever heard of a PET scan, that stands for ""positron emission tomography."" The positron is the antiparticle of the electron.

Antiparticles are an important part of the Standard Model and are very well understood. They act just like regular particles, but all their properties (except mass) are the opposite. An electron has negative charge, but a positron has positive. When matter and antimatter meet, they ""annihilate"" and form radiation, usually gamma.

The real question about antimatter isn't what its properties and so on are, but why there's so much more matter than antimatter in the universe. We can explain why there should be slightly more matter than antimatter, but not the amount that we see.

&gt;So if this turns out to be true, what changes? Do we have to go back to the drawing board?

No, not really. The Standard Model still works perfectly fine in some contexts. You just have to know which model to use.

It's just like how it's perfectly fine to use Newtonian physics to predict the trajectory of a baseball. Newton certainly wasn't right about everything, but he got baseballs right, so that's still useful. Also, if I have some new idea which disagrees with what Newton says about how baseballs behave, I know my idea is wrong, so that saves me the time of exploring it further.

We already know that the Standard Model doesn't work completely. It doesn't describe gravity, for one thing, and it can't explain why neutrinos have mass (in the Standard Model they are massless, which is not true). What physicists are doing now is working out ""extensions"" to the Standard Model which introduce new particles and so on to fix its problems. Another approach is in string theory, which is sort of a different ""road"" you can take to get the same physics that the Standard Model predicts.

So if this turns out to be true, we may start working on adding a fifth force to the Standard Model, or introduce a new mechanism to one of the existing forces that we didn't think would be there.	10	0
35413464045	6	eli5_4-9	4697437	explainlikeimfive	https://www.reddit.com/r/explainlikeimfive/comments/jfzeqw/_/g9o9fql/	1175703656	35411967801	2020-10-22 18:36:33	5763262	omnilynx	In hex, ""15\*16+15"" would be written, ""F\*10+F"".	1	0
34131933818	5	eli5_4-9	4697437	explainlikeimfive	https://www.reddit.com/r/explainlikeimfive/comments/g78ucq/_/foh9soq/	979628714	34131764822	2020-04-24 21:06:43	10156874	Mundokiir	Just curious, how many antacids were you consuming? I get heartburn frequently and tums are my best friend.	3	0
26805664376	5	eli5_4-9	4697437	explainlikeimfive	https://www.reddit.com/r/explainlikeimfive/comments/1j5ps0/_/cbbef08/	92645568	26805651738	2013-07-27 15:12:45	NA	pocketknifeMT	I hadnt thought about that sort of thing... If you were to shatter a gumball machine on the floor,  would most just have the propensity to stay where they fell rather than roll around wildly? 	1	0
43380101579	7	eli5_4-9	4697437	explainlikeimfive	https://www.reddit.com/r/explainlikeimfive/comments/15z3e9z/_/jxfe4ln/	2538058247	43380022876	2023-08-23 15:55:27	30135680	siggydude	Get it right from the tap 🤤	1	0
27669123660	7	eli5_4-9	4697437	explainlikeimfive	https://www.reddit.com/r/explainlikeimfive/comments/2zooy8/_/cplhcgc/	180870992	27668982319	2015-03-20 22:23:13	NA	Hybrazil	Fine. Scottish was just what popped in my head initially	3	0
42343352600	10	eli5_10-19	4697437	explainlikeimfive	https://www.reddit.com/r/explainlikeimfive/comments/12m1t1j/_/jga4zyw/	2334750535	42343119874	2023-04-14 21:21:42	634349639573	kmurp1300	From the AAMC:

The concern stems from a two-decade long congressionally imposed cap on federal support for graduate medical education (GME) through the Medicare program, which is the largest public contributor to GME funding for residencies. The Medicare cap effectively freezes a teaching hospital’s Medicare GME support at 1996 levels — despite efforts by teaching hospitals, medical schools, physicians, and the AAMC, among others, to get Congress to raise the cap to fund more graduate training slots and help meet the health needs of the U.S aging population.	14	0
31684040789	7	eli5_4-9	4697437	explainlikeimfive	https://www.reddit.com/r/explainlikeimfive/comments/b8a0dz/_/ejzuyc5/	679031927	31680064910	2019-04-03 02:25:23	109014268083	dumbestbell	I'd argue Pakistan has a similar level of diversity of domestic cultures, but once again that only confirms the argument that the subcontinent has that. 

You could make the argument that New World countries with large indigenous communities also have that level of diversity, but it's a lot more isolated and limited as compared to the countries of the subcontinent. Additionally I'd argue much of Africa has that too, especially since tribes with diverse cultures and languages were haphazardly split and lumped together by European colonialists.

Part of the reason it's less common now is that European countries were once linguistically and culturally diverse, but many centuries of ethnic conflicts slowly led to specific subcultures carving out their own local monopolies, and retaining complete sovereignty from one another. Whereas in the Indian subcontinent, the various cultures became connected under a single sovereign umbrella. Part of it is due to colonialism, part of it due to the fact that the Indian subcontinent is a distinct geological entity (especially due to the greater Himalayas) that made more sense to colonize as one large entity, and the British became its sole colonial rulers for most of its history (as opposed to, say, in Africa where the entire continent just got carved up separately during the colonial era).	1	0
27678103693	11	eli5_10-19	4697437	explainlikeimfive	https://www.reddit.com/r/explainlikeimfive/comments/30b1qa/_/cpqtthp/	181913986	27678087433	2015-03-25 23:59:05	NA	Gemmabeta	WAKE UP SHEEPLE.	1	0
28013305229	11	eli5_10-19	4697437	explainlikeimfive	https://www.reddit.com/r/explainlikeimfive/comments/3lsff0/_/cvaecnh/	217996812	28013233287	2015-09-22 17:40:24	NA	mischiffmaker	So, in your limited world view, women who don't want babies should never have sex. Got it. 	1	0
27678418215	20	eli5_10-19	4697437	explainlikeimfive	https://www.reddit.com/r/explainlikeimfive/comments/30b1qa/_/cpr0k6f/	181913986	27678412577	2015-03-26 03:21:35	NA	dmartination	Ok lets say its not environmental. Its just 1 in 68 people are now being born autistic because of no reason?	1	0
32717978702	10	eli5_10-19	4697437	explainlikeimfive	https://www.reddit.com/r/explainlikeimfive/comments/d7jvk8/_/f13ftxq/	798744968	32717356087	2019-09-22 13:43:07	8568891	garnet420	If you are wearing your tiara, your friends should be talking from beneath you.	5	0
27705124422	10	eli5_10-19	4697437	explainlikeimfive	https://www.reddit.com/r/explainlikeimfive/comments/320c57/_/cq6wyti/	184773499	27705120337	2015-04-09 20:01:06	NA	TheUnfabulousKilljoy	Well done, I'm leaving it.	21	0
29202832183	2	eli5_2	4697437	explainlikeimfive	https://www.reddit.com/r/explainlikeimfive/comments/5zifc6/_/deym1iv/	361977126	29202773466	2017-03-15 14:59:48	NA	skyfullofstars_12	When you want to get out of paralysis, wiggle your toes. I know this sounds silly but it works really good for me, just keep doing it until I regain feeling of my body.	2	0
27771767006	2	eli5_2	4697437	explainlikeimfive	https://www.reddit.com/r/explainlikeimfive/comments/36412m/_/cralcke/	191664238	27771746711	2015-05-16 00:34:41	NA	bad-monkey	This, it's all about matching the pasta shape to the sauce. 	1	0
27213333158	2	eli5_2	4697437	explainlikeimfive	https://www.reddit.com/r/explainlikeimfive/comments/27m0ee/_/ci24692/	133716614	27213327704	2014-06-08 11:50:37	NA	reds824	The hostthename ''unlimit your web'' 1.95 monthly a good starting point for a small sports blog with small-average traffic you think?	1	0
31013468923	2	eli5_2	4697437	explainlikeimfive	https://www.reddit.com/r/explainlikeimfive/comments/9th5r7/_/e8wm9rv/	593705059	31012923876	2018-11-02 11:19:12	9222770	DerCatzefragger	That's. . . actually a very good answer to what was meant as a smartass question. Giddy exuberance is just as good of an explanation as arrogant boastfulness with the added bonus that it doesn't automatically assume the worst in people.

Heh. . . Well done, Dodgeball.	1	0
39874300800	2	eli5_2	4697437	explainlikeimfive	https://www.reddit.com/r/explainlikeimfive/comments/v660ca/_/ibg4neo/	1884809530	39871615519	2022-06-07 03:27:41	32669010	Captain_Fajita	I'm just loving that umich webpage that was last edited the week after Y2K. And the little sperm and egg gif.	2	0
30209444830	2	eli5_2	4697437	explainlikeimfive	https://www.reddit.com/r/explainlikeimfive/comments/83vmuj/_/dvlx8ta/	490244203	30208779705	2018-03-13 02:03:52	NA	trey1599	I am pretty sure giraffes are the only ruminant animal in the mentioned list. Elephants, for example, barely digest their food and just eat a bunch.	3	0
