	body	count_sents	all_passives	passive_count	passive_sents_count	passive_percentages	binary	full_passive_matches	full_passive_count	full_passive_sents_count	full_passive_percentages	binary_full_passive	truncated_passive_matches	truncated_passive_count	truncated_passive_sents_count	truncated_passive_percentages	binary_truncated_passive	Unnamed: 0	subreddit_id	subreddit	id	permalink	link_id	parent_comment_id	created_utc	author_id	author	score	controversiality	comment_length	n_of_quotes	contains_links	contains_paragraphs	readability_score
54	It sounds to me like the game logic pauses when the window loses focus. This might be some form of anti-cheat functionality built into the game.	2	[]	0	0	0.0	0	[]	0	0	0.0	0	[]	0	0	0.0	0	54	4697437	explainlikeimfive	27826438759	https://www.reddit.com/r/explainlikeimfive/comments/39wbpu/_/cs755k7/	198023250	27826411073.0	2015-06-15 13:15:09		Karai17	2	0	26	0	False	False	75.2
55	Reddit Rule 154: Whenever German is used on a default subreddit, the thread will turn into Du Hast within three messages.	1	['is used']	1	1	1.0	1	[]	0	0	0.0	0	['is used']	1	1	1.0	1	55	4697437	explainlikeimfive	27849542481	https://www.reddit.com/r/explainlikeimfive/comments/3bbnb6/_/cskwci9/	200417730	27849518843.0	2015-06-27 22:50:34		TheSpoom	45	0	21	0	False	False	58.62
56	So much gold...	1	[]	0	0	0.0	0	[]	0	0	0.0	0	[]	0	0	0.0	0	56	4697437	explainlikeimfive	27849668554	https://www.reddit.com/r/explainlikeimfive/comments/3bbnb6/_/cskz1sa/	200417730	27849448666.0	2015-06-28 00:24:58		baconbash	1	0	3	0	False	False	119.19
57	nice the parallel with radiators.	1	[]	0	0	0.0	0	[]	0	0	0.0	0	[]	0	0	0.0	0	57	4697437	explainlikeimfive	29071628705	https://www.reddit.com/r/explainlikeimfive/comments/5pnu2o/_/dcshw9t/	345433344	29071627544.0	2017-01-23 10:22:35		pier4r	1	0	5	0	False	False	32.56
58	/r/OtherTimesItsTH5  It's a thing now...	2	[]	0	0	0.0	0	[]	0	0	0.0	0	[]	0	0	0.0	0	58	4697437	explainlikeimfive	28040189299	https://www.reddit.com/r/explainlikeimfive/comments/3noyd3/_/cvqekj7/	221193975	28039721809.0	2015-10-06 19:05:20		Mack99	1	0	5	0	False	False	66.4
59	Glad they did that, even though I keep a penny inside my grinder lol.  	1	[]	0	0	0.0	0	[]	0	0	0.0	0	[]	0	0	0.0	0	59	4697437	explainlikeimfive	28082635566	https://www.reddit.com/r/explainlikeimfive/comments/3qj6x6/_/cwfoca6/	225963978	28082631959.0	2015-10-28 08:29:58		drkpie	1	0	14	0	False	False	99.57
60	except it is 683 not 685 =p	1	[]	0	0	0.0	0	[]	0	0	0.0	0	[]	0	0	0.0	0	60	4697437	explainlikeimfive	28085298292	https://www.reddit.com/r/explainlikeimfive/comments/3qllkg/_/cwh9eus/	226076272	28083562821.0	2015-10-29 16:00:31		zeradragon	2	0	7	0	False	False	106.67
61	I wonder: what's the evolutionary advantage of releasing dopamine during a pretty song?	1	[]	0	0	0.0	0	[]	0	0	0.0	0	[]	0	0	0.0	0	61	4697437	explainlikeimfive	27756347129	https://www.reddit.com/r/explainlikeimfive/comments/35312t/_/cr1euih/	189937973	27755383927.0	2015-05-07 14:38:44		fwau	1	0	13	0	False	False	41.36
62	Dunno, but it is disgusting to me.  	1	[]	0	0	0.0	0	[]	0	0	0.0	0	[]	0	0	0.0	0	62	4697437	explainlikeimfive	28140979421	https://www.reddit.com/r/explainlikeimfive/comments/3ud3qx/_/cxeeuot/	232398393	28140951194.0	2015-11-27 04:20:49		Pug_grama	-5	0	7	0	False	False	81.29
63	"What about imagining someone you know really well?

If I imagine something like an apple, I see it on the back of my mind and not really clear. But imagining faces is a lot more difficult. Like, if I try to imagine my best friend or my mom I have a few characteristics that identify them (red hair, their eyeshape, a scar) but I'm imcapable of putting all of them together. But if I see them in real life, I can definitely distinguish them from a person that looks similar
I thought that was the norm until now."	6	[]	0	0	0.0	0	[]	0	0	0.0	0	[]	0	0	0.0	0	63	4697437	explainlikeimfive	33069662728	https://www.reddit.com/r/explainlikeimfive/comments/dtcui9/_/f6wtn2g/	835368561	33069267147.0	2019-11-08 17:36:28	58244152319.0	thatidiotcat	3	0	98	0	False	True	68.5
64	"So, ""cut of his dick with a plastic spoon"" is probably not in the original lyrics."	1	[]	0	0	0.0	0	[]	0	0	0.0	0	[]	0	0	0.0	0	64	4697437	explainlikeimfive	36015880779	https://www.reddit.com/r/explainlikeimfive/comments/kyxjod/_/gjmxbgr/	1267995613	36014055812.0	2021-01-17 19:13:11	5794994.0	frodegar	3	0	16	0	False	False	80.62
