	body	count_sents	all_passives	passive_count	passive_sents_count	passive_percentages	binary	full_passive_matches	full_passive_count	full_passive_sents_count	full_passive_percentages	binary_full_passive	truncated_passive_matches	truncated_passive_count	truncated_passive_sents_count	truncated_passive_percentages	binary_truncated_passive	Unnamed: 0	subreddit_id	subreddit	id	permalink	link_id	parent_comment_id	created_utc	author_id	author	score	controversiality	comment_length	n_of_quotes	contains_links	contains_paragraphs	readability_score
0	Then why don't they just reduce the budget to close to nothing, instead?	1	[]	0	0	0.0	0	[]	0	0	0.0	0	[]	0	0	0.0	0	0	4697437	explainlikeimfive	27964234302	https://www.reddit.com/r/explainlikeimfive/comments/3ika61/_/cuh6la6/	212577913	27964227759.0	2015-08-27 05:43:07		ilikeostrichmeat	2	0	13	0	False	False	83.66
1	In the UK school ends in July and starts in September. So it fits in quite well with the harvest.	2	[]	0	0	0.0	0	[]	0	0	0.0	0	[]	0	0	0.0	0	1	4697437	explainlikeimfive	27971797384	https://www.reddit.com/r/explainlikeimfive/comments/3iyyze/_/culoozs/	213263258	27971786975.0	2015-08-31 10:38:08		AlbertDock	3	0	20	0	False	False	95.17
2	"> Are you ignoring the months of Musk's very public attempts to get out of the purchase? 

No, I'm not ignoring it, I'm **directly addressing it**. 

https://www.google.com/finance/quote/QQQ:NASDAQ?sa=X&ved=2ahUKEwiT_8fs6siBAxUXlWoFHYalBTgQ3ecFegQIHxAf&window=5Y

Zoom to a five year view. That local peak right after the beginning of 2022 is where he made the offer. The NASDAQ then plummeted over 20% over the next month, dragging all tech valuations down with it. Then Musk started to to try and get out of the deal. 

Both of our explanations have speculation, but mine has some evidence behind it and it correlates with how you would expect an impulsive human to behave when confronted with this scenario."	8	[]	0	0	0.0	0	[]	0	0	0.0	0	[]	0	0	0.0	0	2	4697437	explainlikeimfive	43675565998	https://www.reddit.com/r/explainlikeimfive/comments/16sntc2/_/k2bayem/	2587719746	43675454286.0	2023-09-26 17:50:36	23517184.0	deja-roo	1	0	108	1	False	True	55.95
3	"Well, it can be aggravated by other circumstances. By ""reformat"" I assumed the OP meant that they took their OS disk and did a complete re-install via reformat, as reformatting usually means wiping a disk clean.

An updated, larger OS should not degrade computer performance much. (Note: I do not include brand new OS's, ie Win7 v. Win XP, just updates like Service Packs). 

Also, Hard drive performance can degrade. RAM can degrade as well, but usually RAM errors just cause the computer to not boot at all. So for physical degradation, usually it's the CPU, GPU, or other complicated IC, or it's the hard drive. Most other components, degradation = hard failure.

If you have a 10 year old computer, AND you are using the latest software, it's not going to be pretty. Hardware performance down and software demands up... somethings gotta give.
"	10	['can be aggravated']	1	1	0.1	1	['can be aggravated by']	1	1	0.1	1	[]	0	0	0.0	0	3	4697437	explainlikeimfive	26349926865	https://www.reddit.com/r/explainlikeimfive/comments/pt2vu/_/c3s2dox/	43347162	26349894893.0	2012-02-17 03:09:37		Zagaroth	2	0	144	0	False	True	67.86
4	No. Blood just wants to flow along a path, and if the path is closed by a clot then it still flows as best it can to wherever it needs to be. There are valves in blood vessels that keep blood flowing only in one way, such that it (normally) *can't* flow against the current. If it ever did, you'd be weak and sick from lack of oxygen.	4	['closed by a clot']	1	1	0.25	1	['closed by a clot']	1	1	0.25	1	[]	0	0	0.0	0	4	4697437	explainlikeimfive	29606734630	https://www.reddit.com/r/explainlikeimfive/comments/6ts3r5/_/dln32na/	412817153		2017-08-15 05:00:39		ElfMage83	6	0	68	0	False	False	90.73
5	So we need a flash. Let's load some nukes on a rocket and send them on the way!	2	[]	0	0	0.0	0	[]	0	0	0.0	0	[]	0	0	0.0	0	5	4697437	explainlikeimfive	27089416415	https://www.reddit.com/r/explainlikeimfive/comments/206wcg/_/cg0c7hb/	121254208	27089414063.0	2014-03-12 01:35:59		StrewwelChris	3	0	18	0	False	False	104.64
6	That's why I love my american spirits. There not any safer but I buy half as many packs as I used too.	3	[]	0	0	0.0	0	[]	0	0	0.0	0	[]	0	0	0.0	0	6	4697437	explainlikeimfive	27108378197	https://www.reddit.com/r/explainlikeimfive/comments/21azj2/_/cgbmmhh/	123124574	27107876126.0	2014-03-25 18:04:12		[deleted]	1	0	22	0	False	False	102.61
7	So? If you can take over the controls easily then you could have corrected anything incorrect your auto car might be doing. 	2	[]	0	0	0.0	0	[]	0	0	0.0	0	[]	0	0	0.0	0	7	4697437	explainlikeimfive	30263728761	https://www.reddit.com/r/explainlikeimfive/comments/886f0v/_/dwi8qk9/	497465743	30263716904.0	2018-03-30 00:44:53		BeyBeyBlackSheep	1	0	22	0	False	False	57.61
8	What's an e-ink screen? Do they not use backlights?	2	[]	0	0	0.0	0	[]	0	0	0.0	0	[]	0	0	0.0	0	8	4697437	explainlikeimfive	27000283733	https://www.reddit.com/r/explainlikeimfive/comments/1ujty2/_/cej9s9h/	111779930	26999925004.0	2014-01-07 03:34:42		tubular1450	1	0	9	0	False	False	109.21
9	"That is unfortunate :( 

What if the VPN is located outside of the US? Unfortunately this would likely mean slow speeds though."	3	['is located']	1	1	0.3333333333333333	1	[]	0	0	0.0	0	['is located']	1	1	0.3333333333333333	1	9	4697437	explainlikeimfive	27010671809	https://www.reddit.com/r/explainlikeimfive/comments/1v75up/_/cepgfr5/	112868449	27010666039.0	2014-01-14 18:51:04		Fuck-The-Moderators	8	0	22	0	False	True	69.28
10	[Because some are involved](http://www.spiegel.de/international/world/edward-snowden-accuses-germany-of-aiding-nsa-in-spying-efforts-a-909847.html)	1	[]	0	0	0.0	0	[]	0	0	0.0	0	[]	0	0	0.0	0	10	4697437	explainlikeimfive	26819642382	https://www.reddit.com/r/explainlikeimfive/comments/1jyiyk/_/cbjq0i6/	93989756	26819322907.0	2013-08-08 19:58:34		LtTimec	1	0	4	0	True	False	
11	Why do you still need to depend on drugs after 9 YEARS? Maybe you should try and fix the issue rather than putting a bandaid on it.	2	[]	0	0	0.0	0	[]	0	0	0.0	0	[]	0	0	0.0	0	11	4697437	explainlikeimfive	27164233000	https://www.reddit.com/r/explainlikeimfive/comments/24mqx5/_/ch8vsbs/	128712137	27164095009.0	2014-05-04 00:11:09		[deleted]	-13	0	27	0	False	False	100.07
12	The civil/structural assumes the full weight of the snow when designing the structure.	1	[]	0	0	0.0	0	[]	0	0	0.0	0	[]	0	0	0.0	0	12	4697437	explainlikeimfive	39524901781	https://www.reddit.com/r/explainlikeimfive/comments/u8uhc5/_/i5o3ted/	1828844357	39524292833.0	2022-04-21 21:24:14	47611847.0	Elfich47	0	0	13	0	False	False	66.74
13	"&gt; Blackjack is the most fair and subsequently bad for the casino   

Excluding poker and sportsbooks, Blackjack isn't even that good.  
If you're playing perfectly on a table that allows it (hint: most tables don't allow it) it is great, but nowadays with machine shuffling, the ""bonus game"", 8 decks, and other rules, the percentage return is actually pretty abysmal."	4	[]	0	0	0.0	0	[]	0	0	0.0	0	[]	0	0	0.0	0	13	4697437	explainlikeimfive	40933920887	https://www.reddit.com/r/explainlikeimfive/comments/y843px/_/isyzzhz/	2069478357	40933096782.0	2022-10-19 18:59:10	14032761.0	death_hawk	1	0	60	1	False	True	49.49
14	But what if they like move backwards, like reverse on a car	1	[]	0	0	0.0	0	[]	0	0	0.0	0	[]	0	0	0.0	0	14	4697437	explainlikeimfive	41022573653	https://www.reddit.com/r/explainlikeimfive/comments/yhfmp4/_/iufs4et/	2085132712	41018691245.0	2022-10-31 00:02:49	636381615127.0	ionee123	1	0	12	0	False	False	93.14
15	You like totally and literally should be 	1	[]	0	0	0.0	0	[]	0	0	0.0	0	[]	0	0	0.0	0	15	4697437	explainlikeimfive	31114158011	https://www.reddit.com/r/explainlikeimfive/comments/a0qiuc/_/eakkdyz/	605899236	31114130215.0	2018-11-27 14:26:22	27264825.0	divinelyshpongled	-1	0	7	0	False	False	55.91
16	Under Armour is also a huge employer of illegals. They use a dirty hiring agency so they have plausible deniability.  I have witnessed this first hand and as much as I love UA i refuse to wear it.  I am sure other companies engage in this as well, its just that I have personally witnessed this.	4	[]	0	0	0.0	0	[]	0	0	0.0	0	[]	0	0	0.0	0	16	4697437	explainlikeimfive	28212214414	https://www.reddit.com/r/explainlikeimfive/comments/3zaad5/_/cyktnym/	240665081	28212055720.0	2016-01-03 22:28:52		leggo_my_jhncena_pog	9	0	56	0	False	False	74.19
17	I'm sure there are examples where an attempted murderer got a longer sentence than an actual murderer -- it would depend upon the jurisdiction, the jury, the skill of the defense attorney at the sentencing hearing, the circumstances surrounding the murder attempt (and whether or not there were other charges that the person was found guilty for).  Someone convicted of 125 counts of attempted murder (say, for an arson at an occupied building or something filed under RICO statutes) could quite easily get a much longer sentence than someone convicted of one count of murder. But generally, given *identical* circumstances, someone convicted of attempted murder is going to get a shorter sentence than someone convicted of murder (that being said, there is never going to be a situation with _identical_ circumstances).	3	['was found']	1	1	0.3333333333333333	1	[]	0	0	0.0	0	['was found']	1	1	0.3333333333333333	1	17	4697437	explainlikeimfive	28260051123	https://www.reddit.com/r/explainlikeimfive/comments/42uvsq/_/czdaz03/	246664826	28260037222.0	2016-01-27 01:26:56		esk_209	3	0	131	0	False	False	27.53
18	What about an ancient Bostonian athlete’s burial site?	1	[]	0	0	0.0	0	[]	0	0	0.0	0	[]	0	0	0.0	0	18	4697437	explainlikeimfive	39604698488	https://www.reddit.com/r/explainlikeimfive/comments/uga5g3/_/i6zm4xk/	1841332755	39602805921.0	2022-05-02 04:00:17	17585278.0	Dodecahedrus	31	0	8	0	False	False	63.36
19	That's how almost all games are	1	[]	0	0	0.0	0	[]	0	0	0.0	0	[]	0	0	0.0	0	19	4697437	explainlikeimfive	27481159092	https://www.reddit.com/r/explainlikeimfive/comments/2nu9py/_/cmhkm2c/	160975798	27480214937.0	2014-12-01 03:21:30		LithePanther	0	0	6	0	False	False	99.23
20	"&gt; I'm actually shocked by how many people from so many different countries are saying credit cards are rare.

I think they are rare in the sense that locals don't use them that often, not that they aren't accepted. I don't think I was ever in a situation where a credit card didn't work but a debit one did. Some places used to charge extra fees if you paid with a credit card, but there is now some European legislation which prevents them from doing it."	6	"[""'m actually shocked"", ""aren't accepted""]"	2	2	0.3333333333333333	1	"[""'m actually shocked by""]"	1	1	0.16666666666666666	1	"[""aren't accepted""]"	1	1	0.16666666666666666	1	20	4697437	explainlikeimfive	33742156210	https://www.reddit.com/r/explainlikeimfive/comments/f5nx60/_/fi17icy/	916506792	33740774882.0	2020-02-18 18:56:11	40756922.0	andreipoe	1	0	86	1	False	True	75.03
21	They still don’t trust computers and remote desk staff to trade that much at once?	1	[]	0	0	0.0	0	[]	0	0	0.0	0	[]	0	0	0.0	0	21	4697437	explainlikeimfive	33800314815	https://www.reddit.com/r/explainlikeimfive/comments/famrmz/_/fizu1tr/	924851051	33799908166.0	2020-02-28 07:24:50	35031090068.0	CollectableRat	1	0	15	0	False	False	90.09
22	How do inert ions such as Na^(1+) and Cl^(1-) react with metals?	1	[]	0	0	0.0	0	[]	0	0	0.0	0	[]	0	0	0.0	0	22	4697437	explainlikeimfive	28284928058	https://www.reddit.com/r/explainlikeimfive/comments/44niyt/_/czs4662/	249680837	28284607400.0	2016-02-08 12:02:41		Foef_Yet_Flalf	-1	0	12	0	False	False	84.68
23	"Time is a thing, regardless of how we measure it. The way humans measure time (seconds, hours, years, etc.) is arbitrary. Time exists even if there's no one to measure it. Atoms will still decay and gradually fall into disorder. This is called entropy. It's why people age. It's why ice will melt if you leave it out on your counter.  Us measuring or not measuring the duration, doesn't change that the duration exists.

Also what you are referring to as ""space-time"" is not entirely accurate. While it's true that time is often considered a fourth dimension including the 3 spacial dimensions, ""Space-time"" isn't based on our units of measurements. Spacetime is based on relativity where space and time are both part of the same thing. And anything with mass will bend space-time. This is gravity. Time dilation is also from relativity, where something moving close to speed of light will experience time slower relative to something at rest frame. At the speed of light, photons don't experience time at all. Again, all of this holds true regardless of if we measure it or not."	16	['is called', 'is often considered']	2	2	0.125	1	[]	0	0	0.0	0	['is called', 'is often considered']	2	2	0.125	1	23	4697437	explainlikeimfive	41382726585	https://www.reddit.com/r/explainlikeimfive/comments/zmtv5o/_/j0e7g6x/	2154661116	41381718950.0	2022-12-16 00:12:14	65631564.0	Im_using_headphones	4	0	185	0	False	True	76.62
24	Being drunk doesn’t negate consent; it is a factor in considering whether a person had the capacity to consent	1	[]	0	0	0.0	0	[]	0	0	0.0	0	[]	0	0	0.0	0	24	4697437	explainlikeimfive	41421266051	https://www.reddit.com/r/explainlikeimfive/comments/zpq24p/_/j115hfn/	2159522377	41409745534.0	2022-12-20 22:24:50	154621763293.0	NinjasOfOrca	1	0	19	0	False	False	52.19
25	Sorry, what question would that be?	1	[]	0	0	0.0	0	[]	0	0	0.0	0	[]	0	0	0.0	0	25	4697437	explainlikeimfive	27278754189	https://www.reddit.com/r/explainlikeimfive/comments/2be8qp/_/cj52dfx/	140072641	27278751723.0	2014-07-23 01:51:27		LuluRex	2	0	6	0	False	False	90.77
26	Well thats just not as fun as conspiracy theory. 	1	[]	0	0	0.0	0	[]	0	0	0.0	0	[]	0	0	0.0	0	26	4697437	explainlikeimfive	27278759512	https://www.reddit.com/r/explainlikeimfive/comments/2be8qp/_/cj52hjs/	140072641	27277823979.0	2014-07-23 01:55:29		meditate42	1	0	9	0	False	False	62.34
27	&gt;!Oh fuck I hadn't realised he'd topped himself after waking up. I'll need to give the wiki a good read or just watch it I reckon!!&lt;	3	[]	0	0	0.0	0	[]	0	0	0.0	0	[]	0	0	0.0	0	27	4697437	explainlikeimfive	40526239089	https://www.reddit.com/r/explainlikeimfive/comments/x00c0c/_/im89y7l/	1995399372	40526232095.0	2022-08-29 07:27:22	61979707.0	Goseki1	2	0	26	1	False	False	83.66
28	I agree. While I don't know what the moderator's intent was with this subreddit, I'd assumed that it was to have somewhat complicated subjects stripped of the complication and explained in laymans terms which is what I saw for a while after I'd subbed but now it seems to be becoming some kind of askreddit bastard spawn with an ELI5 gimmick.	2	[]	0	0	0.0	0	[]	0	0	0.0	0	[]	0	0	0.0	0	28	4697437	explainlikeimfive	26307891358	https://www.reddit.com/r/explainlikeimfive/comments/mqe8b/_/c331evy/	38183051	26307881744.0	2011-11-27 04:24:48		VonPepper	5	0	61	0	False	False	26.48
29	I see. I won't lie like it isn't nice to see my numbers go up, but I'm more interested in seeing a lot of responses and discussion.	2	[]	0	0	0.0	0	[]	0	0	0.0	0	[]	0	0	0.0	0	29	4697437	explainlikeimfive	27303538754	https://www.reddit.com/r/explainlikeimfive/comments/2culhm/_/cjjtlc2/	142515274	27303400676.0	2014-08-07 20:04:23		blaqsupaman	1	0	27	0	False	False	60.99
30	Where have you been getting your baguettes then????!!!	1	[]	0	0	0.0	0	[]	0	0	0.0	0	[]	0	0	0.0	0	30	4697437	explainlikeimfive	34955117028	https://www.reddit.com/r/explainlikeimfive/comments/ickpsn/_/g23dgx0/	1109513111	34954733738.0	2020-08-19 12:19:44	239732699310.0	Samthetrendynerd	0	0	8	0	False	False	105.66
31	That is what every nomad horse archer says! 	1	[]	0	0	0.0	0	[]	0	0	0.0	0	[]	0	0	0.0	0	31	4697437	explainlikeimfive	31267845848	https://www.reddit.com/r/explainlikeimfive/comments/abxc61/_/ed42g9k/	624692953	31267545465.0	2019-01-02 23:31:38	62561403.0	rand652	206	0	8	0	False	False	88.74
32	"Common misconception about soaps is that you don't kill any bacteria when you use hand soap. What soap does is that it targets the peptidoglycan layers of bacteria and destroys them, causing the bacteria to simply slide off of your hands. (Peptidoglycan is a layer of bacterial cell wall that is composed of proteins and glucose molecules in an alternating pattern. Some have thicker layers than others, but bacteria still usually are defenseless against soaps). Hand sanitizers are the actual killers of bacteria. They essentially burn them up and shrivel them through the alcohol. 
:^) microbiology is really eye opening to alot of stuff man"	7	['is composed']	1	1	0.14285714285714285	1	[]	0	0	0.0	0	['is composed']	1	1	0.14285714285714285	1	32	4697437	explainlikeimfive	31341774914	https://www.reddit.com/r/explainlikeimfive/comments/ah7faa/_/eec30aq/	633561634	31341746131.0	2019-01-18 06:16:54	72716119.0	johannvillanueva29	6	0	105	0	False	True	56.35
33	"Have you not been paying attention to what Elon Musk has been doing? He is ruining Twitter and making life hell for everyone working there. We also have a bunch of companies buying each other out, costing many, many workers their livelihoods. And then there's Trump, who is a literal criminal and doesn't pay his taxes. Yeah, politicians can be ""unpleasant,"" but let's not forget how some politicians are also rich and are influenced by lobbyists to make decisions which screw over their constituents.

So yeah, no, I don't buy that rich people should have control of their money, because there are exactly zero good billionaires."	6	['are influenced']	1	1	0.16666666666666666	1	['are influenced by']	1	1	0.16666666666666666	1	[]	0	0	0.0	0	33	4697437	explainlikeimfive	41542834245	https://www.reddit.com/r/explainlikeimfive/comments/103tigd/_/j31j41x/	2183198125	41542285466.0	2023-01-05 12:30:04	1946875007737.0	StrawberryCandid2013	1	0	106	0	False	True	70.43
34	"Well, how far it travels is not at all a function of the photon's energy. Photons are massless particles, and consequently always move at the speed of light until they are stopped, whatever energy they have.

The color of light is a consequence of its wavelength/frequency. When you shine a light through, say, a red-tinted film, what's happening is that the pigment (or what have you) in the film absorbs all frequencies of the passing light *except* red. So if a photon's frequency is within that range of reds, it will pass through, otherwise it will be absorbed. By contrast, if you pass that same beam of light through a perfectly translucent prism, it will all pass through."	6	['are stopped', 'will be absorbed']	2	2	0.3333333333333333	1	[]	0	0	0.0	0	['are stopped', 'will be absorbed']	2	2	0.3333333333333333	1	34	4697437	explainlikeimfive	41555594048	https://www.reddit.com/r/explainlikeimfive/comments/104w4jj/_/j394lkw/	2184999679	41555266574.0	2023-01-06 22:00:00	1644906394577.0	Chadmartigan	2	0	118	0	False	True	68.4
35	Right, right, but *why* is *that* good?	1	[]	0	0	0.0	0	[]	0	0	0.0	0	[]	0	0	0.0	0	35	4697437	explainlikeimfive	26501377395	https://www.reddit.com/r/explainlikeimfive/comments/102zqc/_/c6a8ho3/	60605796	26501360890.0	2012-09-19 02:51:41		mtwara	1	0	7	0	False	False	115.13
36	True.   At the beginning of your career, you don’t leak anything because frankly, it’s so obscure and low profile no one cares.   Eventually, when you do work on something well known, it’s not worth the risk to your career to leak info.   You also may be too busy and jaded to care about impressing internet strangers.   Which isn’t to say that leaks don’t happen.   They do.   However, you might also be surprised how many of them are deliberately put out there by networks or studios for publicity.	7	['are deliberately put']	1	1	0.14285714285714285	1	[]	0	0	0.0	0	['are deliberately put']	1	1	0.14285714285714285	1	36	4697437	explainlikeimfive	38614844873	https://www.reddit.com/r/explainlikeimfive/comments/rse0k6/_/hqma4zt/	1680269910	38614511896.0	2021-12-31 00:28:52	55493917.0	purplepinksky	220	0	87	0	False	False	70.73
37	Yes, that's exactly right. There are tons of different specific chemistries you can use for different conditions, but they are function per that basic summary.	2	[]	0	0	0.0	0	[]	0	0	0.0	0	[]	0	0	0.0	0	37	4697437	explainlikeimfive	37060632370	https://www.reddit.com/r/explainlikeimfive/comments/nuduvk/_/h0wxyya/	1441757072	37060611881.0	2021-06-07 14:52:55	240961410871.0	Spiritual_Jaguar4685	3	0	25	0	False	False	58.79
38	And if you can’t pay it they send a debt recovery company after you? 	1	[]	0	0	0.0	0	[]	0	0	0.0	0	[]	0	0	0.0	0	38	4697437	explainlikeimfive	31429724477	https://www.reddit.com/r/explainlikeimfive/comments/andc7t/_/efsg2m5/	643915289	31429718150.0	2019-02-05 11:53:38	216099160690.0	hayleypayley55	2	0	14	0	False	False	74.19
39	I'm talking about all these wanna be rappers in the news and media. No one in particular. 	2	[]	0	0	0.0	0	[]	0	0	0.0	0	[]	0	0	0.0	0	39	4697437	explainlikeimfive	29507310112	https://www.reddit.com/r/explainlikeimfive/comments/6m9gor/_/djzw274/	400190139	29507288249.0	2017-07-09 19:50:59		medroti007	1	0	17	0	False	False	79.77
40	Halo 6 will have splitscreen! Yey!	2	[]	0	0	0.0	0	[]	0	0	0.0	0	[]	0	0	0.0	0	40	4697437	explainlikeimfive	29532303494	https://www.reddit.com/r/explainlikeimfive/comments/6o4cgc/_/dkerr7q/	403310604	29532224505.0	2017-07-19 02:19:59		Halo4	7	0	6	0	False	False	99.23
41	They outsold because they have far superior marketing and target markets. Some people may enjoy the games I absolutely hate the majority of Nintendo exclusives 	2	[]	0	0	0.0	0	[]	0	0	0.0	0	[]	0	0	0.0	0	41	4697437	explainlikeimfive	29533161603	https://www.reddit.com/r/explainlikeimfive/comments/6o4cgc/_/dkfa5c3/	403310604	29533132534.0	2017-07-19 12:31:42		bodiesstackneatly	-5	1	25	0	False	False	41.87
42	"&gt; A male feminist is a fox wearing a chicken suit.

Aaaand suddenly every argument you've made lost credibility due to generalizing a topic that can't be generalized.
"	4	['be generalized']	1	1	0.25	1	[]	0	0	0.0	0	['be generalized']	1	1	0.25	1	42	4697437	explainlikeimfive	29552420302	https://www.reddit.com/r/explainlikeimfive/comments/6pk7rz/_/dkqqxfy/	405730655	29552349368.0	2017-07-26 13:17:16		Shadhahvar	5	0	28	1	False	True	40.35
43	Or better yet, just don't eat at restaurants where tipping is expected and customary.  McDonald's doesn't require tipping.	2	['is expected']	1	1	0.5	1	[]	0	0	0.0	0	['is expected']	1	1	0.5	1	43	4697437	explainlikeimfive	29552754246	https://www.reddit.com/r/explainlikeimfive/comments/6pk7rz/_/dkqy346/	405730655	29552690401.0	2017-07-26 15:27:57		IDontFuckingThinkSo	0	0	18	0	False	False	53.88
44	Flock	1	[]	0	0	0.0	0	[]	0	0	0.0	0	[]	0	0	0.0	0	44	4697437	explainlikeimfive	27629480394	https://www.reddit.com/r/explainlikeimfive/comments/2x8bvm/_/coxvnii/	176748322	27629478253.0	2015-02-26 15:56:43		BaconContest	75	0	1	0	False	False	121.22
45	"Well they're lying...

Just like Israel is lying (or, uh, ""not commenting"") about their nuclear weapons. "	2	[]	0	0	0.0	0	[]	0	0	0.0	0	[]	0	0	0.0	0	45	4697437	explainlikeimfive	27641469138	https://www.reddit.com/r/explainlikeimfive/comments/2y02dh/_/cp50m36/	178042373	27641443408.0	2015-03-05 09:01:01		poopinbutt2k14	0	0	16	0	False	True	80.28
46	I was about to say this, it really irked and confused me as a American-Portuguese	1	[]	0	0	0.0	0	[]	0	0	0.0	0	[]	0	0	0.0	0	46	4697437	explainlikeimfive	27649836996	https://www.reddit.com/r/explainlikeimfive/comments/2ygv5b/_/cp9zyro/	178826159	27649281146.0	2015-03-10 05:36:19		Plazmotech	1	0	15	0	False	False	64.71
47	I like money.	1	[]	0	0	0.0	0	[]	0	0	0.0	0	[]	0	0	0.0	0	47	4697437	explainlikeimfive	27649929655	https://www.reddit.com/r/explainlikeimfive/comments/2ygv5b/_/cpa1y9j/	178826159	27649929509.0	2015-03-10 07:25:59		JoeBidenBot	1	0	3	0	False	False	93.81
48	That’s all well and good but don’t you know the earth is actually a disc surrounded by a wall of ice that’s not totally just like a popular tv show.	1	['disc surrounded']	1	1	1.0	1	['disc surrounded by']	1	1	1.0	1	[]	0	0	0.0	0	48	4697437	explainlikeimfive	37274557728	https://www.reddit.com/r/explainlikeimfive/comments/ofyuvr/_/h4gb4tc/	1478008791	37274409776.0	2021-07-08 08:27:41	357081686332.0	bigsquaredick	-1	0	30	0	False	False	66.41
49	Thanks, removed.	1	[]	0	0	0.0	0	[]	0	0	0.0	0	[]	0	0	0.0	0	49	4697437	explainlikeimfive	29165177264	https://www.reddit.com/r/explainlikeimfive/comments/5wq8fz/_/dec6ysw/	357302591	29165174595.0	2017-02-28 21:14:53		kouhoutek	1	0	2	0	False	False	77.91
50	Maybe a blow by a hunting rifle.  Or even sombody killed u with a hunting rifle... I said what the beliefs are not that I believe them or that I spread them!  	3	[]	0	0	0.0	0	[]	0	0	0.0	0	[]	0	0	0.0	0	50	4697437	explainlikeimfive	27861316977	https://www.reddit.com/r/explainlikeimfive/comments/3c1jtz/_/csrwprl/	201626279	27861268090.0	2015-07-04 12:57:04		thisworldfreaksmeout	2	0	32	0	False	False	94.45
51	The fact that the sun emits slightly more green light compared to red and blue light doesn't make the sun not white.	1	[]	0	0	0.0	0	[]	0	0	0.0	0	[]	0	0	0.0	0	51	4697437	explainlikeimfive	44262044644	https://www.reddit.com/r/explainlikeimfive/comments/18avden/_/kc0h884/	2678771615	44261985990.0	2023-12-04 22:06:32	37543738.0	Emyrssentry	9	0	22	0	False	False	91.45
52	Tooth paste. Not food. Silly beaver. Try and stay on topic.	4	[]	0	0	0.0	0	[]	0	0	0.0	0	[]	0	0	0.0	0	52	4697437	explainlikeimfive	42859562390	https://www.reddit.com/r/explainlikeimfive/comments/14e1sx4/_/joth5zq/	2442245800	42859552985.0	2023-06-20 11:29:22	985640706443.0	ActualMis	1	0	11	0	False	False	94.15
53	I'm surprised to learn this is the case outside the developed world -- I thought this was something first-world patients were demanding, mostly. TIL. 	2	[]	0	0	0.0	0	[]	0	0	0.0	0	[]	0	0	0.0	0	53	4697437	explainlikeimfive	28163280664	https://www.reddit.com/r/explainlikeimfive/comments/3vw9sh/_/cxroufs/	234972305	28162762948.0	2015-12-08 17:07:21		funobtainium	2	0	24	0	False	False	65.05
