	subreddit_id	subreddit	id	permalink	link_id	parent_comment_id	created_utc	author_id	author	body	score	controversiality	number_of_tokens	bot_delta_awarded	delta
35717	4855832	changemyview	40398711802.0	https://www.reddit.com/r/changemyview/comments/wncj1v/_/ik4cliy/	1974133363.0	40398593604.0	2022-08-13 12:24:40	32273065.0	Jaysank	"There are other reasons why a project might be over budget or taking longer than expected. For instance, the client might not have fully informed the contractor. For instance, if the government contracts a railroad company to build rails, and the contract stipulates that the government must acquire the land to build it on. However, legal challenges/changes in the law make the government unable to get the land by the time the contract says. Getting rid of the contract now would be inefficient, far more inefficient than waiting for the legal issues to be resolved. Additionally, events outside of the control of both parties could slow things down or spike the cost without it being an inefficient action. Natural disasters, international conflicts, or supply chain disruption could all be problems without any inefficiencies.

That’s not to say inefficiency doesn’t exist. Humans aren’t perfect, and every project will have some limit to how efficient it can be. There are also real examples of incompetence or corruption slowing construction. Whether these are the root cause of the widespread slowdown you are concerned about, however, isn’t clear.

Finally, it is also possible that this apparent inefficiency is simply a function of our current world. It is possible that all major projects that you are concerned with are operating at their peak efficiency, and any efforts to clamp down on the hypothetical corruption or incompetence would lead to even more cost overruns. This might not be the most reassuring possibility, but it is one that suggests that inefficiency isn’t the culprit."	78.0	0.0	257	False	True
35719	4855832	changemyview	40398742316.0	https://www.reddit.com/r/changemyview/comments/wncj1v/_/ik4d92k/	1974133363.0	40398617986.0	2022-08-13 12:31:13	22981416.0	barbodelli	"Sounds like poor estimates. What makes you think they were ""meticulously calculated"". They may have been low balling on purpose to get it approved. Knowing that it's a lot easier to ask for more $ than to get a project approved.

Fundamentally government has a very inefficient incentive structure. The goal is to get elected. Not necessarily produce a product in an efficient manner that delivers quantitative results."	8.0	0.0	68	False	True
35740	4855832	changemyview	40399246114.0	https://www.reddit.com/r/changemyview/comments/wncj1v/_/ik4o1sy/	1974133363.0	40398593604.0	2022-08-13 14:05:57	41270918114.0	tbigaming	if you have ever been unfortunate enough to have build a house you will know that it definitely will cost you more than planned, I think there definitely is coruption but i would more so put it on the nature of construction.	2.0	0.0	42	False	True
35748	4855832	changemyview	40399819925.0	https://www.reddit.com/r/changemyview/comments/wncj1v/_/ik50ck5/	1974133363.0	40398593604.0	2022-08-13 15:35:39	29083683.0	rewt127	"I work in the construction engineering industry so I think I can speak to this.

Generally speaking. Budgets and other estimates are done by a bunch of people in a room with suits on and they don't even bother asking Dave the Concrete guy how much the concrete is going to cost.

Infrastructure projects also have the added issue of a huge footprint. This means there is a lot higher chances of running into unforeseen site consequences. Maybe the water table is 20' higher for these 2 miles and that causes problems for construction. Leading to increased costs and delays.

And finally. Unrealistic timelines.

Construction takes time. Shit, a hospital takes like a full year to construct. But they want to build 50+ miles of high speed tracks in under 10? Just unrealistic without hiring dozens of crews."	10.0	0.0	138	False	True
35759	4855832	changemyview	40400097793.0	https://www.reddit.com/r/changemyview/comments/wncj1v/_/ik56ayp/	1974133363.0	40398617986.0	2022-08-13 16:17:39	18976715228.0	The_Real_Scrotus	"&gt;If we are regularly breaching such meticulously calculated estimates, either our estimation system is wrong, or we have some serious problem making us inefficient at building infrastructure.

Poor estimation methods can factor into it, but that's not really the heart of the problem.  I'll try to explain because I do this for a living.

When you're quoting a large multi-year project that's going to cost millions or billions of dollars you get some requirements that you use to generate the quote.  Those requirements vary in level of detail.  Where there isn't enough detail you make assumptions and estimate.

One of the ways that you get into cost overruns is that your assumptions were wrong.  It happens, and it can often mean the project costs a lot more than was planned.

But there's another place that you get into even bigger cost overruns most of the time.  See when you estimate the cost/effort needed to do something you can do that estimate in lots of different ways.  You can assume everything goes right the first time around and make your estimate based on that.  Or you can assume lots of things will go wrong and make your estimate based on that.  Now obviously the estimate assuming that everything goes right will be much cheaper than the estimate where everything goes wrong, so when you have multiple companies competing to win a project like this, it's common for companies who quote more aggressively to win the bid.  But in reality, things *always* go wrong.  The companies who quote aggressively know that.  And they also know that when those things go wrong, they'll pass the cost on to the customer.  And that's the biggest reason you get these cost overruns, because the original planned cost was never realistic in the first place."	2.0	0.0	299	False	True
35771	4855832	changemyview	40400910020.0	https://www.reddit.com/r/changemyview/comments/wncj1v/_/ik5npok/	1974133363.0	40398593604.0	2022-08-13 18:17:18	72413518.0	orangepalm	Idk if it's corruption but it's pretty common for public projects to be intentionally underestimated. Makes it easier to pass the legislation. Then, when the money runs out, what's the government gonna do, not put in more money and have half a park or rail line or whatever?	3.0	0.0	48	False	True
35800	4855832	changemyview	40402711895.0	https://www.reddit.com/r/changemyview/comments/wncj1v/_/ik6qc0n/	1974133363.0	40398617986.0	2022-08-13 23:04:51	24146621.0	Ralathar44	"&gt; But even despite that, western nations make detailed cost estimates to outline expected costs, taking our higher labour costs into account. If we are regularly breaching such meticulously calculated estimates, either our estimation system is wrong, or we have some serious problem making us inefficient at building infrastructure.

I think you are underestimating the difficulty of properly estimate such complex and long term ventures with so many moving parts.  Most people cannot even predict the amount of time it would take to fully clean their house and garage and expect experts to be able to accurately predict the time and expense of years long projects including hundreds or thousands of people and often needing to navigate different locale communities and special interest groups and etc.

&amp;nbsp;

Now the natural answer people come up with is ""they are trained to do that"".  Ok, what training teaches you to do that?  How does that training perform IRL?  Do you know the first bit about that training?  And if you're not well informed on what would allegedly allow them to accurately plan all of this then what makes you so sure it's inefficient?   

Not to mention that even if they had the best of training with an impossible 100% success rate with correct information...who says they're being correct information or indeed even have all the information.  Every project has a significant amount of missing information that impacts completion dates and costs that is not known before the project starts.  Like any project started before COVID lol would be one of the easiest to understand examples right now.

&amp;nbsp;

&amp;nbsp;

Planning long range is already incredibly difficult even with simple things.  I think you're simply underestimating the difficulty.  Though if you wanted to lower the difficulty and costs of such planning then lowering the rights of your people and their wages achieves that pretty well.  Less rights = less variables from worker availability to special interest groups to local groups to etc.  And ofc less wages not only = less money overall but less variability in the overall cost outcome."	2.0	0.0	347	False	True
35842	4855832	changemyview	40422141920.0	https://www.reddit.com/r/changemyview/comments/wncj1v/_/ikiasbk/	1974133363.0	40421920121.0	2022-08-16 11:54:44	10369711.0	Skyy-High	"Don’t let perfect be the enemy of good, and don’t believe conservatives when they wring their hands and say they’d agree with you if only XYZ. 

The goalposts will always move. 

You should know from doing any type of home improvement work yourself that doing things correctly, safely, with the right materials, etc will always take longer and be more expensive than doing things fast, cheap, and dangerous. It’s a fundamental property of doing any kind of physical labor. Protecting human beings should **always** be a higher priority than maximizing profits that mostly go to the richest slice of society, otherwise you’re literally allowing them to profit off of the sacrificed health of workers. 

We’ve had that society before, it led to untold suffering and exploitation. All of our labor laws grew out of decades of activism spurred by that suffering. What do you think the men and women who manned those picket lines would say to you, when you claim that you just want to give up those rights for the hope that conservatives will…stop trying to tarnish the concept of workers’ rights?"	2.0	0.0	184	False	True
35848	4855832	changemyview	40422643007.0	https://www.reddit.com/r/changemyview/comments/wncj1v/_/ikiliyn/	1974133363.0	40422054628.0	2022-08-16 13:25:32	798510159658.0	substantial-freud	"&gt;As I mentioned in the post details, they managed to make many countries support these atrocities, using infrastructure to buy the loyalty of these countries.

Countries *love* supporting, or at least overlooking, atrocities.  Everyone tut-tutted the crackdown surrounding the Tiananmen Square massacre, when the Chinese killed thousands of college students on live TV.

My question is, do *you* support those atrocities?

&gt;People have been saying this for years.

Yes, the foolishness of China’s economic policies has been evident for a long time.

&gt;why should I be confident that the collapse will happen this time?

I hope you don’t use that reasoning in your own life.  “I have been smoking for years.  Why should I stop?”  “I have been drinking and driving since college.  Never had an accident.” 

In the case of China, the cracks have begun to show:

* China’s second-largest builders, Evergrande Group, has $300 billion in bad loans — that is about 2% of the total tax-revenues of China; nothing about the loans are particular to Evergrande
* Housing prices have dropped 30% this year, which may cause the GDP to drop by 10%.  This is worse than any drop in US GDP during the Great Depression.
* Homeowners have called mortgage strikes in at least 300 cities.  This has forced regional banks into insolvency.  
* After flatly refusing to pay off on deposit insurance, the Chinese government has claimed it will pay off some depositors of insolvent banks.  It is not clear this is enough to prevent collapse of the banking system.
* The government has promised war with Taiwan over the Pelosi visit: either it will deliver, resulting in the utter destruction of the PRC, or it will back off, causing the government to look weak.

Will the PRC survive to see the Year of the Water Rabbit, six months from now?  _Maybe_.

But everything is very, very bad and there is no appetite for reform anywhere in the CCP.  Xi seems to be doubling down on bad policy in every sector. 

The 20th National Congress is coming up later this year.  Xi will probably try to get himself elected “Chairman” or even “Leader”, titles that have not been used since Mao.  If he succeeds, it will likely mean stasis until a *Downfall*-style final collapse of the PRC government; if he fails and is purged, the government may be able to survive, following a period of chaotic reform."	2.0	0.0	402	False	True
35888	4855832	changemyview	40471217454.0	https://www.reddit.com/r/changemyview/comments/wuolka/_/ilbin8u/	1986453802.0	40471062876.0	2022-08-22 13:36:23	62238338.0	Queifjay	In my specifically laid out scenerio, I will always point back to milk being the limiting factor. You can always add more cereal but when the milk is gone it is gone. Under your method, simple human error inevitably leads you to an excess of dry cereal waste. Surely you would agree that milk first is the more efficient method in this one instance?	2.0	0.0	64	False	True
36077	4855832	changemyview	40700178009.0	https://www.reddit.com/r/changemyview/comments/xijul1/_/ip3u2c9/	2026542997.0	40699805062.0	2022-09-19 19:55:28	59076243.0	Vesurel	Having money isn't a problem the way having food isn't a problem. But if you have more food than you could ever eat while other people don't have enough food, then the distribution of food in that system leads to people starving. Do you think some people having no food is a worthy price to pay so other people can own mansions?	13.0	0.0	62	False	True
36224	4855832	changemyview	40719897643.0	https://www.reddit.com/r/changemyview/comments/xkq264/_/ipfkq3v/	2030191996.0	40719865539.0	2022-09-22 05:10:49	25141961.0	BlackHoleHalibut	"You have changed the form from:

‘If P then Q, therefore if not P then not Q’

To: 

‘If P then not Q, therefore if Q then not P’

These are not logically equivalent formulations."	1.0	0.0	35	False	True
36354	4855832	changemyview	40829436966.0	https://www.reddit.com/r/changemyview/comments/xwst38/_/ir8sj6u/	2050475588.0	40829330533.0	2022-10-06 04:36:14	42197497.0	GuRoux_	I agree, humans do take in data, process it, and then act.  Your op wants indistinguishable  ai.  So the actions are by definition the same. How we take in data, that is another difference, if that counts for you because computers will be taking in different data and with much different sensors than humans.  How we process data is definitely different if we are dealing with different input data.  How we think and how we experience should be different than computers given our significant differences.  For example, we experience senses like sight and hearing in two different ways.  Why would a computer experience them like us? Perhaps they see in the way we would call hearing.  Perhaps they experience all senses with sight.  Perhaps they sense in some totally different way we have no intuition for.  Maybe the programmer can control how the ai experiences different things.	1.0	0.0	147	False	True
36372	4855832	changemyview	40830987009.0	https://www.reddit.com/r/changemyview/comments/xwst38/_/ir9pr7l/	2050475588.0	40829567794.0	2022-10-06 11:48:10	59322322.0	poprostumort	"&gt;I’ve been thinking about what specifically is wholly human and cannot possibly be replicated digitally.

Issue is that in theory you can replicate everything, but in reality you would need to know:

\- how exactly human brain works  
\- how exactly it reacts to any stimuli  
\- how emotions are generated and how do they work  
\- how memory works 

So long story short, the whole problem is in whet you handwaved by ""designed specifically to be indistinguishable from a human"" because it would need a computing power and level of understanding that is currently unfathomable.

And the answer to ""what specifically is wholly human and cannot possibly be replicated digitally"" cannot be answered without knowing how exactly humans work."	3.0	0.0	120	False	True
36420	4855832	changemyview	40927927086.0	https://www.reddit.com/r/changemyview/comments/y7mfb2/_/isvfini/	2068653566.0	40927879336.0	2022-10-19 00:00:52	37930837.0	Morthra	"&gt; Do you have evidence of that?

Ethiopia's [average IQ](https://www.worlddata.info/iq-by-country.php) is 69, below a number of other African nations who *were* colonized, including Guinea, Niger, the Congo, Cameroon, Sudan, and South Africa.

The whole ""legacy of colonization"" argument doesn't really apply to IQs.

&gt; Do you have evidence that English people normally outperform French people?

English people tend to outperform French people *on IQ tests made by English people*. [Cultural bias in IQ tests is a thing](https://nrcgt.uconn.edu/newsletters/winter052/)"	3.0	0.0	77	False	True
36564	4855832	changemyview	40971897870.0	https://www.reddit.com/r/changemyview/comments/ycbhrg/_/itllyq6/	2076541612.0	40971869268.0	2022-10-24 15:34:35	17383712.0	destro23	"&gt; Do you have that option? 

Yeah, that's what my dad did. Found some new tail, and took off for a few years. It happens all the time, and everyone knows that if they really wanted to, they could just fuck off down the road. 

I heard a joke once: ""When I got married, I thought 'Now I can never leave'. When I had a kid I thought 'Fuck, I could have left!""

I don't exercise that option because I am happy in my relationship. But, if that ever changed to a great enough degree, I'd still have that option. And, I'd probably use it. I have once before."	2.0	0.0	109	False	True
36598	4855832	changemyview	40972850858.0	https://www.reddit.com/r/changemyview/comments/ycbhrg/_/itm6e22/	2076541612.0	40971293309.0	2022-10-24 17:47:45	66461535.0	Mafinde	"I’m extremely glad you’re using floor and ceiling correctly, I almost always see it used incorrectly. I’ve even thought about posting a CMV about it but I know I’m correct. 

More seriously, I think you should re-evaluate the ceiling of a monogamous relationship. The ceiling is a life changing partner. Someone who will do everything for you, even at their own expense. Someone who will be there until your last breath. Someone who will literally die for you. Thinking about it strictly analytically and without any sappy emotion - that is an extremely powerful asset to have. 

Really the only other way to get that is immediate family, but if your brothers and sisters find partners like this, then they will be this person for their partner, not you. And you’re likely to outlive your parents. So without a monogamous dedicated relationship, you likely out of luck. 

You might disagree and say you can find such a person, but apply this simple test as a shorthand proxy for closeness - how many people share finances with a non-spouse? Or if you were hospitalized, how many non-spouses would spend literally every night in the hospital room with you? There are many ways to frame this point, but a monogamous partner can (remember we are talking ceiling here) can be a special, unique, and life changing thing"	1.0	0.0	225	False	True
36609	4855832	changemyview	40973304273.0	https://www.reddit.com/r/changemyview/comments/ycbhrg/_/itmg3wx/	2076541612.0	40973257211.0	2022-10-24 18:49:47	501102590154.0	iamintheforest	I agree with that.  I'm not sure why it being hard matters.  Isn't the question about agency?  (and..to be clear, it's my contention that being successful i relationships brings about a hell of a lot more agency than getting laid with lots of people.	1.0	0.0	44	False	True
36651	4855832	changemyview	41053832270.0	https://www.reddit.com/r/changemyview/comments/yld4sd/_/iuye3pq/	2091734653.0	41053670183.0	2022-11-03 22:53:47	13360545.0	math2ndperiod	"Here’s the thing though, the damage to cause serious ecological consequences is already done. We’re not suffering from the carbon emitted yesterday, but the carbon emitted a decade or more ago. If we switched to 100% nuclear energy tomorrow, things would continue to worsen for a while anyway. So for the next ~10-20 years until things inevitably get bad enough that widespread change has political support, we can either continue to go full steam ahead pumping carbon and bullshit into our oceans and atmosphere, or we can start to gradually transition so that we don’t have to do a complete 180 to have any chance of survival. 

If we tried to overthrow capitalism all at once we’d probably just end up with a civil war or anarchy or a dictatorship. War is not good for the environment, and we need a functioning, prosperous tech industry to continue to pump out technology that will help us adapt to the coming changes.

Basically, the damage is done. We can either start mitigating damage and transition gradually, or we can continue doing maximum damage until we have to completely overthrow society to change anything."	3.0	0.0	191	False	True
36755	4855832	changemyview	41863277611.0	https://www.reddit.com/r/changemyview/comments/11107ha/_/j8cbbqj/	2238937822.0	41863237820.0	2023-02-13 06:14:39	75859607758.0	Bobbob34	"&gt;Because the public often has a twisted or misconstrued idea of how frequent random mass shootings really are. Due to how general the phrase “mass shooting” is, it’s become easier and easier to - intentionally or unintentionally - convince people living in the nicest of suburbs that even they can’t step outside or they will absolutely be shot (when the likelihood is like &lt;.05% or something, numbers may be a little off).

A mass shooting is simply about the number of people. 

I don't get how you think spree killings, which are very rare, btw, would have any effect on perceptions. 

&gt;However, presenting to the public that we have a lot of mass shootings while omitting that fact that the majority of them stem from situations that most citizens wouldn’t even understand (gang violence, etc.) - in which the victims were (unfortunately) often involved - instills extra fear and even confusion into their hearts, and even fuels the flames of division we’re already very much experiencing today.

There are like two mass shootings a day in the US. That's an insane number, and despite FOX's desperation to push the narrative that they're mostly gang related, that's not true.

They are often domestic/familial, which doesn't mean people won't be harmed -- especially in states with lax gun laws (the more strict the gun laws, the less gun violence, and the less strict, the more gun violence). 

[https://www.usatoday.com/in-depth/graphics/2022/08/18/mass-killings-database-us-events-since-2006/9705311002/](https://www.usatoday.com/in-depth/graphics/2022/08/18/mass-killings-database-us-events-since-2006/9705311002/)

I don't, though, get why you;d want to separate out spree killings, which are so small in number."	3.0	1.0	254	False	True
36894	4855832	changemyview	41881390915.0	https://www.reddit.com/r/changemyview/comments/112yzfj/_/j8n3k1v/	2242239967.0	41881379663.0	2023-02-15 15:06:50	30055785.0	Rainbwned	But wouldn't it be the case that if it was peer pressure, they wouldn't believe it themselves and are just doing what their parents say? So in that case if they believe in their religion even after no longer being watched by their parents, that it isn't peer pressure?	5.0	0.0	49	False	True
37079	4855832	changemyview	42344141776.0	https://www.reddit.com/r/changemyview/comments/12mgfed/_/jgalwwg/	2335432693.0	42343944285.0	2023-04-14 23:26:41	462141483316.0	colt707	Work as a delivery driver. You’ll learn quickly that google maps, waze, etc are all great tools but they’re not infallible, mainly due to the fact that they get updated every 5-10years, sometimes longer in rural places.	2.0	0.0	37	False	True
37248	4855832	changemyview	42443035330.0	https://www.reddit.com/r/changemyview/comments/130nszb/_/jhxhjnm/	2359291511.0	42443005299.0	2023-04-27 15:27:27	985168014491.0	Various_Succotash_79	"Lol it definitely does.

Ask a music teacher at a mostly white rural/suburban school what kind of parental feedback they get if they have a Jazz or Hip Hop period."	3.0	0.0	30	False	True
37512	4855832	changemyview	42464027078.0	https://www.reddit.com/r/changemyview/comments/133gj7g/_/ji9zgzq/	2363991100.0	42463810803.0	2023-04-30 06:32:12	292918668732.0	ThuliumNice	"Not all countries have the capability to do this.

This is a big part of why the US is restricting the ability for China to import computer chips.

Poorer nations won't have the ability to do this; every step forward in AI costs staggering amounts of research money."	1.0	0.0	48	False	True
37572	4855832	changemyview	42477163648.0	https://www.reddit.com/r/changemyview/comments/1353r1h/_/jiht18g/	2366753957.0	42477101595.0	2023-05-01 23:08:35	306724356442.0	ItIsICoachCal	"While I couldn't find any studies attempting to create a wide demographic survay, there are studies that compare aspects of butch vs femme lesbian/bi/queer women.

This is the first one I found, and while the thrust of it is about substance abuse, in the process they had to use established techniques to sort their population into ""butch"" ""femme"" and neither. In that process they found more femme than butch women, though not to a statistically significant degree. 

https://www.ncbi.nlm.nih.gov/pmc/articles/PMC3189349/"	1.0	0.0	78	False	True
37612	4855832	changemyview	42477387294.0	https://www.reddit.com/r/changemyview/comments/1353r1h/_/jihxtsu/	2366753957.0	42477369092.0	2023-05-01 23:44:44	119503732118.0	Sagasujin	"https://www.autostraddle.com/tops-bottoms-switches-one-last-look-at-all-the-survey-data-424953/

Sorry, I mean to include that in the last post. Must have slipped up."	7.0	0.0	15	False	True
