	subreddit_id	subreddit	id	permalink	link_id	parent_comment_id	created_utc	author_id	author	body	score	controversiality	number_of_tokens	bot_delta_awarded	delta
25494	4855832	changemyview	34187704827.0	https://www.reddit.com/r/changemyview/comments/gcyisc/_/fpeh5vf/	989224860.0	34187634042.0	2020-05-03 23:11:02	408613617371.0	Independent_Coat	"Thank you, I appreciate the thorough response. You make good points, but I suppose I'm caught up on the strength of the statement. 

""Really bad""

The Hillary debacle certainly fits under this, but other than that, I would say the parties are just about even. Even if Republicans outperform Democrats over whatever timespan and in whatever circumstances, it'd still take more than that for me personally say ""really bad.""

I guess it's just a matter of semantics at this point. I think ""come on, it's not that bad."" But if you're comfortable stating it so strongly from your perspective, that's cool."	1.0	0.0	101	False	True
25527	4855832	changemyview	34189095926.0	https://www.reddit.com/r/changemyview/comments/gcyisc/_/fpfaz92/	989224860.0	34188753538.0	2020-05-04 04:22:14	103549334473.0	Snowsteak	"I agree viewing the opposition as a literal enemy is a recent development. There is no need for as much animosity as exists, in most cases. Some, I think are deserving of all the derision and scorn that can be heaped upon them and more. 
I’m not naive enough to think any politician is completely clean, but also not naive enough to believe that the GOP isn’t the dirtier of the two. 

Party loyalty is what got us to where we are in part, no? Towing the line instead of the voting our conscious or voting based qualifications has allowed fools into the highest sectors of gov’t. How many voters hit straight ticket without looking at any or even half of the names on the ballot? Ignorance is part of the problem, but also apathy. Apathy towards our fellow man. A “fuck you, I got mine” attitude so to speak. 

Perhaps party loyalty should be replaced by loyalty not just to county as an abstract concept, but loyalty to one another. That we can trust we as a group have have our collective best interest at heart. I’m reminded of a quote, I don’t remember the origin, but: “If you want to go fast, go alone. If you want to go far, go together.” (I’m really nervous I picked this up from some dumb movie, but it fits.)"	1.0	0.0	228	False	True
25666	4855832	changemyview	34302532212.0	https://www.reddit.com/r/changemyview/comments/gnnm39/_/fraub90/	1007191701.0	34302511393.0	2020-05-21 02:00:23	365737700498.0	ArmchairSlacktavist	"The manufacturing industry has declined because it's cheaper to go overseas, but this has nothing to do with the minimum wage. That's what you're missing.

If you snapped your fingers and tomorrow there was no minimum wage, manufacturing jobs wouldn't suddenly come rushing back just because now they can pay Americans $1 a day or whatever, because they *can't* pay Americans $1 a day. No American is able to sustain themselves on such a low wage."	2.0	0.0	76	False	True
25769	4855832	changemyview	34604422530.0	https://www.reddit.com/r/changemyview/comments/hhkaiu/_/fwakvb6/	1057425222.0	34604379845.0	2020-06-28 19:26:00	443898567031.0	YouTubeLawyer1	"&gt;I did say if someone can provide enough space for the fish then it's not so bad but most people can't.

1. There is no science to support that claim that living in a sizable-enough tank is detrimental to the fish's health (physical or psychological).

2. There are plenty of fish that were born on fish-farms and who have spent their whole lives effectively in tanks. They have never seen the wild and were never ripped from it. 

3. You have yourself admitted that there are people who have tanks large enough to comfortably house their fish 

4. With these three aforementioned conditions, we can find that owning fish raises none of the objections you have raised. So why should we ban people who have fish hitting all these check marks from owning fish? Because that is what your ban would do. It would ban these good people from owning fish.

Wouldn't it be better and safer and kinder for all parties involved to regulate the ownership of fish moreso than just banning it outright?"	9.0	0.0	175	False	True
25860	4855832	changemyview	34636500733.0	https://www.reddit.com/r/changemyview/comments/hkbvq5/_/fwtof0d/	1062071645.0	34636393398.0	2020-07-03 17:37:33	14086862.0	elcuban27	Not technically relevant, but I will humor you. What if your phone carrier decided to pick and choose which of your social media posts to allow on their network?  Want to tweet something bad about their preferred candidate and suddenly your data stops working. Is this fine?	6.0	0.0	47	False	True
26118	4855832	changemyview	34726121634.0	https://www.reddit.com/r/changemyview/comments/hs1uav/_/fyb1axu/	1075040167.0	34726040078.0	2020-07-16 23:31:14	56013930.0	jakezillaface	"I don't know where you are getting this information from: ""Being fat is the product of good life conditions, not bad.""
According to https://www.cdc.gov/mmwr/volumes/66/wr/mm6650a1.htm
(In the US): The prevalence of obesity decreased with increasing income in women (from 45.2% to 29.7%), but there was no difference in obesity prevalence between the lowest (31.5%) and highest (32.6%) income groups among men.

What you need to remember is that in today's world healthy food is often more expensive than unhealthy food. McDonalds and Burger King are cheap, poor people will often eat this in replacement of real food. You can argue there is either no association, or a negative association between income and obesity, but arguing a positive correlation between obesity and income in the developed world seems absurd."	1.0	0.0	127	False	True
26204	4855832	changemyview	34767861624.0	https://www.reddit.com/r/changemyview/comments/hwhmov/_/fyzvxq0/	1082495263.0	34767725079.0	2020-07-23 16:57:04	39599072.0	letstrythisagain30	"&gt;In my thoughts I believed that security personnel escorting him out would count as ""violence"" because it is a scenario in which he doesn't want to go, and is being forced to.

That has more to do with Trump being a manchild cry baby narcissistic ego maniac than fascism though. Its something that was even been discussed on the news because of how everyone knows Trump is as a person.

&gt;I do believe upon consideration that the biggest threat in this case would be the violence from his supporters that you mention.

Thats possibly the most likely outcome, but even then it would be at most a handful of isolated incidents without much violence to speak of. Maybe a fight or two between people protesting Trump's loss and people calling them idiots for it on the street."	22.0	0.0	137	False	True
26254	4855832	changemyview	34768209736.0	https://www.reddit.com/r/changemyview/comments/hwhmov/_/fz03ebs/	1082495263.0	34768150050.0	2020-07-23 17:52:51	8884935.0	rollingrock16	"The most general example is the Never Trump movement within the GOP.  

As for some more specific examples here's a sampling:

https://www.newsweek.com/republicans-rebuke-trump-vote-overturn-1465762

https://thehill.com/homenews/senate/427773-gop-poised-to-rebuke-trump

https://www.newsweek.com/gop-senators-rand-paul-mike-lee-rebuke-insulting-demeaning-iran-briefing-say-they-support-1481163

https://www.thestate.com/news/politics-government/election/article243935497.html

Not to mention the failures of the GOP to pass much of Trump's agenda when they controlled congress prior to the mid-terms.     The GOP as a party is anything but in lock-step with Trump."	5.0	0.0	59	False	True
26615	4855832	changemyview	34897800699.0	https://www.reddit.com/r/changemyview/comments/i7yicf/_/g158zcr/	1101758559.0	34897703055.0	2020-08-11 21:28:58	58567626.0	TitanCubes	"&gt; Attending college is technically an individual choice, but it is also one of the few available methods. 

But you’re advocating for no in person college. If the only issue was social mobility you would definitely be advocating to give students the choice to go back to school. 

&gt; Shouldn’t we be more concerned about actual survival than economic survival?

This implies that there is a significant risk for college aged students going back to school which is not true. Also if you give any business the opportunity to continue their business or go bankrupt they are obviously going to choose to continue. 

&gt; Would you apply the same economic survival argument at the individual level?

Your analogy here isn’t really correct. Obviously on the individual level we have government supported options to make that choice not have to exist. For a college this choice doesn’t exist. They either open up in the fall or go bankrupt. This would be the equivalent of an individual having the choice to go back to their job otherwise they will never have any job again, and government intervention is not an option."	24.0	0.0	189	False	True
26764	4855832	changemyview	34902948060.0	https://www.reddit.com/r/changemyview/comments/i8guit/_/g18bb30/	1102614149.0	34902862367.0	2020-08-12 16:51:29	15084765.0	TFHC	"&gt;My understanding was that this clause existed to stop people like Alexander Hamilton from being elected President.

The full text is ""No Person except a natural born Citizen, or a Citizen of the United States, at the time of the Adoption of this Constitution, shall be eligible to the Office of President; neither shall any person be eligible to that Office who shall not have attained to the Age of thirty five Years, and been fourteen Years a Resident within the United States."", so as a citizen at the time of the adoption of the Constitution, Hamilton was entirely eligible for election to the presidency."	2.0	0.0	105	False	True
26811	4855832	changemyview	34903954952.0	https://www.reddit.com/r/changemyview/comments/i8guit/_/g18ww08/	1102614149.0	34903881023.0	2020-08-12 19:28:48	310330259419.0	AureliasTenant	The US has this weird (and in my opinion horrible and racist) thing called US nationals, which applies to people born in unincorporated territories of the United States. The Philippines were an unincorporated territory, so people born in the Philippines during whatever the appropriate dates were US nationals. Filipinos has various ways of becoming US citizens (although these were often restricted by racist policies). When the Philippines became independent, non-citizen US nationality was stripped (meaning citizens kept their citizenship but nationals did not keep their US nationality) There are other unincorporated territories of the US like American Samoa that still have this today. The Philippines were not revoked of full citizenship	2.0	0.0	111	False	True
27014	4855832	changemyview	35213039609.0	https://www.reddit.com/r/changemyview/comments/iyijbx/_/g6cxn95/	1146362973.0	35212976364.0	2020-09-23 21:24:34	52869270.0	Love_Shaq_Baby	"&gt;know they were illegal, but there was no necessity for Hamilton to accept it. 

It's still murder and Burr was charged with murder though it was never brought to trial.

&gt;There's also no evidence that Hamilton shot the air during the duel. 

There were letters he wrote beforehand saying he intended to throw away his first shot and that was the story published in papers at the time. There's a good amount of evidence that is what happened since Hamilton's shot did miss Burr.

&gt;I think a large part of my point is that people perceive Hamilton as a progressive and Burr as his opponent/anti-progressive.

Do they? They were members of the same party. Their disputes were personal moreso than ideological and I think the musical demonstrates this pretty clearly when the conflict between the two arises after Burr goes after Philip Schuyler's seat. 

The musical frames Burr as faulty for his ambition, it doesn't attack him on his political beliefs, but rather that he had none."	1.0	0.0	167	False	True
27075	4855832	changemyview	35394180416.0	https://www.reddit.com/r/changemyview/comments/je6kiy/_/g9cs4e8/	1172678506.0	35394105264.0	2020-10-19 18:53:01	555300924354.0	I_Boomer	If it was your responsibility to care for the ant (or the embryo) and you didn't fulfill your responsibility, then you would be morally wrong (and selfish/lazy because it was problematic for you). There sure is no easy answer for all test cases, that's for sure (i.e., going back in time to kill Hitler).	3.0	0.0	54	False	True
27274	4855832	changemyview	35573708303.0	https://www.reddit.com/r/changemyview/comments/judjt6/_/gcbo0zz/	1199878026.0	35573428107.0	2020-11-15 02:23:19	54353837.0	JohnCrichtonsCousin	That's just wrong. If you're not engaged in any sexual activity you should be blue-balled and ready to go. The impetus will be there trust me. You'll be your 8th grade self again, trying to hide randomly occurring boners.	2.0	0.0	39	False	True
27283	4855832	changemyview	35574804937.0	https://www.reddit.com/r/changemyview/comments/judjt6/_/gccbj61/	1199878026.0	35574535688.0	2020-11-15 04:54:34	21745422805.0	Anchuinse	"That's... not true. Yes, there are some women (and men) that don't want to be someone's first, but that often revolves around many people feeling attached to the person who ""took their virginity"". But as I said, the rugby teams at my university had people who'd been with dozens, and people who were still virgins. We really didn't care. Hell, I didn't lose mine until 19, the summer after my first year in college. It's not at all strange to be a virgin for a year or two in college. 

&gt;So whores want a man whos been with dozens of women before them?

Careful. You're sounding very much like an incel with that one. It might shock you, but the number of people someone's been with isn't a huge factor for a lot of people. A lot of the focus and perceived judgment on ""virginity"" is perpetuated by virgins and teenagers who are finding another way to antagonize their peers.


Cards on the table, I thought similarly to you when I was your age. Getting out of my small town and actually talking to other people helped me realize my unhealthy obsession with my idea of sex.

You're somewhat right that many people (men and women) will find a 40+ year old virgin a turnoff, but that doesn't apply to 18, 19, or early 20s virgins.

If you wanna talk about more specifics privately, feel free to message me privately, but I'll turn it around and ask you some questions.

What do you want to get out of sex? What do you think is the difference between having your first time as a 17 year old versus as a 19 year old? How many sexual partners would your preferred partner have? How many sex partners do you want to have before marriage (if you want to get married)?"	10.0	0.0	308	False	True
27330	4855832	changemyview	35628302353.0	https://www.reddit.com/r/changemyview/comments/jyx3lh/_/gd8661d/	1207508597.0	35628267541.0	2020-11-22 15:34:23	29000241.0	10ebbor10	"I know that study, but it doesn't support your views.

The first problem is that OkCupid's rating is not an objective measure of attractiveness. 

See, if you rate someone highly, the algorithm will suggest you to them. If you rate someone low, the algorithm will ignore them.
Since men message women far, far more often than women message men, women are incentivized to rate men low, else they get spammed with a thousand messages.

On top of that, look what happens if we look at who messages whom.

[Women are perfectly willing to message lower rated men](https://techcrunch.com/wp-content/uploads/2009/11/female-messaging-curve.png).

[Men focus most of their effort solely on high rated men](https://beta.techcrunch.com/wp-content/uploads/2009/11/male-messaging-curve.png)

This thus indicates that it is not women being the picky gender, but men."	12.0	0.0	122	False	True
27341	4855832	changemyview	35628430157.0	https://www.reddit.com/r/changemyview/comments/jyx3lh/_/gd88wnh/	1207508597.0	35628265704.0	2020-11-22 15:57:23	56818899.0	Havenkeld	"Internet dating sites involves people evaluating profiles. That's pretty limited information. They don't have access to a person's personality, they have a little list of traits that may or may not be accurate. That appearance is valued over ""personality"" when the only information you have on a person is mostly their appearance according to a picture and their personality is just a short description in text... isn't surprising. 

Survival of the fittest is pretty much an empty tautology.

What survives is presumed to be what was most suited to surviving in its environment ... because it survived. Of course, environments are always changing, and fitness in one context isn't the same in another, so it doesn't do explanatory work it merely describes what mechanically happens. 

At the level of mechanism we can use it in a larger account, but morality doesn't factor in. Survival is a precondition for maintaining some structures of an organism but it doesn't determine how any organism ought to behave while surviving. There are multiple ways to survive, and surviving in an environment necessarily involves changing that environment. If I ask how we ought to change the environment, appealing to survival accomplishes nothing."	3.0	0.0	197	False	True
27351	4855832	changemyview	35628794637.0	https://www.reddit.com/r/changemyview/comments/jyx3lh/_/gd8gpvx/	1207508597.0	35628526289.0	2020-11-22 17:05:10	41809724.0	MysticInept	I as an individual have a right to think you have less worth to me than other people. And you do. and you have no moral right to me to extend personal opportunities to you.	2.0	0.0	35	False	True
27355	4855832	changemyview	35629126071.0	https://www.reddit.com/r/changemyview/comments/jyx3lh/_/gd8ntmf/	1207508597.0	35628249952.0	2020-11-22 17:54:19	37895943.0	iamasecretthrowaway	"We need an r/cmv pinned comment about how bullshitty that ok cupid data is and how grossly it's been misinterpreted. 

Firstly, the ""study"" had users rate an individual's attractiveness and then tracked their message sending. Despite rating men as less attractive than a standard bell curve, women sent an expected number of messages. Assuming that means women think men are unappealing or that women have too high standards is kind of ridiculous. 

A) maybe a dating website *isn't* a normal bell curve of attractiveness. 

B) maybe women are conditioned to be less comfortable opening admitting sexual attraction to strangers, particularly in a potentially sexual situation. 

C) maybe women dont base their level of attraction solely on physical attraction to a photograph so they wouldn't rate people as very attractive without getting to know them. 

D)or maybe the physical things women do find attractive are harder to convey in a photo than the physical things men find attractive. 

E)maybe men on Ok cupid, on average, put less effort into their photos than women did. 

F)maybe a dating website from a time when dting websites were less ubiquitous is just a bad, self selected group of subjects. 

G)maybe there were other factors that affected women's ratings more than men - like maybe they were unconsciously taking things like clothing, props, backgrounds, or even usernames into account in their ratings. 

H) maybe women rate men as below average attraction more often because they view themselves as below their level of attraction also. If my siblings are super smart, I might think of myself as relatively dumb. And if I think (rightfully) you're about as smart as i am, wouldn't I probably rate you as below average intelligence too? The issue there isn't your intelligence or even my perception of it, its that my whole baseline is shifted - my idea of intelligence isn't a standard bell curve.  

But most importantly, the ""research"" found that men disproportionately messaged the women they rated as most attractive while the women messaged a much broader range of people. 2/3 of men only messaged the top 1/3 of women, but women's messages almost exactly mirrored their attractiveness rating - ie, *they may have rated men as being less physically attractive but were* **far** *more likely to give them a chance and try to get to know them.*

Why arent men ever ranting about that?"	5.0	0.0	396	False	True
27589	4855832	changemyview	36096459493.0	https://www.reddit.com/r/changemyview/comments/l67vs7/_/gkyweed/	1280235175.0	36096309949.0	2021-01-27 16:54:48	455019424917.0	joopface	"Evidence of a transition? How about....

1. [1951 parliamentary question](https://web.archive.org/web/20120925022355/http://historical-debates.oireachtas.ie/D/0125/D.0125.195104100006.html)on metric conversion
2. [1964 parliamentary question](https://web.archive.org/web/20120901232358/http://www.oireachtas-debates.gov.ie/D/0209/D.0209.196405120011.html) on switch to metric coinage
3. [1987 parliamentary question](https://web.archive.org/web/20120901232253/http://www.oireachtas-debates.gov.ie/D/0375/D.0375.198711240050.html) on conversion to kilos for food
4. [2003 parliamentary question](https://web.archive.org/web/20120901232407/http://www.oireachtas-debates.gov.ie/D/0572/D.0572.200310140033.html) on the changes to speed limits"	9.0	0.0	41	False	True
27628	4855832	changemyview	36105901300.0	https://www.reddit.com/r/changemyview/comments/l6x2bt/_/gl4irqs/	1281410057.0	36105807906.0	2021-01-28 18:11:19	57959820.0	yumyumnom	"&gt; I understand that when there is an expectation of liquidity then the risk of a reduction in liquidity can cause a run. No one wants to own something if they're not sure they will be able to sell it right away if the norm is that they are always able to sell it immediately. If the status-quo shifted such that there were an expectation of lower liquidity then the steady-state investment would surely remain roughly equivalent - lower liquidity wouldn't reduce peoples desire to earn capital gains. Is there another factor to this I'm not understanding? 

So you are acknowledging that there would be a shift from one status quo to another and that expectation of liquidity is currently of value. Do you not then see that shifting from scenario A where you have liquidity which you find valuable, to scenario B where you have less of said liquidity, would lead prices to move lower?

&gt; Surely this risk mitigation could be achieved through more traditional insurance models without being significantly disruptive. The effect should be the same but would limited to hedging the risk for the people who produce the commodities. Letting others who have no stake in the market hedge against it is like letting random people take out an insurance policy against me crashing my car. 

It's interesting that you bring up insurance, because insurance companies also use derivatives extensively to hedge. You should look into reinsurance companies and how they hedge the exposure they take on from retail insurers. It can get pretty esoteric, hedging disaster insurance like floods or fires with things like weather derivatives (which yes actually exist). These types of derivatives are also used in agriculture to hedge for things like crop yield fluctuations as well. Letting people who have no stake in the market take on risks associated with said market is a fundamental element of insurance.

&gt; I'll need to think more on this. 

Ok, but it's fundamentally no different from any other type of hedging."	3.0	0.0	336	False	True
27782	4855832	changemyview	36173960022.0	https://www.reddit.com/r/changemyview/comments/le0sb6/_/gm91i6u/	1293341010.0	36173785046.0	2021-02-06 17:51:39	33767560446.0	spiderbabyinapram	I don't think you understand. Disney Princess is a brand, that very specifically doesn't include the Frozen pair. This is splitting hairs, but also annoying as multiple folk have told you this but you won't accept it.	3.0	0.0	37	False	True
27835	4855832	changemyview	36216851196.0	https://www.reddit.com/r/changemyview/comments/lhonio/_/gmykt8c/	1299493392.0	36216753893.0	2021-02-11 17:31:18	415996153.0	muyamable	But this system also incentivizes the university to offer degrees for more higher paying jobs than lower paying jobs. It costs a similar amount to educate an elementary school teacher as it does to educate a structural engineer, but the university is going to earn more from the structural engineer than the teacher. So what does it do? It offers more engineering degrees than teaching degrees, even if society needs more teachers than engineers.	4.0	0.0	74	False	True
