	subreddit_id	subreddit	id	permalink	link_id	parent_comment_id	created_utc	author_id	author	body	score	controversiality	number_of_tokens	bot_delta_awarded	delta
27918	4855832	changemyview	36428747365.0	https://www.reddit.com/r/changemyview/comments/m1z4cn/_/gqgqhd1/	1333574087.0	36428208745.0	2021-03-10 16:57:11	177237973542.0	neurealis	"First of all, there is no empirical evidence which indicates that trans women are better at sports than cis women. Especially for kids who transition before they go through puberty (and with acceptance and awareness of trans people increasing, this will becone the case for the vast majority of trans people), physical differences between trans and cis women aren't actually that big compared to the variability between individual women. Especially in team sports, where a lot of success is dependent on things that aren't related to strength, like teamwork, reflexes and situational awareness, it probably won't make that much of a difference if you're a cis woman or a trans woman who transitioned before puberty. 

Also, one of the main reasons why women's sports isn't more popular is that sports organisations have deliberately tried to stop women's sports from being publicly viewed at all, and still continue to choose not to promote it more. Women's soccer used to be more popular in the UK than men's soccer, until the FA banned women from playing on official pitches. The women's soccer world cup final in 2019 was scheduled on the same day as the final games for men's soccer tournaments, but still managed to attract more viewers than both of the combined in the US, as well as the previous years men's soccer world cup. It also had double the viewership of both the Stanley cup final and the MLB all-star game held that year."	2.0	0.0	244	False	True
27974	4855832	changemyview	36485744433.0	https://www.reddit.com/r/changemyview/comments/m7y2n4/_/greo4kx/	1343602912.0	36485725443.0	2021-03-18 20:56:35	460854358987.0	ElizaThornberry4	"Lol ""a point."" No, I think it, coupled with all other evidence, all but conclusively proves it was anti-Asian. I think at this point the burden falls on you (or anyone) to provide the evidence that it's not racially driven."	16.0	0.0	40	False	True
28453	4855832	changemyview	36699310832.0	https://www.reddit.com/r/changemyview/comments/mswp77/_/guxtlgw/	1378810771.0	36698255788.0	2021-04-18 04:58:10	330384905477.0	plumsftw	"You keep dealing in non-absolutes. For example you added to your OP that ""most girls are boring"" followed up with ""what do most girls like nowadays""? Hence you are admitting that you don't actually know what girls are interested in. How can you conclude to know what women are like without having really understood or befriended any? How do you know this type of girl has a ton of guys going for them? How do you they would probably hate you? Assuming you're referring to your own attitude toward women, the solution is simple: become the type of person whose mindset would not make them hate you.

As many people have said in this thread, the best way for you to change your view is to first work on yourself. Through therapy, through building on your confidence and not hating yourself, and eventually through making friends of both genders. You need to stop assuming you know things. I don't know how many times you've been rejected but it's clear that those instances had a large negative effect on your confidence and defined your worldview, even if it was just a few times. The way to combat that is to work on yourself and become the type of person to keep persisting and being less afraid of rejection. But unless you're willing to not let those rejections define your view of women as a whole, your view isn't really going to be changed."	5.0	0.0	242	False	True
28631	4855832	changemyview	36883499322.0	https://www.reddit.com/r/changemyview/comments/nbg2x1/_/gxzhe7u/	1409948101.0	36883216970.0	2021-05-13 15:05:06	38957372.0	ThatIowanGuy	Because public consensus of a movie is an objective statement compared to personal choice which is subjective. I enjoyed Avengers more than Justice league would be a subjective statement while, if there’s data to show it, more people enjoyed Avengers than Justice league would be an objective statement.	-5.0	1.0	48	False	True
28635	4855832	changemyview	36883641552.0	https://www.reddit.com/r/changemyview/comments/nbg2x1/_/gxzkfyo/	1409948101.0	36883607598.0	2021-05-13 15:27:03	7215168.0	dublea	"&gt;Can I give a delta in a meta thread?

*What do you get if you cross an Elephant and a Rhino?* /S

I'm not sure but you're welcome to try.

&gt;I’m just saying that there still is room for CMVs in the style of X is better than Y because public reception, possibly awards from experts, as well as comparing profits are showing that objective measurements do exist for seemingly subjective topics.

That's the crux. I agree but I think posters need to address and acknowledge that it is subjective. Even possibly providing a hint as to what may change their view. For instance, having them consider a different show/movie within the same context they didn't consider. But if they accepted and acknowledged the subjectiveness up front, it would reduce/prevent those posts from devolving into a subjective vs objective conversation."	4.0	0.0	140	False	True
29301	4855832	changemyview	37037523576.0	https://www.reddit.com/r/changemyview/comments/nru8lh/_/h0j6o3c/	1437482501.0	37037506017.0	2021-06-04 05:08:36	43998997.0	Fifteen_inches	So again, it’s about the indecency rather than the kink.	189.0	0.0	10	False	True
30659	4855832	changemyview	37922813789.0	https://www.reddit.com/r/changemyview/comments/pteddo/_/hf69ie5/	1561033788.0	37845196961.0	2021-10-03 01:58:48	500379025682.0	ConsistentNumber6	"Yes, delayed cord clamping greatly reduces anemia at 6 months (most important if you're breastfeeding, since milk doesn't have much iron) and is now standard in many hospitals. I considered donating cord blood, but decided not to for this reason.

I didn't know that the placenta could be used for research. If I'd been asked I'd have been all over that..."	1.0	0.0	61	False	True
30883	4855832	changemyview	37865977335.0	https://www.reddit.com/r/changemyview/comments/pufxp5/_/he8fb3r/	1562786393.0	37863641355.0	2021-09-25 15:53:25	869723740103.0	chaching65	The justices are not allowed to strike laws down as they are passed.  The law, especially for things like abortion, sodomy, contraceptives, etc, needs to be put in practice and an actual case needs to be presented to them.  So after the 14th amendment was passed no abortion case was brought to the supreme court until RvW.  Like how the congressional act that extended judicial jurisdiction wasn't struck down until a case was brought to them in Marbury vs Madison.	1.0	0.0	80	False	True
31134	4855832	changemyview	38302652592.0	https://www.reddit.com/r/changemyview/comments/qyi2ya/_/hlgerw0/	1630071154.0	38302554322.0	2021-11-21 01:23:02	5410853.0	AnythingApplied	"Thanks for the delta!

&gt; that these companies beat analyst expectations

Analysts missing on mass like that isn't really a criticism unless they missed by more than the rest of the market did.  They could miss by a lot and still potentially beat the market.  Not sure if that is true here or not, don't know enough about that EPS surprise.

&gt; Would you say analysts are slightly better than average investors?

The significant majority of analysts, personal investors, mutual fund managers, etc that beat the market are only beating the market due to luck and not the quality of their strategy.  But that shouldn't be confused with none of them actually have strategies that are better than the market, though identifying which analysts should be listened to in general is likely as hard an activity as just beating the market (since successfully listening to the right analysts would also lead to beating the market).

But ultimately, I do think that ""Jim Cramer said this is a buy"" is useless.  Their final recommendation aren't what I would suggest you listen to.  It's the reasoning and how you incorporate their reasoning into your analysis that matters."	2.0	0.0	195	False	True
31248	4855832	changemyview	38378029183.0	https://www.reddit.com/r/changemyview/comments/r5udqz/_/hmpacu7/	1642402331.0	38377922239.0	2021-11-30 19:49:35	336640785386.0	Echoos1	"Each person being an advocate is a big part of it, but the buying power usually has more influence on the market that being vocal. We've seen many times big companies shrug off scandals when people outcry for justice but still make their bottom line from customers.

Consumers who feel morally invested in sustainability are more likely to support and buy from businesses also interested in sustainability.

In architecture, basically every architect is interested is sustainable design, but sustainable buildings only get built for clients willing to pay for it. Same idea here"	53.0	0.0	93	False	True
31338	4855832	changemyview	38380607364.0	https://www.reddit.com/r/changemyview/comments/r5udqz/_/hmqtm6c/	1642402331.0	38380103200.0	2021-12-01 02:21:41	5840949.0	ristoril	"Nobody's placing blame except the people blaming consumers for their consumption practices. 

The important thing to figure out is who to hold accountable and how to do it.  Most of the time ""accountability"" is thought of as a synonym for ""punishment,"" but the real meaning has to do with how do we make sure entities don't just do what they want but rather do things with intention and a full appreciation of the full consequences of their actions. 

This isn't even about the past, really.  It is what it is.  We can clean it up but cleaning up after the fact isn't a good as preventing the mess in the first place.  

So can *consumers* stop producers from producing in a messy fashion?  No.  At best they can not reward producers who make huge messes, but the mess is there at that point. 

The only entities who can prevent producers from making messes are producers.  They'll only do it if we use the tool of government to create the guidelines and regulations and other guardrails that will lead them to least messy production choices. 

After the fact is too late, and it's the only lever consumers have.  Before a mess is made is the perfect time, and that's something voters and their elected representatives can do."	20.0	0.0	216	False	True
31501	4855832	changemyview	38549175867.0	https://www.reddit.com/r/changemyview/comments/rlxxr8/_/hpj6mgr/	1669442084.0	38549048049.0	2021-12-22 07:45:10	5410853.0	AnythingApplied	"&gt; Yes. Outcomes matter though.

Right, but I'm not sure how more clearly they can say it than ""An accident isn't a crime unless..."". It has to be more than an mere accident.

&gt; She intended to fire a taser into a moving vehicle which could easily be recklessly endangering public safety

That is true, but that would only apply if firing the taser wasn't the right call to be made at that moment. None of your original post said anything remotely like, ""She shouldn't have even fired her taser in that situation"".  This is an argument the prosecution is trying to make, so there is an argument to be made there, but it certainly isn't a clear cut one.  If you want to have that discussion on whether or not she was right to draw a taser in that situation, then we can have that, but that is a much harder target than you seem to be aiming for.  Your original post seems to try to paint her honest mistake as still meeting the bar.  Without her intentional act (the one she intended on doing, drawing the taser) being a reckless one, she just isn't guilty of anything.  You would need to show she shouldn't have drawn any weapon in her situation to do that."	3.0	0.0	216	False	True
31505	4855832	changemyview	38549267703.0	https://www.reddit.com/r/changemyview/comments/rlxxr8/_/hpj8lbr/	1669442084.0	38549211736.0	2021-12-22 08:10:26	5410853.0	AnythingApplied	"Thanks for the delta!

Why the focus on the reasonable person standard? The Jury guidance for this case I linked made no mention of leading the jury to use that standard (though it only had excepts from the guidance, its possible it was elsewhere).

Also, other courts have had no issue using a ""reasonable officer"" standard.  If you want to dig into all the details of how the ""reasonable officer"" standard is applied, you can see [this document](https://law.lclark.edu/live/files/7237-lcb144art8mandiberg.PDF).  It is literally *precedented* as can be seen by the supreme court cases referenced in that document.  It has quite a rich precedented as a concept."	2.0	0.0	104	False	True
31562	4855832	changemyview	38700766337.0	https://www.reddit.com/r/changemyview/comments/s04iq8/_/hs1fqf5/	1693263824.0	38697570930.0	2022-01-10 08:34:44	56717008.0	fschiltz	It would be even worse for international competition. A small country like mine (Belgium) is pretty good at the moment because we were lucky to have a few star players in the same generation that we can rely on. But if the depth of the field was more important, small countries could never even compete with large countries such as France, Germany and Brazil and the large countries would be even more dominant than now.	1.0	0.0	75	False	True
31563	4855832	changemyview	38701338617.0	https://www.reddit.com/r/changemyview/comments/s04iq8/_/hs1rzzt/	1693263824.0	38698892590.0	2022-01-10 11:08:36	862824749675.0	FjortoftsAirplane	"A general principle is that anything that removes an element of luck from the game will favour the more skilled player(s).

Limited substitutions means the effects of injuries, fatigue, players being cautious on a yellow card, or just failed choices that aren't changeable are further reduced, and that benefits the team that has more resources.

Having unlimited substitutions would make squad depth that much more important, and that only benefits those who can afford the costs.

It would vastly reduce the efficacy of cards. Often players take yellows to prevent a promising attack, or they use ""rotational fouling"" where no one player fouls an opponent enough to get a yellow/red for persistent foul play. Unlimited subs would mean you could bring players on for the sole purpose of committing fouls, disrupting the game, and killing attacks.

My other concern is that substitutions take time and are already used to disrupt the flow of a game. Having unlimited subs would slow the game right down. You could always go for roll on/roll off subs but that would involve an overhaul to the way subs are made and require extra refereeing (could make things difficult at lower levels). It would certainly add delays though, as if a coach wants to put out five defensive players for a set piece or corner, that's five on that need to take up positions. Same for attacking plays from corners or long throws. The one thing football doesn't need is people wasting more time.

I also think there's something to be said in favour of limitations. It means that the way the game is initially approached matters much more. How a team sets up for a game isn't a trivial decision. Formations are more rigid as wholesale changes can't be made, and we get to see strategies and tactics play out over 90 minutes rather than be in a state of flux in which the system constantly changes. I also think the level of organisation required in football systems wouldn't lend itself to chopping and changing so much anyway (I suppose that might be a plus to your side as teams wouldn't actually utilise their subs too often). Personally, I don't want to see a constantly shifting game, I want to see whether a team's tactics work over 90 minutes."	3.0	0.0	384	False	True
31623	4855832	changemyview	38865691209.0	https://www.reddit.com/r/changemyview/comments/sfpezh/_/hurmn9l/	1719432989.0	38865665344.0	2022-01-29 21:11:05	36822851.0	iwfan53	"&gt;The second statement is part of the reasoning for my view (provided it's free).

Why do you think that making it so that prisoners can rape people is a better way of getting people free government sex, then simply have the government hire a bunch of prostitutes and provide them to people as needed?"	2.0	0.0	54	False	True
31647	4855832	changemyview	38868624103.0	https://www.reddit.com/r/changemyview/comments/sfpezh/_/hutdiav/	1719432989.0	38868084701.0	2022-01-30 05:03:05	257177547136.0	bogdanoffinvestments	"How about fanatical racists whose only desire is to hurt and kill those they hate? Should we turn in a Black or Chinese petty thief to the KKK because they threaten to blow up a building? What would the world look like if good people give in to the demands of psychopaths?

Justice dictates we can’t put someone in jail before he commits a crime. Unfortunately, this also means innocent people have been harmed. But severe punishment will always be a much more effective deterrent than appeasement. Look at how drastically acts of terror have declined since the world collectively bombed the shit out of ISIS and sent all their leaders behind bars or to the grave. Somehow I don’t think this outcome would have occured had we allowed them to take over the Middle East."	1.0	0.0	136	False	True
31678	4855832	changemyview	38948047169.0	https://www.reddit.com/r/changemyview/comments/sfpezh/_/hw4ntj5/	1719432989.0	38873678913.0	2022-02-08 20:26:23	19014711.0	StarChild413	"But if you're forcing women into this and basically saying to the straight male incels ""fuck this woman or we're going to think you're going to commit a mass shooting"", don't you realize the optics would be kinda shitty"	1.0	0.0	39	False	True
31769	4855832	changemyview	39337336821.0	https://www.reddit.com/r/changemyview/comments/tr00wo/_/i2kfncl/	1798869912.0	39337310834.0	2022-03-29 14:22:01	25470889.0	polr13	"&gt; I am suggesting that a significant contributor to the choice of violence is toxic masculinity, **and that is not being discussed.**

Emphasis mine.

Well, hopefully I can change your view on the 'not being discussed part' because the role of toxic masculinity in this incident is absolutely being discussed.

Examples:

https://www.glamourmagazine.co.uk/article/will-smith-toxic-masculinity

https://thelogicalindian.com/trending/will-smith-chris-rock-34711

https://www.tennessean.com/story/opinion/2022/03/28/will-smith-chris-rock-oscars-2022-lessons-learned-toxic-masculinity/7192253001/

https://www.latimes.com/opinion/story/2022-03-28/will-smith-chris-rock-oscars-slap-toxic-masculinity

https://www.newsweek.com/toxic-masculinity-defined-will-smith-hit-chris-rock-1692505

https://www.newstatesman.com/comment/2022/03/will-smith-vs-chris-rock-shows-toxic-masculinity-always-has-the-last-word"	6.0	0.0	57	False	True
33218	4855832	changemyview	39476145596.0	https://www.reddit.com/r/changemyview/comments/u49tek/_/i4v2svw/	1821161756.0	39476115828.0	2022-04-15 18:30:37	1279406675954.0	LooseBar2222	"Is that what your CMV is? It seems like the goalposts have moved from ""Asking celebrities to call off their fans is stupid"" to ""Celebrities shouldn't be on the hook for their fans from a legal perspective.""

AFAIK, there's no legal issues with a person's fans harassing someone. There might be legal issues for those specific fans, but the celebrity isn't on the hook. The only way there could be legal repercussions is if the celebrity is being defamatory or actively encouraging harassment."	3.0	0.0	83	False	True
33223	4855832	changemyview	39476185923.0	https://www.reddit.com/r/changemyview/comments/u49tek/_/i4v3o03/	1821161756.0	39476151115.0	2022-04-15 18:36:34	8933892.0	Deft_one	So then it's not extremely stupid to ask that they use their 'power' as we agree they 'should,' is it?	1.0	0.0	20	False	True
33561	4855832	changemyview	39754339052.0	https://www.reddit.com/r/changemyview/comments/uuml7w/_/i9gpgbw/	1865427692.0	39754305239.0	2022-05-21 16:15:22	197666713968.0	hastur777	"https://www.theatlantic.com/ideas/archive/2020/07/dehumanizing-condescension-white-fragility/614146/

This article does a decent job laying out the issue. Any statement besides agreeing that you’re complicit in systemic racism is white fragility and more evidence of racism."	29.0	0.0	29	False	True
33635	4855832	changemyview	39755250949.0	https://www.reddit.com/r/changemyview/comments/uuml7w/_/i9h8zyd/	1865427692.0	39755221979.0	2022-05-21 18:46:03	161685.0	hacksoncode	"If a person interpreted it as an attack on a person trying to get through the thick skull of a probably white supremacist, mostly. 

Your comment looks like it's focused on the horrors of the possibility that white people might have to feel shame or guilt, rather than the willful ignorance of the original tweet thinking racism is ""long ago"". 

Let's rearrange that response and remove the apparent attacks on the person holding the original person accountable for their willful ignorance:

&gt;What we need to do is figure out a way to combat the revisionist history narratives and misinformation that are plaguing conservative spheres. It's likely that promoting ""guilt"" is counterproductive in this effort, because those conservative spaces suffer from white fragility."	6.0	0.0	122	False	True
33753	4855832	changemyview	39756268498.0	https://www.reddit.com/r/changemyview/comments/uuml7w/_/i9hut3m/	1865427692.0	39756225040.0	2022-05-21 21:47:06	30083292.0	JayStarr1082	I just explained it, in depth. You feed an us-vs-them narrative that directly contributes to radical groups feeling victimized. This pushes them down the path of political extremism and leads to racially-motivated terrorism. If white American culture wasn't so hostile towards ethnic minorities these terrorist attacks against said minorities wouldn't happen - or at least would happen significantly less frequently.	2.0	1.0	60	False	True
34228	4855832	changemyview	39877407904.0	https://www.reddit.com/r/changemyview/comments/v6yji7/_/ibhz8v4/	1886140735.0	39877336376.0	2022-06-07 15:47:39	19271185.0	Moccus	OSHA doesn't always cover state and local government employees.	7.0	0.0	9	False	True
34418	4855832	changemyview	39891630868.0	https://www.reddit.com/r/changemyview/comments/v8gx51/_/ibqg3dg/	1888677829.0	39891376780.0	2022-06-09 14:19:37	29032527.0	Salanmander	"&gt; there's legitimately no reason we can't start gathering up junk in general and start chucking it in any random direction and letting inertia take care of the rest. Or throw it into the sun if we're worried it'll hit a space marmot in 90,000 years.

That's...not how orbits work.

If you just throw something in a random direction, it will be in approximately the orbit you were, and it will pass through (roughly) the same place relative to the body it's orbiting repeatedly. The more we do that, the more we increase the probability of colliding with something near the bodies we visit frequently.

If you actually want to make it not a problem, you need to throw it out of the solar system, which takes a *lot* of energy. It's easier the further out you are, but even if you're near Jupiter's orbit, you still need to throw things at about 5 km/s to get them to leave the solar system.

Throwing it into the sun is actually even *harder*. To throw things out of the solar system you need to increase their velocity by about 40% of your current velocity around the sun....to throw them *into* the sun you need to decrease their velocity by more than half of its current velocity around the sun. And increasing and decreasing velocities are equally difficult in space.

In short ""throw it into the sun"" and ""chuck it into space so that we'll never need to worry about it"" are both *much* more expensive than more traditional waste management."	415.0	0.0	259	False	True
35183	4855832	changemyview	40196896144.0	https://www.reddit.com/r/changemyview/comments/w2t1w1/_/igs6zkg/	1939632337.0	40196793635.0	2022-07-19 14:37:05	302842386298.0	shotwithchris	Well unless you hate fun times around a campfire with some good people and eating s’mores I would appreciate if you consider a delta	2.0	0.0	24	False	True
35191	4855832	changemyview	40196994060.0	https://www.reddit.com/r/changemyview/comments/w2t1w1/_/igs934c/	1939632337.0	40196951184.0	2022-07-19 14:50:53	302842386298.0	shotwithchris	I would also argue that graham crackers are superior due to its high versatility. S’mores, pie crust, crumble, ice cream topping. There’s way more ways to have graham crackers.	1.0	0.0	29	False	True
35715	4855832	changemyview	40398665760.0	https://www.reddit.com/r/changemyview/comments/wncj1v/_/ik4bm00/	1974133363.0	40398617986.0	2022-08-13 12:14:50	20786301.0	premiumPLUM	Major infrastructure projects that go into the billions are practically impossible to accurately estimate.  There's no reason to get fussy over someone else not knowing exactly how much it's going to cost to complete a multi-year project that has never been attempted before.	8.0	0.0	43	False	True
