	subreddit_id	subreddit	id	permalink	link_id	parent_comment_id	created_utc	author_id	author	body	score	controversiality	number_of_tokens	bot_delta_awarded	delta
19194	4855832	changemyview	30580447500.0	https://www.reddit.com/r/changemyview/comments/8vvvtv/_/e1qt4b0/	537285091.0	30580398682.0	2018-07-03 21:58:16	8643930.0	spacegecko	Realistically, I have a hard time imagining anyone would be able to change this particular view...I just don't think that the idea you're wanting to hear from this CMV (Homosexuality is 100% always genetically determined?) is reflective of science. 	6.0	0.0	39	False	True
19370	4855832	changemyview	30669891479.0	https://www.reddit.com/r/changemyview/comments/92p5ah/_/e3827pz/	548728073.0	30668623772.0	2018-07-29 05:13:25	7620111.0	JNiggins	"&gt; Pro life people want to stop abortion, not to punish women who have them

The President briefly talked about punishing women for abortion &amp; when everyone rightly freaked out, he recanted. But I think his remarks showed his inner thought process. [&lt;Source&gt;](https://www.nytimes.com/2016/03/31/us/politics/donald-trump-abortion.html). 

In addition, Republican representatives have often called for the punishment of women, in addition to their doctors, for abortion. 

An ID rep. called for their execution, but then similarly walked it back. [&lt;Source&gt;](https://www.washingtontimes.com/news/2018/apr/3/bob-nonini-idaho-gop-candidate-suggests-punishment/)

Another ID rep. tried to introduce legislation that would charge women for 1st degree murder just last year [&lt;Source&gt;](http://www.ncsl.org/research/health/fetal-homicide-state-laws.aspx).

A number of OH representatives have introduced a bill that, while currently under revision, would currently criminally punish women &amp; doctors with the same crime [&lt;Source&gt;](https://www.legislature.ohio.gov/legislation/legislation-summary?id=GA132-HB-565).

I would posit that the politicians who say that they would not punish a women for an abortion, but only punish their doctor, are playing a politically expedient game. It is the reason they ""accidentally"" tell the truth &amp; then have to walk it back. The party's actions as a whole in other avenues of this question seem to show that they would change their hand if the political wind blew differently, or if they had more power. 

Indeed, since Planned Parenthood v. Casey sets the state's right to ban abortion at ""viability of the fetus,"" and due to advancements in medical science, viability is therefore a moving target that is always waxing backward (from 24 weeks at the start of the millennia to around 20 weeks now). Because of this women are being prosecuted as we speak [&lt;Source&gt;](https://www.nbcnews.com/news/asian-america/indiana-has-now-charged-two-asian-american-women-feticide-n332761) &amp; that is likely to continue &amp; increase. 

Furthermore, pro-life individuals often frame the argument as one of a binary choice between if a fetus is a ""human life"" or not (ignoring the spectrum of viability in Planned Parenthood v. Casey). This is almost always to focus the argument in such a way to quantify ""abortion as murder."" The logical conclusion to that construction of thought is that murderers should be punished. This is a shocking, but logically consistent framework for those self-identifying as ""pro-life"" &amp; is likely the reason why their representatives do what they do &amp; will likely punish women &amp; feel justified in doing so. 

Finally, before 1973 laws banning abortion almost always had provisions for the punishment of the women for their abortions. [&lt;Source&gt;](https://en.wikipedia.org/wiki/Abortion_in_the_United_States#History). Women were not ""protected"" by anti-abortion laws, they were pursued by the state for violating these laws. If the supreme court were to invalidate their own previous abortion rulings, chiefly Roe v. Wade &amp; Planned Parenthood v. Casey, the status quo ante would prevail &amp; abortion would be illegal, in admittedly various forms, in 38 of 50 states immediately [&lt;Source&gt;](http://www.ncsl.org/research/health/fetal-homicide-state-laws.aspx).

I could actually go on, but to say that those who self-identify as pro-life don't want to punish women is to admit that you simply don't fully understand the history of the topic in which you speak. "	3.0	0.0	485	False	True
20002	4855832	changemyview	30724058251.0	https://www.reddit.com/r/changemyview/comments/96pfsy/_/e44b72j/	555460162.0	30720754041.0	2018-08-13 16:07:46	5108697.0	woodrail	cool, do I get a delta?	1.0	0.0	6	False	True
20071	4855832	changemyview	30793249774.0	https://www.reddit.com/r/changemyview/comments/9cbif3/_/e59i7la/	564888063.0	30793234096.0	2018-09-02 13:03:59	20663005.0	crayonmuncha	"https://www.ncbi.nlm.nih.gov/pmc/articles/PMC5385318/

https://www.bjs.gov/content/pub/pdf/GUIC.PDF

http://www.socialmedicine.info/index.php/socialmedicine/article/download/852/1649"	3.0	0.0	3	False	True
20082	4855832	changemyview	30793387853.0	https://www.reddit.com/r/changemyview/comments/9cbif3/_/e59l64t/	564888063.0	30793337497.0	2018-09-02 14:07:09	136383837626.0	begonetoxicpeople	"https://everytownresearch.org/background-checks-loophole/

https://www.rand.org/research/gun-policy/analysis/background-checks.html

https://www.americanprogress.org/issues/guns-crime/reports/2018/03/15/447964/require-background-checks-gun-sales/

http://www.center4research.org/does-gun-control-really-work/
(First part only really deals with the argument about background checks)"	1.0	0.0	15	False	True
20129	4855832	changemyview	30795323668.0	https://www.reddit.com/r/changemyview/comments/9cgibn/_/e5aqntg/	565121219.0	30795206621.0	2018-09-03 01:55:58	65061122.0	Doodoointhepeepants	"I think your issue is expectations, I’m also a bit surprised by this being something you aren’t used to, as I’ve been spending 4-8 weekends a year in a public campground for the last 30 years from Ohio to Washington (mostly WI, MN, MI, SD, ND) and  Friday/Saturday night, especially on Labor Day/Memorial Day there is almost always music, and groups who aren’t there to do much else than drink outside with a fire.  I literally got back a few hours ago from camping in a state park here and there were multiple sites that were playing music until around 10, with fires and talking/laughing until even later.

Basically comparing a Tuesday to a Saturday is like comparing what a bar restaurant is like on a Tuesday night vs a Saturday.  Again, this is public land, not yours, the rules are determined by the public, not just the enthusiasts.

Consider people like this being there a good thing, and them enjoying the park being a good thing, basically if parks aren’t accessible to all, they will cease to exist (since they exist purely due to the will of the public).  That may mean you have to deal with other people’s sound waves impeding into your space, however sound waves have never been seen as an impediment on the “your freedoms ends where mine begins” dichotomy.  Basically, don’t allow yourself to be so affected by others, and don’t have expectations of others to adjust their behavior, while within rules, on public land."	84.0	0.0	251	False	True
20600	4855832	changemyview	30811346096.0	https://www.reddit.com/r/changemyview/comments/9dutea/_/e5ka2sw/	567468370.0	30811137343.0	2018-09-07 16:18:00	30750100.0	Amp1497	"If an album is your work and a representation of your thoughts and ideas, why not use your physical image to represent the album? If an album tells a story or has a deeper meaning, than I agree with you. But if an album is simply a person's outlet or their own personal expression, then I see nothing wrong with using their image on the cover.

We'll use the Phil Collins album *Face Value* as an example. The album is simply about his personal life and his own thoughts and feelings. He's presenting his feelings at ""face value"". I believe the cover fits that. It's his face, because *his* expression of *his* emotions in musical form. The cover being in black and white represents that his ideas are presented in black and white. He's not trying to color anything up, or try and dress up his ideas to make it more presentable. He wants to express himself as straightforward as he can.

Another example is Selena Gomez's album *Revival*. The cover is simply her, naked, in black and white. The album is meant to be a ""naked"" or ""stripped down"" version of her feelings. I'll admit while it's not overly creative and the idea for the cover can be considered overused, it still fits the entire point of the album, and fits it well. The same can be said for the Phil Collins album. 

I think an album cover is less about being creative and more about being representative of an album. Doing both of course speaks volumes about the artist(s), but if an album is a simplistic expression of the artist, then why can't the cover reflect that? "	3.0	0.0	279	False	True
20628	4855832	changemyview	30889332779.0	https://www.reddit.com/r/changemyview/comments/9jwnhh/_/e6uplpn/	577631717.0	30889322721.0	2018-09-29 13:57:27	10605545.0	Milskidasith	"&gt; however that would mean that the system would be somewhat unfair and the show asserts that only bad people should be deserving of an eternity of punishment in the bad place.

This is more of a meta-problem with the show, TBH. It is very difficult to mesh ""these people were so bad they deserve an eternity of punishment"" with ""these people are sympathetic protagonists we could initially conclude deserved to be in The Good Place."""	8.0	0.0	76	False	True
20633	4855832	changemyview	30889368967.0	https://www.reddit.com/r/changemyview/comments/9jwnhh/_/e6uqdmv/	577631717.0	30889362603.0	2018-09-29 14:12:50	17119023273.0	AlexDChristen	Well you said yourself that both my be required, and then you said it just seems unfair which I'm saying it is. That's the point of the show.	6.0	0.0	28	False	True
20643	4855832	changemyview	30889440033.0	https://www.reddit.com/r/changemyview/comments/9jwnhh/_/e6urwgx/	577631717.0	30889434651.0	2018-09-29 14:41:01	21491549.0	Ansuz07	"&gt;I didn't mean to make the point that Chidi didn't belong in the bad place, just that one of the two didn't belong if it's a consistent system that values either actions or motivations.

If it is a blended system - where both intention and outcomes matter - then it makes sense why both of them were ruled ""bad""."	3.0	0.0	59	False	True
20703	4855832	changemyview	30947922535.0	https://www.reddit.com/r/changemyview/comments/9oetyp/_/e7tlduv/	585198385.0	30947896449.0	2018-10-15 18:25:48	52869270.0	Love_Shaq_Baby	"&gt;There would undoubtedly be a spike in the use of it once it's legalized but it would most definitely not create a significant amount of new addicts.

Why would a spike in the use of an addictive substance not create new addicts? Should I point you to the opioid crisis caused by use of legal prescription painkillers?

&gt;In fact, the net amount of addicts might actually go down once people no longer have to deal with the stress of having an illegal addiction, would be able to open up about it and turn themselves around

Again, the opioid crisis would tell us otherwise."	9.0	0.0	103	False	True
20780	4855832	changemyview	31001765114.0	https://www.reddit.com/r/changemyview/comments/9slarx/_/e8pnf22/	592218573.0	31001756791.0	2018-10-30 06:31:56	11630688.0	veggiesama	"""Sex Change Regret Dot Com"" isn't an authoritative source. One of the tabs at the top is literally ""Things I've learned.""

The [NHS](https://www.nhs.uk/conditions/gender-dysphoria/treatment/) is better. I'm not even British but I recognize it's a world leader in medical research."	30.0	0.0	39	False	True
20782	4855832	changemyview	31001768157.0	https://www.reddit.com/r/changemyview/comments/9slarx/_/e8pnhel/	592218573.0	31001756791.0	2018-10-30 06:34:03	49570125.0	Bladefall	These are biased, non-scientific sources. Here is a link to a comment with many better sources that say transition drastically improves trans people's lives and health: https://www.reddit.com/r/changemyview/comments/9beuwu/cmv_i_believe_people_with_gender_dysmorphia/e52jg1t/	43.0	0.0	27	False	True
20785	4855832	changemyview	31001772889.0	https://www.reddit.com/r/changemyview/comments/9slarx/_/e8pnl21/	592218573.0	31001760438.0	2018-10-30 06:37:25	55591705.0	PennyLisa	"&gt; urely there would be some form of medication to ""correct"" this imbalance and set them ""back on track"", no?

No. There isn't. Many things have been tried: Antidepressant medications, antipsychotics, high dose hormones, hormone suppression, ECT, none of it has much of an effect. What actually works is gender affirmative treatment which includes hormone therapy.

The ""studies"" you quote are just opinions. There's a fairly extensive body of scientific literature on this that largely agrees with gender affirming care."	17.0	0.0	80	False	True
20843	4855832	changemyview	31003495709.0	https://www.reddit.com/r/changemyview/comments/9sqeqn/_/e8qoie5/	592456991.0	31003464854.0	2018-10-30 18:34:44	20546783.0	Grunt08	"Well, imagine how some Americans might react if Saudi Arabia decided to lobby the United States not just for favorable foreign policy, but internal cultural change.  Imagine they were advocating subjugation of women and curtailment of their rights through social advocacy and education.

Do you think there might be negative consequences?  That maybe Americans incensed by that kind of cultural interference would be less inclined to favorable foreign policies towards Saudi Arabia?

You seem to think doing this through NGOs shields from these consequences, but would you draw a huge distinction if the education I mentioned was technically administered by a Saudi-funded NGO?

And it intervention doesn't work, why continue? Why not use those resources on something that actually provides a benefit?"	28.0	0.0	122	False	True
21021	4855832	changemyview	31015352209.0	https://www.reddit.com/r/changemyview/comments/9tnc86/_/e8xqmxd/	593993382.0	31015295362.0	2018-11-02 20:49:43	32192419956.0	mysundayscheming	"No one would ever recommend that an adult who can't cook *see a therpaist*. That's not remotely what they're for. And you made the claim that

&gt; most people will never touch algebra again after their formal education ends

so I hardly think my defense of it is ""punching strawmen."" Your claim is blatantly false. People touch algebra on a weekly if not daily basis. If you weren't being willfully misleading, it's ignorant or indicating a fundamental misunderstanding of what algebra is. Any and all of which suggest we need to spend more time teaching algebra, not less so we can send our children to therapists who absolutely don't teach cooking, family planning, or financial planning anyway. The mental health ramifications of not being able to take care of yourself can't be staved off in advance, but children don't really suffer from not being able to cook and financially plan until they're responsible for it. So not in elementary school, but in college maybe? After college? The best thing we can do is when they're children is not give them some kind of advance therapy but actually teach them how to do those things, which 1) doesn't happen in therapy at all, and 2) has academic fundamentals underlying it which you think ""most people don't touch""

And I would treat my children's teacher and my children's therapists very differently. Someone responsible for teaching my kid algebra forms a very different relationship with them than someone resolving my child's mental illness, potentially diagnosing them, expecting them to be deeply emotionally vulnerable, etc. Find the most ardent supporter of widespread therapy and even they'll be adamant that the therapeutic relationship depends a lot on the personality/methods of the therapist in a way that teaching algebra does not. A bad therapist, or even one that doesn't jive with you, can actively aggravate your mental health problems. A child and their parent need much more control over who provides them professional counseling than who teaches them to read. "	3.0	0.0	334	False	True
21106	4855832	changemyview	31053308050.0	https://www.reddit.com/r/changemyview/comments/9w0kze/_/e9kc5ua/	597970490.0	31053292960.0	2018-11-12 17:43:00	60475543.0	PhasmaUrbomach	Also, if I've proven than Sanders was not even close to as war hawkish as Clinton, have I changed your view?	1.0	0.0	21	False	True
21118	4855832	changemyview	31053556152.0	https://www.reddit.com/r/changemyview/comments/9w0kze/_/e9khha0/	597970490.0	31053549197.0	2018-11-12 18:51:54	60475543.0	PhasmaUrbomach	That was probably the rationale at the time, along with the massive political pressure to ACT after 9/11 in some way. I don't think that war was properly executed, though. 	1.0	0.0	30	False	True
21121	4855832	changemyview	31053769665.0	https://www.reddit.com/r/changemyview/comments/9w0kze/_/e9km20x/	597970490.0	31053410645.0	2018-11-12 19:46:31	11900111.0	Gladix	"&gt; Well I think it is reasonable to expect politicians to estimate the total civilian deaths that would result in foreign invasions.

Okay, so I'm starting to see where the missunderstanding is. The bill doesn't grant the right to wage war. It grants limited power for military to pursue terrorist's related to 9.11. The AUMF was used in Philippines, Georgiea, Yemen, Djibouti, Kenya, Ethiopia, Eritrea, Iraw, Somalia.

Most of the countries US didn't invade.

US used the AUMF bill to set up resources in Afganistan to communicate with Al-Qaeda, so they would give up bin Laden who was connected with 9.11. And to cease supprting terrorist's against US.

Al-qaeda refused, and the war begun.

The bill was not declaration or war, or authorization for war, do you understand that?"	3.0	0.0	129	False	True
21124	4855832	changemyview	31054494110.0	https://www.reddit.com/r/changemyview/comments/9w0kze/_/e9l1l0e/	597970490.0	31053227884.0	2018-11-12 23:12:05	176225802133.0	posnfen	"so i changed your view? are you going to give me a delta?

and bernie explains why he voted for the afghanistan war in the post on his website. he thought the option of war was one possible choice, he didnt think they'd do only war."	1.0	0.0	46	False	True
21853	4855832	changemyview	31335973035.0	https://www.reddit.com/r/changemyview/comments/agrsyp/_/ee8mnjf/	632832865.0	31335935449.0	2019-01-17 01:02:42	180397531.0	grizwald87	"&gt;I am suggesting that right and wrong is something inherent to humans. Like Kant. Of course my views are formed based on social frameworks, but that doesn't make them any less ""natural"". Our social frameworks are a product of nature.

Kant didn't believe animals had moral rights, so clearly his system is flawed if you're seeking to rely on it for this purpose. Morality is either objective, in which case you should be able to point to evidence that it exists outside of what people believe, or it's subjective, in which case you have to justify why your position is better for society than mine - why does a deer deserve to live if I'm feeling hungry?

&gt;I definitely see that there is a huge difference between factory farming and hunting. 

So do you consider hunting for your meat moral or immoral? If the least abhorrent version of animal-killing for food is morally acceptable, then you have to edit your thesis."	5.0	0.0	161	False	True
21917	4855832	changemyview	31346037445.0	https://www.reddit.com/r/changemyview/comments/ahhh5p/_/eeemdad/	634030621.0	31346016856.0	2019-01-19 02:11:23	228100013175.0	finzipasca	"&gt; That's a fair point I hadn't considered I guess though it certainly doesn't apply in my case as I'm a fairly skinny 55-60kg at 181m but I hadn't considered it !Delta

Cheers mate. My question would be how old you are. Assuming you're a young man, your metabolism can handle much more right now than it will be able to as you age. These habits won't serve you well in the longer run, even if they don't seem to have an impact now. 

&gt;That's fair but my hamburgers are mostly chicken-based.

Gotcha - hamburgers are conventionally ground beef. Chicken / Turkey burgers are much healthier. 

&gt;Do carrots count because I do eat a lot of those?

I mean, carrots are good for you too, but eating more spinach/kale and potatoes (depending on how you prepare them) will go a long way. 
"	2.0	0.0	142	False	True
22030	4855832	changemyview	31433632275.0	https://www.reddit.com/r/changemyview/comments/anizoy/_/efurtw3/	644178994.0	31432718643.0	2019-02-06 06:23:46	11740160.0	dale_glass	"I think government funded research should be in the public domain. No entity should own it, rather it should be available to anybody to benefit from. That's because the public paid for it, so the public owns it.

"	1.0	0.0	38	False	True
22041	4855832	changemyview	31433603658.0	https://www.reddit.com/r/changemyview/comments/anng7s/_/efur7t6/	644387032.0	31433572613.0	2019-02-06 06:11:00	224371543127.0	MisanthropicIceCube	"&gt; especially where oppressive judgement is handed down by someone older, it is often expected that we still deal with them respectfully, and anything other than this would be viewed as an act of defiance.

Dealing with someone respectfully and respecting them aren't the same thing. You should be amicable, because that's when conversations are fruitful. You're able to ask questions and clarify possible confusions. Losing your temper does not help the situation in any way. That's why we treat people respectfully. 

This applies to authoritative figures as well. If you don't treat those beneath you with respect, you're committing the same offense, namely believing your authority somehow exempts you from basic human decency. Also, you lose out on the bonuses of amicable discussions. 

People that view questioning an authoritative figure as defiance are wrong to do so. There might be a time and place to do so, but nobody is beyond reproach."	1.0	0.0	153	False	True
22100	4855832	changemyview	31451290406.0	https://www.reddit.com/r/changemyview/comments/aoxwva/_/eg5aazq/	646554790.0	31450350768.0	2019-02-10 09:02:34	28876850.0	xxFactFinder	"Unfortunately I don't have a certain confidence about situation of Europe (or German) yet. However, following may be useful if you have never read.

What the World Rejected: Hitler's Peace Offers 1933-1939.

[https://www.wintersonnenwende.com/scriptorium/english/archives/nothanks/wwr00.html](https://www.wintersonnenwende.com/scriptorium/english/archives/nothanks/wwr00.html)

Des Moines Speech by Charles Lindbergh, September 11, 1941

[http://www.charleslindbergh.com/americanfirst/speech.asp](http://www.charleslindbergh.com/americanfirst/speech.asp)

Fragmentarily...

Foreign relations of the United States. Diplomatic papers. The Soviet Union, 1933-1939.

pp.226, pp.291-296, pp.764-767

Foreign relations of the United States.1939.V1. (pp.232-)

""VI. ANGLO-FRENCH-SOVIET NEGOTIATIONS ATTEMPTING TO REACH AN AGREEMENT AGAINST AGGRESSION""

[https://babel.hathitrust.org/cgi/pt?id=osu.32435028315372;view=2up;seq=4](https://babel.hathitrust.org/cgi/pt?id=osu.32435028315372;view=2up;seq=4)

Documents on German Foreign Policy - Series D - Volume XII  (pp.1002-1004)

[https://archive.org/details/DocumentsOnGermanForeignPolicy-SeriesD-VolumeXii-February1-June](https://archive.org/details/DocumentsOnGermanForeignPolicy-SeriesD-VolumeXii-February1-June)"	2.0	0.0	90	False	True
22102	4855832	changemyview	31452491200.0	https://www.reddit.com/r/changemyview/comments/aoxwva/_/eg601j4/	646554790.0	31451010495.0	2019-02-10 17:42:24	71598013.0	efisk666	he wanted several years. i forget how many, i think maybe it was 5.	1.0	0.0	14	False	True
22105	4855832	changemyview	31454057115.0	https://www.reddit.com/r/changemyview/comments/aoxwva/_/eg6xlsr/	646554790.0	31450290205.0	2019-02-11 01:06:17	11900111.0	Gladix	"So let's recap. The first world war started as a response to British empire spreading across the globe. After the WW1, nations fucked over Germany. Que WW2.

But what was before. Why were British so imperialistic. Well they were in brutal conflict over the church with Spain. (inquisitions), and was nearly destroyed, if not for the doctrine of strong navy. That naturally evolved into expansion and then trade.

Okay, so why did the Inquisitions happened. Why did the parts of Catholic church rebelled and split?

Because Catholic church was affraid of loosing power, in spite of the blossoming spanish trade (from which nobilities prospered). Most nobles, and powerful people just happened to be Jewish. Que the hunt for the wicked.

We can go further and further, it's just a cycle of hostility, trickery, and responses to previous wrongs. Why do you make the arbitrary dividing line at the Treaty of Versailes?"	1.0	0.0	151	False	True
22306	4855832	changemyview	31508257103.0	https://www.reddit.com/r/changemyview/comments/atrfie/_/eh37arz/	654650438.0	31508229026.0	2019-02-23 06:53:27	38293231.0	yyzjertl	"Do you also object to the term ""unlicensed doctor"" on the same basis? After all, it gives no indication to the nature of the medicine that individual is practicing unlike ""unauthorized doctor."" Do you think that the term ""unlicensed doctors"" refers to any doctors, legal or illegal, who have not yet received or have misplaced their licenses?"	1.0	0.0	57	False	True
