"ancestor_text","annotation_id","annotator","ap","author","author_id","body","controversiality","created_at","created_utc","dd","fm","gt","id","im","is","jc","lead_time","link_id","mc","md","parent_comment_id","pd","permalink","score","selftext","subreddit","subreddit_id","title","updated_at","url"
"Tisarwat @ 2016-12-22 15:24:29 :

There should be a rule about *proportionate retaliation*.

**Strength against weakness**

If someone who was 4 ft and had a degenerative muscular illness slapped a 6ft wrestler, the wrestler would not be justified in responding with full force. This is an extreme example but demonstrates the disparity in strength without mentioning gender. 

**Strength against strength** 

If two people around the same height got into a scrap, with similar body types, then incapacitating force would be acceptable. Note that I don't say equal force- we can't calculate that in the split second, and the first instinct is self defence. There would also have to be a reasonable margin of error because again, exact calculations are difficult and the defender may overestimate their attacker's strength. 


**Gender and Averages**

How this relates to gender: as many people point out, women tend to be physically smaller and weaker than men. This isn't always the case- there's a lot of overlap, as we would expect with such large groups. 

The problem is that in the past it has been generalised to mean that all women are weak, and all men are strong, so a violent response from a man is never proportionate. Instead it should be judged contextually- this woman was strong and fit, or particularly vicious, or that man was a bodybuilder, or had a disability that made him vulnerable. 

That means that gender won't be directly used as a metric. But because of the general fact that women are physically smaller and weaker, there will still be a correlation that physical retaliation should be minimised against women. It absolutely should not be framed like that since it leads to this kind of absolute rule that is detrimental. But it will have a milder correlative force. 


**The purpose of a violent response**

Last point: the reason for limiting retaliation is not 'this person can weather the damage', it's this person could, unless limited, deal out disproportionate harm. So it's not saying that men (or strong people, if my example is being followed) can never retaliate. It's saying they shouldn't do it at full strength because that's punitive rather than defensive. That's why so far I've ignored weapons- they totally change a strength dynamic. A weak person with a knife poses a much greater that against an unarmed yet strong opponent than without one. Guns even more so. In such a situation them retaliation could be much stronger- not because it's suddenly okay to hurt weak people but because the danger faced is greatly increased, so it is reasonable to respond to disarm the threat.

**Regarding the video**

the issue is disproportionate response. Ignoring what might have been said, she was relatively small and did not seem to include much force in her attack. He was clearly very strong, and appeared to knock her out. The retaliation was much greater than the threat, to the point where it seemed retributive rather than defensive. 

**Tl;Dr** it's not okay for women to hurt men but bad vice versa. It's an issue of proportionate response to violence based on strength/ danger. In a situation where all parties are unarmed, this will tend to fall along gendered lines. The important thing is not to generalise this to mean ALL men or ALL women, but to judge based on context.  
--------------------------------

DocGrey187000 @ 2016-12-22 15:40:34 :

This is a well-reasoned response. 


Few things: 


She did not appear to be alone. 


He did appear to be alone (at least he left alone).


They're in a restaurant full of knives, in a country full of guns. 


He's not a cop or ju jitsu master, he's just some 19 yr old. 


I agree all the way that you use proportionate force, but let's not operate with perfect hindsight: a common philosophy is to end a fight ASAP, once it can't be avoided. 


He hit her once. 


He left. 


He didn't gloat, stand over her, kick her. 


I think that, within range, he did the minimum to end the fight. He doesn't have cuffs, or a Vulcan neck pinch at his disposal. Any one in that bar could hit him over the head with a bottle, or shoot him as he wrestles to restrain his smaller enemy. 


He shut her off, and left. 



--------------------------------

Zoidbergluver @ 2016-12-22 18:19:05 :

Why does him being alone matter?

Why does being ""in a country full of guns"" matter? Did she have a weapon on her person or directly accessible? No. So your logic is faulty. Being in the same country as a gun does not mean he can respond as if she has a weapon. He would need to have reasonable suspicion that she *actually* had a weapon. 

He isn't ""just a 19 year old"". He plays college football, a sport where his entire job is hitting others. You don't play college football as an average 19 year old. He is a massive man. 

He left. He didn't call the cops, didn't make sure she was okay, he left her to die (for all he knew). 

And again, was his degree of violence proportionate? She slapped his face and he knocked her out, breaking bones in her face. Does that seem right to you? Regardless of gender?",1357,"7","[{""rating"":1}]","marketani","","This is ridiculous, make sure shes okay? The woman who juat grabbed his neck? This isnt some freaking prank. He has no obligation to help that bitch. If a man deliberately brushes his hand on a womans ass as he walks by gets kicked in the testicles by her as hard as she could, would you expect her to call the police and check on him? Do I have to explain how dangerous a kick to the balla can be regardless of the initial sensation? Nope, because nobody on this website cares. I go in TwoX and I see someone say they did that and its upvoted(sometimes the woman even has a bit of formal martial arts training/athletic). Im not making judgements on whether its right or wrong nor am i saying you should care. ",1,"2024-05-20T19:36:16.955649Z","2016-12-22T20:57:58Z","[{""rating"":7}]","[{""rating"":1}]","[{""rating"":1}]","","[{""rating"":7}]","[{""rating"":1}]","[{""rating"":1}]",267.262,335503537.0,"[{""rating"":1}]","[{""rating"":1}]","","[{""rating"":1}]","https://www.reddit.com/r/changemyview/comments/5jr06p/_/dbipphi/",1,"EDIT #2: 


Great talk folks. This did not change my view, but it DID enlighten me as to why my view is comparatively rare---clearly folks think that, if you have a physical advantage over someone, you should give them leeway, and that if you have to hit them, it should be with a bias towards 'lightness.


I don't agree with either of those, but I do believe a rational person could hold those opinions. 


Thanks, this was easily the biggest thread I've ever started on here. Some bright folks that I respect, in a sub that has a phenomenal culture, but I retire. 


Agree to disagree



EDIT:

This has been fascinating. I think this sub is full of very reasonable ppl. So far, I no one has moved me, and it may not occur, but I admire the reasoned debate.


Most responses have hinged on ""proportionate response""---the idea that maybe he should have hit her softer. I've said it numerous times in here, but I think that is an unreasonable standard based on gendered rules and hindsight---he should have hit her hard enough to stop her but not hard enough to hurt her(?), or maybe just restrained her because he's so strong. Keep in mind---The only way we now know that she is no match for him is because he knocked her out. That could not have been known beforehand to a level that lets us know that he should've hit her 46% less hard. 


It's in the moment, she's aggressive and escalating, and he still took multiple hits before retaliating, and only hit her once.  YOU ARE NOT BEING REALISTIC IF YOU THINK HE SHOULD HAVE RESTRAINED HER LIKE A 3 YEAR OLD. She is stronger than a 3 year old, and the other bar patrons wouldn't have allowed it. He would be vulnerable. The goal of a fight is to end a fight, and the threat to yourself, not to make sure the other combatant is definitely not hurt. 


An easy to test your argument for this sort of unrealistic gender accommodation and bias: Replace the lady with Michael Cera. 


Should Mixon restrain Michael Cera, who grabs his neck and hits his face?


Should Mixon tap Michael Cera and hope he is chastened and willingly retreats?


Michael Cera would not be being treated like a victim here because he's an adult, and would've been the aggressor, even though he's likely closer in strength to this lady than he is to a D1 running back. 


From now on, I will be responding to gendered arguments with Michael Cera substitutions, to save time. 

---——


This is prompted by a recent video released that shows college running back Joe Mixon in a confrontation with a woman. 


The video shows them standing, then the woman pushes Mixon with both hands, then he ""pump fakes"" at her (presumably a threat), then she grabs him by the throat and hits him in the face, then he strikes her head and she is knocked out of frame. After that, He immediately leaves. 


He was suspended, he apologized, etc. She is suing, and is referred to as ""the victim"".


I believe he did nothing wrong. I believe he is the victim. 


This is an example of a gendered rule that I think is commonly applied in the U.S., At least: men are expected to never hit women. I think this rule is unfair, unsafe, and unrealistic.


I don't think men should hit women, but nor should women hit men. 


I don't think there is a rule about hitting that should only go one way.  


Don't beat your wife...or husband. 


No one should be allowed to hit a woman....or man. 


And conversely


You have a right to defend yourself, no matter your gender...or the gender of your attacker. 


Mixon was punished, and some say it was not enough.


I would consider my view changed if someone could describe an instance where it's ok for a woman to hit, or not ok for a man to hit, where gender is a determining factor (where you could say ""he was wrong to hit her"" but not ""that person was wrong to hit that person""). I'm looking for a moral/philosophical pov, rather than a ""holding the door, standing when a woman leaves the table"" chivalry pov. 


Holding the door for women doesn't ruin men's careers or send them to jail, but in our society, defending yourself from physical abuse might, if you're a man and your attacker is a woman. 


Cmv","changemyview",4855832,"CMV : There should be no social or legal rule about hitting people that is applied differently between the genders","2024-05-20T19:36:16.955661Z","https://www.reddit.com/r/changemyview/comments/5jr06p/cmv_there_should_be_no_social_or_legal_rule_about/"
"CircleReversed @ 2018-08-15 17:43:48 :

&gt;So whenever a black person chased the ""American dream"", other black people scold them for ""acting white"".

What evidence do you have of this? 
--------------------------------

ChewyMang @ 2018-08-15 18:20:36 :

I grew up in black neighborhoods and constantly would hear black people mocking other black people for engaging in white things. It is almost as if some blacks who try to rise above the black narrative get shamed into submission.

Not to mention TV shows and media where this idea is generally propagated.

I also notice it a lot at university. There were ""D black students"" who would chirp the ""A black students"". It happens more often than I think you realize.

Just a few months ago this very conversation was on cnn ",1358,"7","","CircleReversed","","&gt;I grew up in black neighborhoods and constantly would hear black people mocking other black people for engaging in white things. It is almost as if some blacks who try to rise above the black narrative get shamed into submission.

&gt;Not to mention TV shows and media where this idea is generally propagated.

&gt;I also notice it a lot at university. There were ""D black students"" who would chirp the ""A black students"". It happens more often than I think you realize.

&gt;Just a few months ago this very conversation was on cnn

This thread is based on a stereotypical view of black people which paints them as anti-intellectual bullies. It doesn't have much to do with the reality of black American identity through history or in the present. The Harlem Renaissance is an important part of black American history and identity, and it flies in the face of this anti-intellectual stereotype. Conversations of black American identity regularly revolve around great black intellectuals such as authors, poets, scientists, and activists. Martin Luther King was a doctor, and nobody accuses him of acting white because of his education. If you visit an African American history museum I doubt you'll find any exhibits documenting anti-intellectualism as a significant philosophy among black Americans.",0,"2024-05-20T19:40:24.362864Z","2018-08-15T18:32:15Z","[{""rating"":4}]","[{""rating"":6}]","[{""rating"":1}]","","[{""rating"":1}]","[{""rating"":1}]","[{""rating"":1}]",246.792,556889591.0,"[{""rating"":1}]","[{""rating"":6}]","","[{""rating"":1}]","https://www.reddit.com/r/changemyview/comments/97k2rb/_/e48wg33/",12,"Preface: I am a white 27 male from USA, and I mastered in sociology with emphasis on race relations. My stepdad is a black Muslim and the amount of racism I have experienced by association is appalling. So understand that while yes, I have a white background with undeniable privilege, I also empathize deeply for black  people and the daily pain they endure. I can never understand truly what I means to be black. And I admit that. This post is not about calling black people ""wrong"", or that black culture is ""bad"". So please do not see this as me attacking black culture but rather my views on why black people have not reached true equality.

CMV post : 

Black culture historically emerged from slavery and the struggle of being poor and underprivileged in white societys. This is an overgeneralization, but it is important to realize the foundation of black culture came from oppression and poverty.

Many black people who become successful in America have become successful by adopting a ""white narrative"". Or rather they ""act white"" to get ahead. Black people generally gaze down upon other blacks who act white. And reasonably so. However I believe this ""negative perspective"" of ""acting white"" ultimately keeps black people as a whole from rising up. I believe this because subconsciously black people associate ""intelligence"" with being white. 

The unfortunate truth is that white people in America don't actually have a ""culture"" distinct from being American. A white person merely says they are ""American"", where a black person identifies as a ""black American"" (again, an overgeneralization, I know). But by and large being black is an identity on its own that comes into question every day of their lives, a question whites don't need to engage with. 

Given that ""white culture"" doesn't exactly exist in the same way, it could be said that black people are not resisting ""white culture, but rather that black people are resisting ""intellectualism"" (the exercise of the intellect at the expense of emotions).

Let me explain, black culture entails several main components, like every culture: dress, language, attitude, emotions, perspectives, a collective history and etc. With black culture in America, their culture derived from slavery and the struggles of being poor (due to white oppression). Being poor and uneducated and unable to read for centuries lead to a language that, in all reality, is a poor version of English (not the black slang but the actual language used). Uneducated black people for centuries passed on their belief systems to future generations, including the distain for white people (and everything they represent) and today we have a culture that is in many regards ""intellectually resistant"". I say this because when a black person looks at a successful white person, they say it's because they are white with privlidge, but a successful black person would never claim their success is from acting white but rather working hard and educating yourself. 

The most successful black people in America (apart from musicians, artist and the like), are successful by and large because they ""acted white"". They speak like white people, they act like white people, they got an education, and they pursued white careers. But nothing is objectively ""white or black"", things just are.  By insisting some activities are white and others are black is a poor way of thinking and it limits what opportunities you pursue in life if you refuse to do ""white activities"". 

As I stated above, however, is that white people don't have culture, they just are ""American"". So whenever a black person chased the ""American dream"", other black people scold them for ""acting white"". My argument though is not that they are acting white, but rather they educated themselves to the point of realizing the struggle between black and whites in terms of obtaining success is strictly determined by the effort you put in. 

White and black people would get along better if we all saw ourselves as American rather than white and black Americans. White people feel more uncomfortable around blacks than any other race (except maybe Muslims, but that's only been the past 20ish years) mostly because white people have no way of relating to them. 

White people feel uncomfortable not because of ""black culture"", but because black culture promotes the ideology of the white man being evil. And in the past this was true. But I feel at this point, black people need to take responsibility for their current state. They are keeping themselves oppressed by not integrating with white/American culture. They can't keep blaming white people for everything. If you haven't gotten ahead its because you haven't tried. Getting ahead in America means getting an education. If black people let go of black culture, white people wouldn't feel so threatened. If black people wouldn't act so ""hard"", white people wouldn't feel so threatened. And the irony is that black people feel they need to uphold this culture, but in reality it is the only thing preventing them at this point from being equal to whites. (most) Whites don't see themselves as being white, a privilege often attributed to white people from black people. But I'm not sure it's a privilege, as black people are ""choosing"" their culture. They are choosing to be ""black"" instead of American. It's okay to Honor your heritage, but resisting ""white culture"" (ie American culture) is the best way of obtaining what you want (ie equality).

I know there are many systemic reasons responsible for black oppression and the development of their culture in general, but in today's world, equality is truly possible, but white people can't do anything more for the black communities. Black people need to start acting like Americans, not gangsters. Because that gangster vibe is not inviting. Even educated black people don't find the gangster vibe inviting. And it's because the gangster attitude is a attitude derived from fear of the white man. Making yourself look hard and threatening, while yes keeps white people away from you, it also keeps you away from the ""answer"" black people are striving for: peace, equality and equal opportunity.

Think about it. If you owned a business, would you rather hire a thug, or a black person who is educated and uses proper English (yes, I said ""proper English"", not white english"")? White people don't discriminate you because your black, but because of your attitude. 

To summerize: black culture is a self created culture of resistance that depends on resisting white culture. White culture doesn't exist, and so what is actually being resisted is intellectualism (ie, the exercise of your intellect at the expense of your emotions). By holding onto a history of poverty and a culture defined by poverty, black people ultimately will never find equality until they realize being intelligent and using proper english doesn't equate to being white, it equates to success. When white people see blacks make an effort to stop distinguishing themselves as a separate entity, white people won't feel so threatened and their passive racism will fall away, as the ""nigga identity"" is what whites hate about blacks, not their actual skin color. Stop acting like a nigga and you'll stop being treated as one.

Edit: before anyone posts, I want to state that I know blatant racism exists in America still, and that simply pursuing intellectualism will not erase all the problems, but it's the only way to begin the process towards equality. There will always be racism, but by and large I feel there is too much blame being put on white people and not enough emphasis being places on personal responsibility.

If black people erased their perceived stereotypes, I guareebte there would be less police shootings too, as cops wouldn't immediately assume a black guy is a thug or criminal. Unfortunately I know white people created black peoples problems, but at this point, what else can white people do? We live in a world of stereotypes and prejudge people based on them. And there is much truth in stereotypes. If black people as a whole rose above their stereotypes and created new ones for themselves, they wouldn't appear as a perceived threat to whites anymore. And the relations between the two groups would settle","changemyview",4855832,"Cmv: Black culture is defined by resisting ""intellectualism""","2024-05-20T19:40:24.362876Z","https://www.reddit.com/r/changemyview/comments/97k2rb/cmv_black_culture_is_defined_by_resisting/"
"",1600,"7","[{""rating"":1}]","JackNotName",71204968.0,"YTA

If you can't trust the group you are working with, you will never succeed in life. This level of micromanagement and perfectionism is a losing strategy. It will turn everyone against you, and you will never actually get things done in a real world setting.

Focus on ""good enough"" not perfect.",0,"2024-05-21T09:43:59.779897Z","2020-02-07T16:54:30Z","[{""rating"":4}]","[{""rating"":6}]","[{""rating"":1}]","","[{""rating"":1}]","[{""rating"":1}]","[{""rating"":1}]",156.337,907603496.0,"[{""rating"":1}]","[{""rating"":1}]","","[{""rating"":1}]","https://www.reddit.com/r/AmItheAsshole/comments/f0d3c8/_/fgsx462/",1,"[removed]","AmItheAsshole",4922054,"AITA for rewriting the work of my group members?","2024-05-21T09:43:59.779909Z","https://www.reddit.com/r/AmItheAsshole/comments/f0d3c8/aita_for_rewriting_the_work_of_my_group_members/"
