"ancestor_text","annotation_id","annotator","ap","author","author_id","body","controversiality","created_at","created_utc","dd","fm","gt","id","im","is","jc","lead_time","link_id","mc","md","parent_comment_id","pd","permalink","score","selftext","subreddit","subreddit_id","title","updated_at","url"
"diyaww @ 2016-04-04 19:56:47 :

There are multiple types of abuse, including physical, emotional, sexual, economic, and more. 

All types of abuse, not just physical, can traumatize a victim by threatening their sense of security and autonomy. For example, if I force you to stay in a relationship because I control all of your financial assets, that's abuse. You may feel you have no options except to be unhappy with me for the rest of your life, or dead.

And that's the problem with limiting the definition of abuse. A victim may not understand that what their abuser is doing is wrong or abnormal (especially when it's not physical) - and more importantly, that there is *help*.

If a more liberal use of the word abuse causes more victims to reach out for help, that's a good thing. Maybe they call a woman's shelter or counselor and learn that they aren't actually being abused - but what if they are?
--------------------------------

ronep @ 2016-04-05 04:30:18 :

I'm not sure it is a good thing. I think dilution of the term abuse may make it harder to isolate people who are truly, honestly terrible people. Let's say 30% of people call the guy who occasionally uses ""cunt"" in a joking manner abusive means that when you want to use a word to describe terrible, terrible abuse where the other person wants to kill themselves, you have no word for it. You've already cried wolf on the guy who jokes around. Calling him a wolf and the guy who beats his wife a wolf means wolf now means nothing.
--------------------------------

diyaww @ 2016-04-05 05:12:10 :

It sounds like you want the term ""abuser"" to be a kind of scarlet letter that only true abusers wear. 

Try looking it at it from a victim's point of view: if you think abuse has a very narrow definition, maybe you don't seek help if your husband keeps you constantly hungry, because you still have food and shelter. Maybe you don't seek help because you live a comfortable lifestyle, even though your partner demeans you constantly and makes you feel worthless, stupid, and undeserving of life.

The fact is that there is a wide variety of types and combinations of abuse. We want victims to speak out. In this case, it's better to get more false positives by widening the scope than to more false negatives by narrowing the scope. We don't want victims to think, ""you know, abuse is a really strong word. My partner loves me, he's not capable of doing something that bad. It's probably not abuse."" 

We call someone a criminal whether they've committed tax fraud or killed someone. If we need more context, we can ask for it. If, after hearing that context, we think they deserve a scarlet letter we send them to jail and give them a record. But *only* if their victim comes forward.
--------------------------------

ronep @ 2016-04-05 05:50:37 :

But you're speaking as if the only solution to those situations is labelling everything as abuse. Your partner can love you and still be a dick that you shouldn't be with. I know plenty of people that shouldn't be in relationships with people that love them. Saying ""if we don't call that abuse then the victims will be fine with it"" is silly. That's using up the current power that the word abuse has to change a current situation, but it's short sighted.

If we use abuse to describe low-level negative dickeshness, then it will lose its power and meaning.

It *should* be a scarlet letter. It *should* brand people as bad people. It should only be used to describe behaviour that society thinks of as absolutely reprehensible. Broadening the scope now and sweeping up a whole bunch of false positives weakens it for future use.

Your criminal example, I think, is weak. Because the sub-terms are weak. ""Abuser"" means both someone who's kinda a dick, and someone who can be charged with murder. But what are the sub-terms that are analogous to criminal? ""Really seriously actually terrible abuser"" and ""abuser""?
--------------------------------

Klosterheim @ 2016-04-05 06:53:37 :

Well yes, some people believe that the best we can do right now for the good of the many is to widen the scope of this term and similar ones. They think that the benefit of having more people come forward outweighs the problems of having more people come forward that shouldn't and changing the meaning of words somehow.

You'll concede that if someone was to take your position to its extreme, it would make for a terrible solution as well. It's a question of balance.

I think that you should think about whether it really is a big deal if words lose their oomph somewhat. What does it matter if you don't have a special terrible name to describe special terrible things, aren't the things terrible enough on their own ? Wouldn't it be a good thing if we could stop calling someone something and making it a huge deal because people jump at an emotionally-charged word ? Maybe we can stop arguing the semantics of who's what, and stop dismissing each other as much.
--------------------------------

ronep @ 2016-04-05 07:13:14 :

I think you're underestimating the power that the oomph behinds words has. Rapist is a great example. Rapist right now is a powerful word. It destroys lives and careers when it's used. It's a big deal. It can be wielded to make rapists outcasts and isolated. But, if, 100 years from now, rapist also means, for example, making a cat-call, then nobody is going to care when you label someone as a rapist. When you need to wield the power of the word it will no longer be there. You will no longer have a single, vile word that can can immediately encompass the terrible concept you want to encompass and put it in someone's mind, and immediately form someone's opinion of them.

I think you are underestimating the power of words, and the loss of power when they're diluted.",1606,"7","[{""rating"":1}]","dangerzone133","","The fact that rapist is so strong isn't a good thing though. I've had so many victims describe what is legally rape, but can't identify to themselves that it's rape. It makes the healing process even harder when the victim can't accurately articulate what happened to them because they are scared of this giant label. Same goes with reporting, they may want the rape or abuse to stop, but don't want to label that person as a rapist. ",0,"2024-05-21T09:50:55.527967Z","2016-04-06T15:04:12Z","[{""rating"":1}]","[{""rating"":7}]","[{""rating"":1}]","","[{""rating"":1}]","[{""rating"":1}]","[{""rating"":3}]",44.927,264265736.0,"[{""rating"":2}]","[{""rating"":1}]","","[{""rating"":1}]","https://www.reddit.com/r/changemyview/comments/4dc4qw/_/d1s6hpc/",2,"Recently I have noticed a trend in language used to discuss relationships. It seems like the term ""abuse"" gets thrown around to describe everything from infidelity to even slightly mean behaviour. On threads like [this one](https://www.reddit.com/r/relationships/comments/4d5sxs/my_28f_boyfriend_30m_1_year_thinks_its_ok_to/) a boyfriend says that since he censors his offensive language when making jokes, that his girlfriend should make an effort to curb her annoying linguistic habits. Is this stupid? Yes. But in the comment it gets called out as abusive many times.

I feel like describing this somewhat dickish behaviour as abusive is harmful. There are people who experience serious abuse. Abuse where animalistic terror is inflicted on them because they are genuinely afraid for their safety. Where the place that they consider home is the least safe place to be. Where the sick individuals who inflict this on them are okay with hurting children and making their lives a living hell. And the only word to describe these people is ""abusers."" Equating someone who's kinda a jerk to these people is harmful. Abusers should be unforgivable pariahs, not someone who got in an argument with a SO. The word should have power and it should be used carefully. To accuse someone of abuse should be akin to accusing them of rape. It should have heft behind it. The dilution of the term is harmful. CMV.
_____

&gt; *Hello, users of CMV! This is a footnote from your moderators. We'd just like to remind you of a couple of things. Firstly, please remember to* ***[read through our rules](http://www.reddit.com/r/changemyview/wiki/rules)***. *If you see a comment that has broken one, it is more effective to report it than downvote it. Speaking of which,* ***[downvotes don't change views](http://www.reddit.com/r/changemyview/wiki/guidelines#wiki_upvoting.2Fdownvoting)****! If you are thinking about submitting a CMV yourself, please have a look through our* ***[popular topics wiki](http://www.reddit.com/r/changemyview/wiki/populartopics)*** *first. Any questions or concerns? Feel free to* ***[message us](http://www.reddit.com/message/compose?to=/r/changemyview)***. *Happy CMVing!*","changemyview",4855832,"CMV: Using the word ""abuse"" to describe someone who is just a jerk dilutes the word and minimizes the experiences of people who experience actual abuse.","2024-05-21T09:50:55.527982Z","https://www.reddit.com/r/changemyview/comments/4dc4qw/cmv_using_the_word_abuse_to_describe_someone_who/"
"HighGradeSpecialist @ 2015-08-21 02:12:41 :

Is like jorah and reek had a love child.",1607,"7","[{""rating"":1}]","KRAy_Z_n1nja","","I thought it was actually Theon for a sec",0,"2024-05-21T09:51:44.430453Z","2015-08-21T02:55:52Z","[{""rating"":1}]","[{""rating"":1}]","[{""rating"":1}]","","[{""rating"":1}]","[{""rating"":1}]","[{""rating"":1}]",28.638,211285781.0,"[{""rating"":1}]","[{""rating"":1}]","","[{""rating"":1}]","https://www.reddit.com/r/insideJorahshead/comments/3hsl5h/_/cua9d0g/",28,"","insideJorahshead",5125437,"Jorah is such a good listener","2024-05-21T09:51:44.430480Z","http://i.imgur.com/KVUnOUq.png"
"",1608,"7","[{""rating"":1}]","blatherskyte69","","Yep, YouTube is your friend. Look up tutorials for painting minis. The concepts are the same as scale figures.  Also check out r/minipainting",0,"2024-05-21T09:52:16.664023Z","2021-01-16T01:12:59Z","[{""rating"":1}]","[{""rating"":1}]","[{""rating"":1}]","","[{""rating"":1}]","[{""rating"":1}]","[{""rating"":1}]",51.929,1266794768.0,"[{""rating"":1}]","[{""rating"":1}]","","[{""rating"":1}]","https://www.reddit.com/r/modelmakers/comments/ky7t3k/_/gjendze/",2,"","modelmakers",4685394,"I want to get better at 1/35 figure paintings and I’m just wondering if you guys have any tips?","2024-05-21T09:52:16.664037Z","https://www.reddit.com/r/modelmakers/comments/ky7t3k/i_want_to_get_better_at_135_figure_paintings_and/"
"IndraSun @ 2021-02-06 16:18:52 :

I think it costs me eight bucks a month for an eight person server.",1609,"7","[{""rating"":1}]","astralbeings","","for a two person server?",0,"2024-05-21T09:52:37.073150Z","2021-02-06T16:22:29Z","[{""rating"":1}]","[{""rating"":1}]","[{""rating"":1}]","","[{""rating"":1}]","[{""rating"":1}]","[{""rating"":1}]",26.284000000000002,1293328684.0,"[{""rating"":1}]","[{""rating"":1}]","","[{""rating"":1}]","https://www.reddit.com/r/Minecraft/comments/le0iss/_/gm8qwpi/",0,"[deleted]","Minecraft",4619142,"price of minecraft realms","2024-05-21T09:52:37.073162Z","https://www.reddit.com/r/Minecraft/comments/le0iss/price_of_minecraft_realms/"
"",1610,"7","[{""rating"":1}]","HK416Enjoyer","","Go for it
I've had mine for a month and as a self-proclaimed power user I'm really happy with it and it didn't even cost all that much",0,"2024-05-21T09:52:54.438850Z","2022-01-19T19:48:55Z","[{""rating"":1}]","[{""rating"":1}]","[{""rating"":1}]","","[{""rating"":1}]","[{""rating"":1}]","[{""rating"":1}]",39.782,1706105761.0,"[{""rating"":1}]","[{""rating"":1}]","","[{""rating"":1}]","https://www.reddit.com/r/Xiaomi/comments/s7rrmp/_/htcymt5/",1,"Should I replace my Redmi Note 8T with Poco x3 Pro? I'm thinking about it a lot and I need more opinions.","Xiaomi",4714311,"Poco x3 Pro vs Redmi Note 8t","2024-05-21T09:52:54.438863Z","https://www.reddit.com/r/Xiaomi/comments/s7rrmp/poco_x3_pro_vs_redmi_note_8t/"
"",1611,"7","[{""rating"":1}]","cdreyes87",18503005.0,"nice pick ups. I bought all of those movies this sale except for night of the living dead and safety last.",0,"2024-05-21T09:53:21.814943Z","2023-08-03T00:52:43Z","[{""rating"":1}]","[{""rating"":1}]","[{""rating"":1}]","","[{""rating"":1}]","[{""rating"":1}]","[{""rating"":1}]",47.839,"","[{""rating"":1}]","[{""rating"":1}]","","[{""rating"":1}]","https://www.reddit.com/r/criterion/comments/15ginf0/_/juk1c0p/",1,"","criterion",4678677,"Had a really successful July sale haul this time around.","2024-05-21T09:53:21.814957Z","https://i.redd.it/wmr2rvf13rfb1.jpg"
"NearEmu @ 2021-02-05 08:31:52 :

Here's a bit of a question.

If she was damned to hell by Ganush, unfairly, but she then did something evil in her attempt to stop the curse.

Would that be enough to make it so she actually did deserve the fate?

This is ignoring the fact that there exists no crime that actually deserves literal *eternal torment* because if we don't ignore that then the entire thread is pointless anyway.
--------------------------------

LegitimateShift8 @ 2021-02-05 08:39:10 :

This is a really good question.

I would say no only because she did bad things to try and rid herself of the curse. She killed her cat to try and “appease” the demon that was after her. Some people feel like she deserved to die after that but I don’t. In no way am I advocating that people should kill animals (I love my dog) but If someone has the choice between killing an animal or burning in hell for eternity, 99% of them would kill the animal.
--------------------------------

NearEmu @ 2021-02-05 08:46:20 :

99% of them would kill the cat I probably agree, but that doesn't answer whether or not killing an innocent creature is worthy of it.  It could perfectly well mean that 99% of people deserve it for killing innocent creatures to save their own soul.  That's pretty wildly selfish.
--------------------------------

LegitimateShift8 @ 2021-02-05 09:00:40 :

I get you. With that I don’t think it’s really about what someone did but rather *why* they did it. If they killed animals because they just could then yeah that’s horrible and they now deserve whatever comes to them. But if they did it to avoid a terrible fate like that, as selfish and as bad as it is, I still do think it’s understandable and doesn’t make them worthy of that kind of punishment.
--------------------------------

NearEmu @ 2021-02-05 09:32:02 :

Where would the line be I wonder?  Would it be understandable to kill 1000 innocent cats in order to save yourself from a terrible fate?  Would it be understandable to kill *ALL* innocent cats?  Or would it be understandable to kill 1 90 year old woman to avoid the terrible fate?  What is the limiting factor on how many innocent lives you are understandable to end in order to avoid your own fate?

Also does it apply in all situations or only situations that involve hell?  Would it be okay for me to kill a families cat in order to avoid the fate of going to jail?  or.... would it be understandable to simply kill my wifes cat, in order to avoid the fate of simply not wanting a cat in my house anymore?

There must be some limiting factor involved right?

This is a hell of a discussion by the way lol
--------------------------------

LegitimateShift8 @ 2021-02-05 09:42:32 :

Lol it really is. It’s funny that we’re this invested in scenarios from a movie that came out twelve years ago.

I’m sure there is a line though where I would think someone should try and find another way of escaping their fate. And for me this action was only justifiable when it comes to avoiding hell. If someone killed a cat to avoid going to jail for something they did, it’s wrong and I have no sympathy for them at all. But if someone killed a cat to avoid hell because a scorned gypsy cursed them, I’ll still think it’s wrong, but that’s more understandable. 

I always kind of have the mindset that you don’t necessarily have to agree with what someone did to understand why they did it. I wouldn’t like that someone killed their pet to avoid eternal damnation, but I’d understand *why* they killed their cat to avoid eternal damnation.",1430,"7","[{""rating"":1}]","NearEmu","","Ok, i see...

The only problem i have so far is that ""understandable"" has nothing at all to do with what is ""deserved""

I completely understand a man who beats another man bloody for groping his wifes butt.  I FULLY understand why a man would do that, but the man doesn't deserve to be beat half to death for something like that. We live in a society and we have to uphold society with guidelines.  We can't have people dishing out beatings for things that we *ALL* would perfectly understand *why* they did it right?  We as a single person in that society, do not get to dictate what is deserved, thats for society as a whole to do.  Equally, it's also not up to us to dictate what innocent lives die in order to save our own fate either, that's up to a power higher than us as well.

So what is understandable is often times not what is deserved, even if *I* FULLY understand why someone did something.

So if we don't have an actual limiting factor for what is worth killing innocents, to avoid fates, and if we also accept that 'understanding' someones actions does not necessarily *condone* or make them undeserving of consequences, I find it difficult to find any concrete stance I could accept for killing an innocent person, to save your own innocent fate.",0,"2024-05-21T07:34:33.526839Z","2021-02-05T09:48:06Z","[{""rating"":4}]","[{""rating"":6}]","[{""rating"":1}]","","[{""rating"":1}]","[{""rating"":1}]","[{""rating"":6}]",41199.472,1291755245.0,"[{""rating"":6}]","[{""rating"":5}]","","[{""rating"":1}]","https://www.reddit.com/r/changemyview/comments/ld2sq5/_/gm3lgmj/",1,"[deleted]","changemyview",4855832,"CMV: Christine Brown did not deserve her fate in the movie “Drag me to hell”","2024-05-21T07:34:33.526852Z","https://www.reddit.com/r/changemyview/comments/ld2sq5/cmv_christine_brown_did_not_deserve_her_fate_in/"
"Lazy_Trash_6297 @ 2023-12-14 16:51:16 :

I Know for me personally, my parents only really knew about the mixes. They didn't know about brands like Abuelita. If you haven't made hot chocolate from scratch before it can be intimidating, even if its really simple in actuality.  And I think if you've only had the powdered mix its hard to imagine what the other stuff is actually like.

I'm a fan of hot chocolate but I like the mix because i can get low-sugar varieties. I don't always want a really intense, rich beverage, sometimes I Just want something sweet.  

I see it being comparable to coffee drinks. Sometimes I want my fancy specialty latte order, sometimes I want a drip coffee with a little cream.",1435,"7","[{""rating"":1}]","Square-Dragonfruit76","","So what you're saying is that it is two things:

1) Lack of knowledge/education



2) Sometimes not being in the mood for something richer",0,"2024-05-21T07:38:04.327813Z","2023-12-14T16:56:21Z","[{""rating"":1}]","[{""rating"":3}]","[{""rating"":1}]","","[{""rating"":1}]","[{""rating"":5}]","[{""rating"":1}]",191.262,"","[{""rating"":1}]","[{""rating"":1}]","","[{""rating"":1}]","https://www.reddit.com/r/changemyview/comments/18iciz9/_/kdcay67/",11,"Every time I see hot chocolate made from cocoa powder it feels like a scam. Melted chocolate is richer and smoother. You can combine the two, sure, but the idea of simply having ""hot cocoa"" is strange, especially considering the point is to have a chocolaty drink.

The only reasons I can think of is that cocoa powder might be easier/cheaper to use, but I am talking about flavor for this CMV. Or maybe quality cocoa powder is easier to find than quality chocolate? Honestly IDK.

Why I want my view changed: I want to understand the appeal of hot cocoa, and why it is so popular.","changemyview",4855832,"CMV: Hot chocolate made from melted chocolate is better than made from cocoa powder.","2024-05-21T07:38:04.327828Z","https://www.reddit.com/r/changemyview/comments/18iciz9/cmv_hot_chocolate_made_from_melted_chocolate_is/"
