"ancestor_text","annotation_id","annotator","ap","author","author_id","body","controversiality","created_at","created_utc","dd","fm","gt","id","im","is","jc","lead_time","link_id","mc","md","parent_comment_id","pd","permalink","score","selftext","subreddit","subreddit_id","title","updated_at","url"
"bytor99 @ 2015-06-30 19:16:46 :

I think the biggest problem is that it's an incomplete philosophy. 

First, there is no basis for this philosophy. It makes the *assumption* that truth and love are the highest values possible, yet there is no backing for it. If life is a pre-requisite to truth AND love, shouldn't life be valued first? And should we not value freedom next, to let people pursue their own desires? In terms of truth, it makes sense for us to value that-- it allows us to gain more information about the world, and better develop moral decisions. But what about love? Love-- whether between friends, romantic partners, etc-- is a mutual agreement of sorts, a recognition to act in happiness and respect. Therefore, love comes from our values of 1) happiness (our friendships and relationships giving us more fulfillment, and our recognition that being an asshole to everyone makes us less happy) and 2) respect (our desire, or at least some people's desire, to be nice even when wronged). Love is not a PRIMARY value. 

Second, you give no means of deciding what IS truth and what IS love. Truth may be described as ""that which is with accordance of reality""-- but do we all witness the same reality? Perhaps there is an objective reality, but perhaps there is not. I have no way of knowing if we witness the same reality. It's all the same to me, and it SEEMS as if there is, but there are different truths to different people. A certain idea may speak to you, and improve your life, but not mine-- each person must thus be able to pursue *their own* truths. And perhaps there are some universal truths, but perhaps not-- that's something that has to be proved, not assumed. 

Looking at some of the examples--
&gt;But I must recognize that's true only to me, and I would be wrong to try persuading others of it, without evidence that might apply to them

Would you? Let's say there's religion A, and Jane Smith is a follower. And under the beliefs, if you do not believe in Religion A, you will suffer for eternity after death. Now, if Jane was convinced that religion A was true, even if Jane didn't have solid proof, wouldn't she be an asshole not to try to tell other people? I mean, she honestly believes that those people will suffer for eternity-- wouldn't it be loving to try to save them? You may argue that, of course religion A is wrong, and has no validity-- but in Jane's mind, it has PERFECT validity. 

This is an example of where definitions come into play. Where is the boundary for truth and love? Now, clearly, the answer would be for JANE to value truth more heavily, and pursue knowledge that her beliefs are unfounded-- but suppose *she believes* she has. Truth and love, then are in contradiction. 

Now, looking at the implications;

&gt;If homosexuality doesn't result in decreased love in the world, it's immoral to oppose two same-sex ppl forming a life together.

Why is the standard for immorality love? And why assume something is immoral unless it promotes love? If I go to the store and buy a few tomatoes with the intent to simply throw them away, there's nothing loving in that-- I don't intend to feed anyone. But I would argue that my choice is still moral because of *rights*. Which is another huge flaw in your philosophy- systems of love need systems of rights to gauge the *limit* of love. In my tomato example, it would be immoral, because no love would have been furthered-- but I think it's pretty clear that, since I agreed to buy the tomatoes, and the store agreed to sell them, nobody is being forced to do anything against their will-- both of us can continue happily.

&gt;Rape is wrong because it is an infringment on love

I actually think this is a good counterexample. A significant number of rapes are committed by a person the victim knows. Rapists may even be romantically in love with their victims-- in your world, this would be moral. Yet, because the RIGHTS of the victim are being infringed upon, in a horrible, inhumane, disgusting manner, it is one of the most immoral acts imaginable. 

To take another example-- gay conversion therapy. Say that John is gay, and his loving family, followers of Religion A, believe that he will suffer in eternity for it. Let's say they even have some evidence Religion A is correct. Out of love, they kidnap him, and force him into a gay conversion therapy camp in a third-world country. Such situations as these have been proven CONSISTENTLY to cause great psychological harm and trauma. Clearly, it is wrong to force John against his will to go to this camp-- yet his family, out of ""love"", has done it anyways. Shouldn't there be a recognition of rights? That John should be free to live his life how HE wants? The boundary would be, his family, out of kindness, tries to *persuade* him-- yet, morally, that is the furthest they can go without being immoral.

And last, the problem of war is one I think you cannot handle. Say Country A attacks Country B. Country B, acting purely in a system of love, would refuse to attack back, because violence isn't loving-- but, because self defense is an inherent right, I think Country B is right to stop aggression and defend itself. Under your philosophy, if even one country or person doesn't follow it, the others can be seriously harmed.
--------------------------------

JasonSilvermann @ 2015-06-30 20:05:52 :

I like where this is going and you make some valid points, my ""framework"" indeed has holes.

First, it seems my initial post didn't perfectly communicate my views, so I'll address some points where you understood a message I didn't mean to convey.

1.) You start out speaking about how Truth can't really be known, that even truth is subjective. If you're willing, I want to agree that a solipsistic view won't further the conversation, so I'd like to agree that Truth can be known. Or at least let's look at truth as a spectrum. Isaac Newton's physics are ""true"" given certain evidences, and Relativity is ""more true"" given other evidences, and quantum, and something beyond quantum may be even ""more true"" than that.

2.) You mention a few examples where an individual may hold some truth that is contrary with others (your ex: the lady who would be wrong to not proselytize her religion). My grid I drew out in my post addresses this (or at least I should hope it would). For example, if a parent is deeply religious and wants to undo their child's gayness, they would be wrong. Their religion, which is true to them, dictates gayness is wrong, and they're fine to hold that belief personally. But there's no evidence they could provide that would possibly persuade most people that being gay is wrong. (There is evidence that it takes a man and woman to make a baby and anyone would either have to agree with this, or choose ignorance/deceit. But there exists no evidence at this level of ""potency"" which supports/opposes being gay, or any religion). Does that make sense? I want the framework to allow individual ""truths""/beliefs, and also set a barrier between infringing on other's rights when that individual truth isn't universal. (for example, a creep may be obsessed with a girl, that's his personal truth, but if she doesn't reciprocate that love, it's wrong for him to rape her, he's infringing on her love/health/mental health).

3.) Defense in warfare. Ya, I don't know how my framework would address that. What would you recommend?

Hopefully that explains my ""framework"" a little better, any comments now that we're closer to being on the same page?
--------------------------------

bytor99 @ 2015-06-30 20:19:55 :

&gt;If you're willing, I want to agree that a solipsistic view won't further the conversation

Okay, that's fine, I think. I still don't understand why LOVE is particularly something you value. In my opinion truth is essential to figuring out the world and developing our sense of morals-- yet why love? As I point out above, valuing love comes from valuing other things (happiness, life, respect, etc) so love is a secondary value, not a primary one. 

&gt; But there's no evidence they could provide that would possibly persuade most people that being gay is wrong

Okay. Let's take another example, then. Say that John regularly consumes Big Macs and large sodas. Say this is a problem which is contributing to substantial health difficulties; John is frequently out of breath, and is gaining weight at an unhealthy rate. Surely this is enough evidence to convince most people that it would be in John's best interest to not consume Big Macs and soda any longer. John's family takes this evidence, and sends him, against his will, away to a ""healthy eating"" camp, where he is forced to stay, against his will. He definitely benefits from eating healthier, yet his autonomy and individual choices are being destroyed. 

You may criticize this for being too extreme an example, yet 1) it shows your philosophy DOES have holes, 2) it shows your philosophy doesn't recognize RIGHTS which is a basis for society, and 3) I would bet most people have some unhealthy behaviors (eating cake, alcohol, etc), and even if they do not take it as far as John in this hypothetical example, it would still open up the possibilities.

Moreover, going back to the example of the gay conversion therapy-- suppose it was 1950. Most of the evidence then DID claim there to be some problem with homosexuality, and most of the people in America would've supported endeavors such as gay conversion therapy. Would that have justified the hypothetical family's actions? I would say no, because the element of FORCE is what makes their actions wrong.

&gt;Defense in warfare. Ya, I don't know how my framework would address that. What would you recommend?

I would recommend holding AGGRESSION as a wrong. For your framework to be more sophisticated, you have to have an ultimate gain. You want to try to minimize the assumptions you're making and try to explain the world in as few logical leaps as you can. So rather than straight assuming truth and love are to be desired, why not value life first? After all, the purpose of your framework is for living your life-- it makes sense to begin there. From life, you can look towards truth as a means of furthering your understanding of life and the moral framework. From there, we can determine why any aggression is wrong-- it is destructive to the values of life and truth TOGETHER. If we value life, we should seek not to destroy our value. But, let's say a thief attempts to kill me in the streets. They have not abided by a respect of life. I surely want to maintain a respect to life, so I attempt not to kill the thief in defending myself, yet to continue MY life, I may very well have to defend myself. Yet I am no longer using force to impose my will on another person, I am using force to stop a person from attempting to impose their will on me.",1548,"7","[{""rating"":2}]","JasonSilvermann","","I like where this is going, and I hope my rebuttal doesn't sound argumentative, because I agree with a lot of your points.

1.) Big Macs example - it is possible to have unhealthy habits/addictions, so first, I'd argue that John is committing ""unlove"" against himself by not fixing those habits. Secondly, are his parents justified in correcting the behavior against his will... My framework, in it's current state, mildly addresses this saying that there are universals truths and personal ones. I say that one should not proselytize/force their personal beliefs, maybe they shouldn't enforce universal ones either? But then how could you justify imprisoning a criminal (which I think is justifiable, it maximizes love towards the criminals future victims)?

2.) 1950s homosexuality, most evidence was against gays. This is indeed another difficult situation. The evidence wasn't arrived by through honest scientific/experimental means (I'm assuming). Since the evidence wasn't truthful, it shouldn't hold weight. We have similar problems today in the healthcare industry. Misinformation abounds in pharmaceuticals, alternative medicines, diet, exercise, etc. I would say that just because somethign is published in a journal, or had an experiment done, doesn't make it a truth.

3.) I like that, I agree that force shouldn't be used against people in most situations. Defending yourself is ok. But what about using force in, say, apprehending a criminal, or even non aggressive force like grounding a child, or putting a child in school detention?",0,"2024-05-21T08:45:04.958937Z","2015-06-30T20:37:28Z","[{""rating"":1}]","[{""rating"":7}]","[{""rating"":1}]","","[{""rating"":1}]","[{""rating"":1}]","[{""rating"":1}]",137.82,200985634.0,"[{""rating"":1}]","[{""rating"":6}]","","[{""rating"":7}]","https://www.reddit.com/r/changemyview/comments/3bntia/_/csny9zt/",0,"It's time for me to stop believing that organized religion is the source of moral truth, and recognize that humans are innately moral, and religion often struggles to keep pace.

Therefore I've tried to develop a moral guidebook that is foundational, and universal - a framework that can address the morality of any issue. How could it be improved?

**TL;DR**

|  | **Truth** | **Love** |
|-----------|----------------------------------------------|---------------------------------------------------------------|
| **Universal** | Majority would agree | Majority recognize it as love |
| **Me** | True to me (I can't preach to others though) | It's my way of getting/giving love (again, I can't preach it) |


So this says that the only 2 virtues are things that maximize Truth, and Love. These things either apply universally, or apply to me (so I would be wrong to proselytize them, since they only apply to me). The intent is to analyze any proposed moral question through the lens offered in each quadrant of the graph.

--------------------------------------------------

**Longer Explanation**

Ex:

*Does God exist*?

* **Universal Truth** - Is there evidence that I could supply to anyone and they would more or less have to agree that God exists? Is there falsifiable evidence that God exists? No, so no universal truth to be found here. Therefore it would be immoral for me to proselytize otherwise.

* **Personal Truth** - Do I want to believe in God, maybe because i had a special experience? Yes? Then that's fine. But I must recognize that's true only to me, and I would be wrong to try persuading others of it, without evidence that might apply to them.

* **Universal Love** - Does a belief in God *necessarily* maximize Love in the world? (Notice one must be careful to not ask if the trappings of religion maximize love, such as social causes, but if the belief itself maximizes Love). If I can think of instances where a belief in God results in murder or bigotry, then I must concede that no, a belief in God does not maximize Love.

* **Personal Love** - Do I feel more love for myself, and for others if I believe in God? If yes, that's fine, I must however not proselytize this until I have persuasive evidence that would apply to most people universally.

--------------------------------------------------

**Implications** (or things I think are implied by this framework)

* If homosexuality doesn't result in decreased love in the world, it's immoral to oppose two same-sex ppl forming a life together.

* If I can't supply an honest person with evidence of Christianity, it's immoral (and annoying) for me to try

* If vaccinations are truly causing disease, and anyone has to agree with the evidence, then it's immoral to continue administering them. If avoidance is actually *causing* more disease, it's immoral to not administer them.

* If I can supply evidence that any honest person would agree implies a billions-of-years old universe, then it's immoral against truth to try to persuade others differently.

* Rape is wrong because it is an infringment on love

* Pot smoking is fine, as long as you don't drive high or neglect important things in your life

* Alcohol consumption is morally fine

Forgive that these are my views, which you may disagree with, they are just attempts at interpreting a framework I hope to refine into being ""universally true"". Criticize the framework, or my misinterpretations of it. No flame wars though.

--------------------------------------------------

**Potential Problems** (i'm not sure how to interpret them)

* Prostitution - it leads to more disease, and maybe an unhealthy outlet for the cravings we have to get ""Love""

* Incest - again, leads to disease in children, but it is a realization of Love

* Getting drunk is a grey line because it's infringing on love towards yourself, and your own health, not to mention those you love if you have a drinking rage

* Hard drug usage, or mandated banning the drugs of abuse

* Do-Not-Resusitate patients

* Giving medical treatment to a murderer

* Protecting oneself in aggressive situations, such as muggings, or war.

_____

&gt; *Hello, users of CMV! This is a footnote from your moderators. We'd just like to remind you of a couple of things. Firstly, please remember to* ***[read through our rules](http://www.reddit.com/r/changemyview/wiki/rules)***. *If you see a comment that has broken one, it is more effective to report it than downvote it. Speaking of which,* ***[downvotes don't change views](http://www.reddit.com/r/changemyview/wiki/guidelines#wiki_upvoting.2Fdownvoting)****! If you are thinking about submitting a CMV yourself, please have a look through our* ***[popular topics wiki](http://www.reddit.com/r/changemyview/wiki/populartopics)*** *first. Any questions or concerns? Feel free to* ***[message us](http://www.reddit.com/message/compose?to=/r/changemyview)***. *Happy CMVing!*","changemyview",4855832,"CMV: Is this moral philosophy missing anything? Love + Truth","2024-05-21T08:45:04.958949Z","http://www.reddit.com/r/changemyview/comments/3bntia/cmv_is_this_moral_philosophy_missing_anything/"
"",1549,"7","[{""rating"":1}]","sangbum60090",21932791.0,"The real problem everyone talking about was that how it was so rushed rather than how she went evil. It would've been better if they dedicated an entire season on her descent to madness.",0,"2024-05-21T08:45:58.397920Z","2019-05-27T22:48:42Z","[{""rating"":1}]","[{""rating"":1}]","[{""rating"":1}]","","[{""rating"":1}]","[{""rating"":1}]","[{""rating"":1}]",52.773,715160431.0,"[{""rating"":1}]","[{""rating"":1}]","","[{""rating"":1}]","https://www.reddit.com/r/changemyview/comments/btsdbj/_/ep1vv20/",19,"So, go away if you have not seen the latest season. Just go. 

So, in my view the big twist of Danny going ""evil"" was well done and amazing. I also believe this is what will happen in the books (probably better written and the details changed, but end result the same). I'm going to preface this by disclaiming that, while I liked season 8, it has it's flaws. Deep flaws. Dudes don't know how to plan a battle for shit. And can't remember about fleets. 

Anyway, so Danny burned Kings Landing. If you remember when Danny took Slavers Bay the slaves actually helped her. They welcomed her as a messiah like character because she broke their chains. She also was ruthless to the Slavers, burning and killing them. Sacking their cities and killing the nobels. We all cheered for her at the time, but that was just a mask for her brutality. The books have it very similar, where Danny utterly destroys those that appose her. Just for the most part those that appose her at first are evil. 

Now Season 6, Danny moves past the books and we no longer have a point of reference to know if this is the same as what GRRM has planned. Season 6 has Danny burn the leaders of the Dothraki because of what they have done. How they treat their wives and send them off when the leader dies. She killed all of them and took over as leader. We cheered because these men were evil, but this is another example of her anger and wrath. 

So she then moves to Westeros and begins her war. She takes Casterly Rock but is out done by Jamie. In response she uses her dragon to burn the army, killing many in a mass slaughter. On top of this she takes her prisoners, and if they don't kneel burns them alive. I believe this scene was supposed to the the ""wait, Danny, you are going to far"" scene. 

Personally, I feel like for the show to be well done we had to believe Danny was good right up until the end. The hints that she might go to such lengths needed to be buried, so that we would not see it coming. Just like the red wedding was a large surprise and we only figured it out in retrospect, so to is how this was supposed to be. 

Danny finally gets to King's Landing, at the start of her journey south it has already cost her one dragon and many of her (respawn capable) Dothraki and Unsullied. She has lost one of her best friends. She has had to endure the north refusing to kneel and treating her with hostility. (Side note I like that Sansa refused to kneel and think it's crazy that the North should trust her even if Danny helped fight the Nights King. The White Walkers were a threat to everyone so Danny was just doing herself a favor). 

So Danny finally heads to King's Landing, having lost so much already and feeling unwanted. The she looses another dragon and her best friend. On top of that her spymaster has betrayed her, Jon is found to be her nephew and has a better claim on the throne, and Jon won't return her affection. She feels alone and rage. The city gives in, but to easily. The people don't want her, and so she finally decides to rule by fear. Make an example of Kings Landing so no one else will ever cross her. 


Anyway, let me know your opinions!","changemyview",4855832,"CMV: I liked the twist in Season 8 of Game of Thrones (Spoilers)","2024-05-21T08:45:58.397936Z","https://www.reddit.com/r/changemyview/comments/btsdbj/cmv_i_liked_the_twist_in_season_8_of_game_of/"
"SaintNutella @ 2019-06-21 05:31:03 :

&gt; Humans, animals (including humans), plant, and everything else(bacteria, fungi, protozoa ect) and are living, all feel there form of pain

This is not true or accurate. To start, just because one is living does not mean they can feel pain. Emotional or physical. The gametes in my body for example do not *feel* pain. Also, living things such as plants or bacteria lack the nervous system to actually have their sensory neurons produce the feeling of pain.

&gt; We all can think(in our own way), can feel it when where hurt, 

You need a brain or some sort of form of a brain to be able to think or do any cognitive actions. Bacteria are incapable of thinking. 

&gt; Why is it that humans think there superior?

We believe we're superior because we're the most intelligent *by far* and can also have the greatest impact on the earth.

&gt;  There brain? Sure, where smarter then everything else, but are we so superior that they deserve to have no rights; to be killer without much consideration? 

Well you would have to consider the alternative of killing each other for food, which is destructive to the species committing cannibalism.",1551,"7","[{""rating"":1}]","The_Traveler42","","Okay, I admit maybe giving bacteria rights is a little far. But, plant produce chemical signels that act like a pain response, DESPITE the fact they don't have a brain. Also, our impact from our ""mighty brain"" has been entirely negative, not nearly every specis other than our own. The sheer number if specis we have driven to extinction is emourmous, and if we continue down out global warming path, it will be much; MUCH greater",0,"2024-05-21T08:47:44.075367Z","2019-06-21T05:34:48Z","[{""rating"":1}]","[{""rating"":5}]","[{""rating"":1}]","","[{""rating"":1}]","[{""rating"":1}]","[{""rating"":1}]",105.073,730910199.0,"[{""rating"":1}]","[{""rating"":1}]","","[{""rating"":7}]","https://www.reddit.com/r/changemyview/comments/c35xx3/_/erp1129/",1,"Humans, animals (including humans), plant, and everything else(bacteria, fungi, protozoa ect) and are living, all feel there form of pain, and yet have no rights, other than humans, and some animals and plants. We all can think(in our own way), can feel it when where hurt, and deserve to be treated equal. Why is it that humans think there superior? There brain? Sure, where smarter then everything else, but are we so superior that they deserve to have no rights; to be killer without much consideration? And yet, when you apply this to humans, everyone gets angry (not defending any of it. I don't support ethnic purges or anything, just making a point). When you step on grass, it ""feels"" that and it ""hurts"". Why can we have lawns of grass but not humans? Why do WE deserve rights, but not them!

I admit this probably is a bad way to see it. After all, it's implausible to give rights to the bacteria floating in the air. Can some explain how I'm wrong though?(besides the utter implausible of implementing any-such systems)

View changes:
I have realized it is entirely impossible to implement regulations for these, as they would be VERY hard to enforce, and almost no one would support them

I have admitted giving bacteria and other microscopic life rights is rediculess. They are too different to us for us to understand them, and therefore it would be impossible to give the appropriate rights to them.","changemyview",4855832,"CMV: all living things are equal","2024-05-21T08:47:44.075379Z","https://www.reddit.com/r/changemyview/comments/c35xx3/cmv_all_living_things_are_equal/"
