"ancestor_text","annotation_id","annotator","ap","author","author_id","body","controversiality","created_at","created_utc","dd","fm","gt","id","im","is","jc","lead_time","link_id","mc","md","parent_comment_id","pd","permalink","score","selftext","subreddit","subreddit_id","title","updated_at","url"
"Cyberpunk_Is_Now @ 2016-11-30 20:02:20 :

If something isn't a punishable offense, then it's not an offense.

If it wasn't an offense, then people could disrupt the right to a speedy trial by constantly disrupting the proceedings of the courtroom. That would be a *bigger* waste of public resources in the aggregate.
--------------------------------

fauxonly @ 2016-11-30 20:45:50 :

Wouldn't that fall under the category of interference? I guess my title was but I specify in my post I'm only arguing against ""disrespect"". 
--------------------------------

Cyberpunk_Is_Now @ 2016-11-30 21:00:34 :

Disrespecting them is, by definition, interfering with the court proceedings.

IANAL, but I don't think you can be found in contempt of court while court isn't in session. It's specifically the act of disrupting the court with your disrespect that (it seems to me) the crime of ""contempt"" is actually dealing with.",1451,"7","[{""rating"":1}]","fauxonly","","I will have to do some more research into how exactly this law is applied but it still seems the principle of it is off by allowing disrespect. Suppose someone says during a recess that the judge is a cowardly bitch. Could the judge view that as disrespect? It certainly wouldn't interfere with court proceedings. ",0,"2024-05-21T07:46:06.833915Z","2016-11-30T21:17:46Z","[{""rating"":1}]","[{""rating"":5}]","[{""rating"":1}]","","[{""rating"":2}]","[{""rating"":1}]","[{""rating"":3}]",214.819,328803682.0,"[{""rating"":1}]","[{""rating"":4}]","","[{""rating"":1}]","https://www.reddit.com/r/changemyview/comments/5frejm/_/damm9xw/",1,"From justice.gov

&gt; Contempt of court is an act of disobedience or disrespect towards the judicial branch of the government, or an interference with its orderly process. It is an offense against a court of justice or a person to whom the judicial functions of the sovereignty have been delegated.

In this, I have no issue with punishing disobedience or interference. These seem like reasonable restrictions made to ensure that the justice process unfolds quickly. However, it seem juvenile to punish someone (a recent case had 180 days for calling the judge a ""cowardly bitch"") for an action that does nothing bad except for potentially hurting the judge's feelings - an action that would not be a crime in any other scenario. It is a waste of publish resources (in the referenced case, 6 months of prison time) to punish someone for something that does so little harm to society. It seems to have a large potential for abuse, in the common case that the judge is both the target of the disrespectful statement and the arbiter of the punishment. ","changemyview",4855832,"CMV: Contempt of court should not be a punishable offence.","2024-05-21T07:46:06.833928Z","https://www.reddit.com/r/changemyview/comments/5frejm/cmv_contempt_of_court_should_not_be_a_punishable/"
"",1454,"7","[{""rating"":1}]","ElfMage83","","No. Blood just wants to flow along a path, and if the path is closed by a clot then it still flows as best it can to wherever it needs to be. There are valves in blood vessels that keep blood flowing only in one way, such that it (normally) *can't* flow against the current. If it ever did, you'd be weak and sick from lack of oxygen.",0,"2024-05-21T07:47:23.125091Z","2017-08-15T05:00:39Z","[{""rating"":1}]","[{""rating"":5}]","[{""rating"":1}]","","[{""rating"":1}]","[{""rating"":1}]","[{""rating"":1}]",50.093,412817153.0,"[{""rating"":1}]","[{""rating"":1}]","","[{""rating"":1}]","https://www.reddit.com/r/explainlikeimfive/comments/6ts3r5/_/dln32na/",6,"","explainlikeimfive",4697437,"ELI5: When blood coagulates and stops the bleeding from a wound, what happens the blood flow behind it? Does it turn around and flow back upstream?","2024-05-21T07:47:23.125105Z","https://www.reddit.com/r/explainlikeimfive/comments/6ts3r5/eli5_when_blood_coagulates_and_stops_the_bleeding/"
"YetAgainIAmHere @ 2022-12-20 16:48:46 :

Is it okay to buy anything or any service from anyone whose in direct danger due to their lack of capital?

Isn't that the entire point of paying someone minimum wage? They lre in direct danger of being homeless and not eating so they have to work for whatever you give them. 

If this is acceptable in minimum wage jobs, or when buying buying and selling goods/services, why is buying sex so inherently different?
--------------------------------

UntakenAccountName @ 2022-12-21 02:19:23 :

Wage labor has many ethical problems. There’s a reason it’s colloquially known as “wage slavery”—and two wrongs don’t make a right.  

Just because one person is forced to submit themself to a bad employment situation doesn’t mean that we should force someone else to submit to a different bad employment situation. And most wage labor has regulations and protections in place to prevent harm, sex work is inherently degrading, dehumanizing, cruel and harmful.  

How would our workplace laws even begin to regulate sex work? There’s no real way to mitigate the STD risk, there’s no real way to mitigate the PTSD risk, there’s no real way to mitigate the violence/aggression/stalking/etc risk, I mean… it’s really bad work, let’s be honest.
--------------------------------

Prinnyramza @ 2022-12-22 00:59:08 :

Regular STD screenings from both workers and customers in advance.

PTSD from consensual sex? 

I think you are confusing illegal prostitution which is what we have now with legal prostitution.
--------------------------------

UntakenAccountName @ 2022-12-22 01:52:33 :

&gt;Regular STD screenings from both workers and customers in advance.  

Already occurs and already doesn’t work because people can catch STDs/STIs in the interval. Porn has a huge problem with this exact issue.  

&gt;PTSD from consensual sex?  

So many ways this can happen. Are you seriously suggesting that people can be traumatized (even unintentionally) by consensual sex? Let’s say a sex worker is working and a client suddenly says or does something traumatic/triggering for them. Even if the client didn’t intend to cause harm, it can happen. I’m just shocked that your point here seems to be that trauma during consensual sex is an impossibility or something. Like what?

&gt;I think you are confusing illegal prostitution which is what we have now with legal prostitution.  

So stripping and dancing (etc) is legal. Why do they have stalking, assault, violence, and similar dangerous problems?
--------------------------------

Prinnyramza @ 2022-12-22 02:12:25 :

Anything can be accidentally triggering. Therapy isn't required for all work.

Also wait, do you think porn and stripping should be illegal?
--------------------------------

UntakenAccountName @ 2022-12-22 02:43:28 :

&gt;Anything can be accidentally triggering. Therapy isn't required for all work.  

But we do have laws, regulations, and health and safety organizations to prevent as much of that sort of thing (and other harms) as possible. Typical jobs can’t suddenly become violent rape/assault.  

&gt;Also wait, do you think porn and stripping should be illegal?  

Stop trying to set up straw man arguments for yourself. Why don’t you answer the line we were following: You claimed legal prostitution wouldn’t have problems like violence/aggression/stalking/etc, I asked you to explain why similar legal industries like stripping, dancing, etc have those problems. And please realize that prostitution involves more vulnerability, proximity, and risk than what currently exists.
--------------------------------

Prinnyramza @ 2022-12-22 11:48:05 :

No you brought it up. You're claiming that any sexual act is instantly corrupted by money AND that porn stars and stripping suffer for the exact same reasons you believe prostitution shouldn't be legalized.

So you believe porn and stripping should be illegal which most people won't get behind.
--------------------------------

UntakenAccountName @ 2022-12-22 15:53:23 :

“And please realize that prostitution involves more vulnerability, proximity, and risk than what currently exists.”  

Pornstars are supposed to have protections to keep the industries safe. Strippers are supposed to have protections to keep the industries safe. Sex work and porn are inherently “rapey” in my honest opinion. How can you have sex with someone while knowing that they wouldn’t be doing it if they weren’t getting paid?  

As the world is right now, too much of all three of those industries look like financial coercion and physical abuse—and worse.  

The sex industry’s existence leads to human trafficking and sex crimes, mainly against poor and/or migrant women, who are largely off the radar, even in big op ed pieces and mainstream criticisms. These victims are very real and they exist in large part because of society’s acceptance of the industry. It’s not a matter of personal freedom or consenting adults  when there are hidden victims and the activity goes beyond two people’s sex lives.  

https://fightthenewdrug.org/10-porn-stars-speak-openly-about-their-most-popular-scenes/  

https://amp.theguardian.com/commentisfree/2019/aug/15/why-are-people-silent-about-the-abuses-and-exploitation-in-porn  

https://amp.washingtontimes.com/news/2021/oct/26/former-porn-stars-recall-industry-abuses-struggles/  

https://camdencivilrightsproject.com/2016/01/28/former-porn-star-lisa-ann-says-increased-demand-for-abuse-porn-tends-to-break-you-down-as-a-woman/  

Look of the list of pornstars who now speak out against porn:  
Lisa Ann  
Lana Rhoades  
Mia Khalifa  
Randy Spears  

So, so, so many more.  

And you’re led to believe the money is good and the jobs are good because of that, but that’s not even true. Most pornstars live in poverty. Even mainstream ones are frequently living under poverty limits.
--------------------------------

Prinnyramza @ 2022-12-22 16:49:42 :

I dunno why you are using so many words to just say you believe stripping and porn should be illegal.

It really feels like you are avoiding saying it out right because you know the idea is so unpopular.
--------------------------------

UntakenAccountName @ 2022-12-22 19:20:35 :

I don’t even think that wage labor should be legal. You’re barking up the wrong tree here.  

Can people produce porn ethically: yes. Can people strip ethically: yes. Can people engage in sex work activities ethically: yes. Is it inherently rapey and problematic under our current economic and social systems: yes.  

I’m not saying that any of the things should be illegal in an absolute sense, but I am saying that how they exist today is harmful, dangerous, and inherently violent/exploitative.  

I’m all for sexual liberation, but to me that doesn’t include putting it under the yoke of money and financial control.  

I think most people grapple with these issues because they see that what’s going on is dangerous/harmful/exploitative/etc, but they have an intuitive sense that it doesn’t have to be and could exist ethically; and further, that ideals of personal liberty and freedom insist for it to one day exist in such ethical ways.  

But our current economic and social systems aren’t that utopic future, and acting like we should be reasoning from that world and supporting personal liberty/freedom while we live in a world of financial control and domination is dangerous and harmful. And even if one individual is able to ethically engage in those industries, the industries’ mainstream existence will provide a hiding place for harmful illegal and violent forms of human trafficking and sex crime.  

We make laws and policies for our world, while trying to get to a better world; we don’t make laws and policies for a utopian world and hope for the best.
--------------------------------

Prinnyramza @ 2022-12-22 20:00:09 :

Ah so you're an anarchist who is trying to use the idea of rape to disencourage legalized prostitution eventhrough you can't logical separate it from already legal sex work such as porn and stripping
--------------------------------

UntakenAccountName @ 2022-12-22 22:24:04 :

…I’m not an anarchist though? Not an anarchist at all. Anarchists annoy me. You really gotta stop arguing against your own versions of what other people say to you. You keep doing it in this thread. Look up the principle of charity. What you’re doing is dishonest and rude, and unlikely to lead to real debate/dialogue.",1467,"7","[{""rating"":1}]","Prinnyramza",31798423.0,"Alright communist then. And just to let you know I don't have any inherent issues against anarchist or communist.

Basically you have an issue against wages in general. That is what you said. And you can have that stance, but that's not the topic at hand.

That might be the topic you want to discuss. You can make a post for that but that's not the topic that OP presented. 

You have consistently failed to able to separate prostitute from currently legal sex work and have even admitted to feeling the same about porn then you do about prostitution. 

With that anyone who believes that porn should be legal or anyone who believes in wages isn't going to agree with your assessment.",0,"2024-05-21T07:56:58.877873Z","2022-12-22T23:05:33Z","[{""rating"":3}]","[{""rating"":4}]","[{""rating"":1}]","","[{""rating"":1}]","[{""rating"":5}]","[{""rating"":1}]",438.031,"","[{""rating"":1}]","[{""rating"":1}]","","[{""rating"":1}]","https://www.reddit.com/r/changemyview/comments/zqh45p/_/j1av768/",1," I live in a developed west european country, and I frequently visit the foreign sex workers here. I don’t see anything wrong with it, ethically speaking. Every girl ive seen has spoken english, and appeared to be healthy, comfortable, and in charge of their own business. In my country human trafficking is quite rare according to statistics, so i assume i have never bought sex from a trafficked person. That’s why I’m mostly okay with what i’m doing, with some occasional, minor doubts. Im not rich and that’s why i don’t buy sex nearly as often as i would want to.

The places i don’t go to are those ”thai-massage” places. I know for a fact that i could get my dick wet in those places paying something like half of what i pay to other escorts. But i also know that the girls in those places are trafficked, more often than not. Why the police here does nothing about those places, i don’t know. Maybe it’s just legally difficult. 

Here i see where i seem to have drawn the line. Im okay with the fact that a woman is selling herself, and I’m the buyer, as long as its her decision, and the decision is not based on life and death circumstances. What then constitutes a life and death circumstance for me? Lack of security, food, shelter, basic necessities which we all need in life to survive. 

If some ice princess from Czech Republic would rather have sex with me than go to work in a factory back where she comes from, getting a salary that is indeed low but that would get her all of the basic necessities she needs, that’s fine by me. If some girl from Thailand would rather have sex with me than starve, then that’s not okay with me. I’m not saying she shouldn’t do it, i’m saying she needs to find an another customer, because i’m not touching that situation with a ten-foot pole.","changemyview",4855832,"CMV: Buying sex is ethically okay, as long as the person you are buying it from is not in direct danger caused by their lack of capital. Selling sex is always ethically okay.","2024-05-21T07:56:58.877886Z","https://www.reddit.com/r/changemyview/comments/zqh45p/cmv_buying_sex_is_ethically_okay_as_long_as_the/"
"dale_glass @ 2018-09-19 19:06:47 :

I see three problems here.

1. The amount of people who are actually interested in engaging in ritual combat to settle a dispute is actually very small. I'm male, pretty buff, and in all my life I've never even thought of settling a dispute by ""Let's put on some gloves and settle this like gentlemen"".
2. Domestic abuse is... abuse. It's pretty much by definition a situation in which the normal rules have failed, and at least one of the parties has decided to dispense with all sense of decency and to beat the shit out of the other party. Even if originally both would be willing to engage in some ritualized combat in the general sense, we're talking about very heated situations in which it's unrealistic to expect somebody to cool down, arrange a battle, and then stick to the rules.
3. Psychologically, it's unhealthy. Research says that venting your anger isn't actually a good thing. Beating your enemy feels good and makes you want to do it again. That doesn't make for a healthy relationship.
--------------------------------

MentalSewage @ 2018-09-19 19:31:16 :

So far you've come the closest to changing my mind.  

1. I think that's because as a society, we have decided that combat is barbaric and only tend to allow violent response after pushed past the point of thinking clearly.  That means once a situation becomes violent, people are usually unsure how to conduct themselves reasonably because they think violence is the antithesis of reasonable.  In reality, the two concepts are totally independent. 

2. I suppose an ongoing ritual combat would break down over time with an abusive person, and devolve into actual abuse.  I suppose my main hope was that by handicapping the individuals, the would be victim of abuse would be able to take the would be abuser down a peg on occasion.

3. I'd like more information in this research.  While I can see that as the case in some cases, getting beat I would think is a deterrent from wanting to do it again.
--------------------------------

dale_glass @ 2018-09-19 19:51:54 :

&gt; I think that's because as a society, we have decided that combat is barbaric and only tend to allow violent response after pushed past the point of thinking clearly

Okay, but why combat? Most couples are made of a man and a woman, and men have the overwhelming physical advantage in combat. Me, with my regular gym attendance, would need to be paired up by a professional female fighter, and even then I think I would have excellent chances if it ever came down to a contest of strength, which seems pretty likely. It would make for an extremely unfair fight, practically all the time. Boxing has weight classes precisely for this reason.

But there's a more important problem, and it's this: combat, done in any way at all, has nothing to do with the underlying dispute. Suppose I claim the world is round, and my opponent says it's flat. Suppose they are able to win by being a mountain of muscle. How does the ability to fight have anything to do with the actual disagreement?

We could pick a non-physical contest, but the problem would remain. If one side wins by being better at the contest, it's unrelated to the disagreement. If one side wins basically at random because they're about even, you might as well just throw a coin.

&gt; I suppose an ongoing ritual combat would break down over time with an abusive person, and devolve into actual abuse. I suppose my main hope was that by handicapping the individuals, the would be victim of abuse would be able to take the would be abuser down a peg on occasion.

And why would an abusive individual consent to being handicapped?


&gt; I'd like more information in this research. While I can see that as the case in some cases, getting beat I would think is a deterrent from wanting to do it again.

[Here for example](https://www.psychologytoday.com/us/blog/overcoming-destructive-anger/201705/should-you-visit-anger-room)

Yes, but winning is an incentive to want to do it again. Whoever loses will have an incentive to stop arguing, and whoever wins will have a lot of leverage to get their way. ""You want a black eye in the ring again? No? Then we're getting pizza.""


--------------------------------

MentalSewage @ 2018-09-19 19:59:03 :

I completely agree it doesn't determine who it right, it's meant to vent hostility to ensure it never goes to the point of full on violence.  And assuming proper handicapping I don't see how it could be used as a threat.  At best a challenge.

As for why somebody would follow along, because clearly too many couple enjoy hitting each other.  And if they have the opportunity to hit each other knowing they wont actually hurt each other, wouldn't be judged, and wouldn't be arrested, they can get their licks in at each other and feel better without either of them getting hurt, I think you'd be pretty hard pressed to find a couple that fights a lot that WOULDN'T take you up on that.",1480,"7","[{""rating"":1}]","dale_glass",11740160.0,"&gt; I completely agree it doesn't determine who it right, it's meant to vent hostility to ensure it never goes to the point of full on violence. 

But why actual violence? Why not ritual combat by FPS, for instance?

&gt; And assuming proper handicapping I don't see how it could be used as a threat. At best a challenge.

And how would that work, exactly? I mean, I could say, wear a bunch of weighted clothing. But that weight only really applies downwards, I can overcome it for at least some time, I could use it to my advantage, and if I get somebody in a headlock it's not going to do a whole lot to diminish my muscular strength. It may even augment it.

Say, making me wear a heavy glove is only going to make everything worse, because F=MA. With more mass in my fist I can punch proportionally harder. It'll wear me out sooner of course, but if I manage to land a hit early it's going to hurt a lot.

&gt; As for why somebody would follow along, because clearly too many couple enjoy hitting each other. 

I very highly doubt it. People do get into extremely unhealthy dynamics, but I'd bet that after the relationship is over, the vast majority of such cases decides it wasn't fun in the slightest.

",0,"2024-05-21T08:01:22.409183Z","2018-09-19T20:12:46Z","[{""rating"":2}]","[{""rating"":7}]","[{""rating"":1}]","","[{""rating"":1}]","[{""rating"":1}]","[{""rating"":1}]",253.521,573107628.0,"[{""rating"":2}]","[{""rating"":4}]","","[{""rating"":1}]","https://www.reddit.com/r/changemyview/comments/9h7ooc/_/e69ym6v/",1,"EDIT: I misspoke, I don't mean ongoing abuse but heated arguments that result in violent acts eventually leading to a situation of domestic assault.

I don't mean this comically, but genuinely (albeit half baked).  What I mean is a set of rules like you would find in boxing that keeps violence from being overly dangerous.  For one thing, weight handicapping to make up for size differences.  A 6'4"" 300lb person vs a 5'3"" 120lb person is inherently one sided, so the larger individual would need to limit all combat to, say, on their knees with padded gloves.  While this would be technical and require some in-depth thought that I haven't quite put into it, what I've realized with going to a boxing gym that having a way to vent aggression aggressively but safely REALLY helps.  A friend of mine and I recently got into an argument and pulled out the boxing gloves.  We never decided who was right, but we got our hits in and apologized to each other.

This would also work to stop cases of men being victims but being arrested simply because they are men.  By having laws on the books with regards to the combat, I feel like it would remove the assumption that it was the man's fault AND doesn't even require police intervention unless it went too far, in which case it's clearly whoever broke the rules.

The last point I think this would help with is empowering people in general.  Many think violence only tears down people weaker, but in a way it also empowers the weaker person if the stronger one has to handicap in order to be within the law.  Clearly the extremely violent cases wouldn't listen to the rules and the problem remains the same while also clearly the couples who are genuinely reasonable have no use for it, but what I would wager is the vast majority of domestic abuse cases could do with some reasonable aggression but safely.  Instead of anger boiling over and one party throwing a punch they regret and it permanently damaging the other person or the relationship, they can remember that they have gloves and rules to allow the situation to get physical.

I feel like this could also reduce the amount of emotional abuse, as at least some would choose to dawn the gloves instead.

_____

&gt; *This is a footnote from the CMV moderators. We'd like to remind you of a couple of things. Firstly, please* ***[read through our rules](http://www.reddit.com/r/changemyview/wiki/rules)***. *If you see a comment that has broken one, it is more effective to report it than downvote it. Speaking of which,* ***[downvotes don't change views](http://www.reddit.com/r/changemyview/wiki/guidelines#wiki_upvoting.2Fdownvoting)****! Any questions or concerns? Feel free to* ***[message us](http://www.reddit.com/message/compose?to=/r/changemyview)***. *Happy CMVing!*","changemyview",4855832,"CMV: Domestic Abuse (physical) would be less prevalent with a set Rules Of Combat","2024-05-21T08:01:22.409196Z","https://www.reddit.com/r/changemyview/comments/9h7ooc/cmv_domestic_abuse_physical_would_be_less/"
